BANK,IFSC,MICR,BRANCH,ADDRESS,CONTACT,CITY,DISTRICT,STATE
"ICICI BANK LIMITED",ICIC0001279,700229078,"KOLKATA - HAJRA, WEST BENGAL","ICICI BANK LTD ,17,S P MUKHERJEE RD,KOLKATA-700025",0,KOLKATA,KOLKATA,"WEST BENGAL"
"ICICI BANK LIMITED",ICIC0001278,700229075,"KOLKATA - NETAJI NAGAR, WEST BENGAL","ICICI BANK LTD., 184 NSC BOSE ROAD,  KOLKATA - 700040, WEST BENGAL",0,KOLKATA,KOLKATA,"WEST BENGAL"
"ICICI BANK LIMITED",ICIC0001277,700229055,"BELIAGHATA, KOLKATA","ICICI BANK LTD., 12, HEMCHANDRA NASKAR ROAD, BELIAGHATA, KOLKATA - 700010, KOLKATA DIST., WEST BENGAL.",0,KOLKATA,KOLKATA,"WEST BENGAL"
"ICICI BANK LIMITED",ICIC0001276,700229045,"M.G. RD., KOLKATA","ICICI BANK LTD., 133, M G RD, KOLKATA - 700007, KOLKATA DIST., WEST BENGAL",0,KOLKATA,KOLKATA,"WEST BENGAL"
"ICICI BANK LIMITED",ICIC0001275,700229057,"SANTOSHPUR, KOLKATA","ICICI BANK LTD., C195, SURVEY PARK, SANTOSHPUR, KOLKATA - 700075, KOLKATA DIST., WEST BENGAL.",0,KOLKATA,KOLKATA,"WEST BENGAL"
"ICICI BANK LIMITED",ICIC0001274,700229056,"GARIAHAT RD., KOLKATA","ICICI BANK LTD., 1/423, GARIAHAT RD.(SOUTH), JODHPUR PARK, KOLKATA - 700068, KOLKATA DIST., WEST BENGAL",0,KOLKATA,KOLKATA,"WEST BENGAL"
"ICICI BANK LIMITED",ICIC0001273,700229053,"HATIBAGAN - KOLKATA, WEST BENGAL","ICICI BANK LTD., 104, SRI AUROBINDO SARANI, PLOT NO. 1B, HATIBAGAN, KOLKATA- 700006, KOLKATA DIST., WEST BENGAL.",0,KOLKATA,KOLKATA,"WEST BENGAL"
"ICICI BANK LIMITED",ICIC0001272,23122011,TOPSIA,"86 A TOPSIA ROAD,HAUTE STREET BUILDING, KOLKATA 700046.",0,KOLKATA,KOLKATA,"WEST BENGAL"
"ICICI BANK LIMITED",ICIC0001271,700229076,"KOLKATA ┬û KALIKAPUR, WEST BENGAL","ICICI BANK LTD.,659, KALIKAPUR ROAD, KOLKATA ┬û 700078 WEST BENGAL",0,KOLKATA,KOLKATA,"WEST BENGAL"
"ICICI BANK LIMITED",ICIC0001270,760229003,"KOLKATA - ESPLANADE, WEST BENGAL","ICICI BANK LTD.,182,DHARAMTOLLA STREET, LENIN SARANI, ESPLANADE, KOLKATA-700013, WEST BENGAL",0,KOLKATA,KOLKATA,"WEST BENGAL"
"ICICI BANK LIMITED",ICIC0001269,530229007,"GANDHIGRAM, VIASKHAPATNAM","ICICI BANK LTD., HINDUSTAN SHIPYARD LTD. COMMERCIAL COMPLEX, MAIN PORCH, GANDHIGRAM, VISAKHAPATNAM - 530 026, VISAKHAPATNAM DIST., AP.",0,VISAKHAPATNAM,VISHAKHAPATNAM,"ANDHRA PRADESH"
"ICICI BANK LIMITED",ICIC0001268,530229008,"VISHAKHAPATNAM - ONE TOWN ANDHRA PRADESH","ICICI BANK LTD., 25-12-44, GODEVARI STREET, ONE TOWN, VISHAKHAPATNAM - 530001, ANDHRA PRADESH",0,VISAKHAPATNAM,VISHAKHAPATNAM,"ANDHRA PRADESH"
"ICICI BANK LIMITED",ICIC0001267,250229007,"MEERUT - MAWANA ROAD UTTAR PRADESH","ICICI BANK LTD., C-2 TRUPTI GARDEN, MAWANA ROAD, MEERUT-250001, UTTAR PRADESH",0,MEERUT,MEERUT,"UTTAR PRADESH"
"ICICI BANK LIMITED",ICIC0001266,250229005,"MEERUT HAPUR ROAD, UTTAR PRADESH","ICICI BANK LTD., 43, SHIVPURI, OPP. EVES HOSPITAL, HAPUR ROAD, MEERUT - 250001, MEERUT DIST., UTTAR PRADESH.",0,MEERUT,MEERUT,"UTTAR PRADESH"
"ICICI BANK LIMITED",ICIC0001265,226229016,"RAJAJI PURAM - LUCKNOW, UTTAR PRADESH","ICICI BANK LTD., CP-132/7, GOLA CHAURAHA, RAJAJI PURAM, LUCKNOW - 226017, LUCKNOW DIST., UTTAR PRADESH.",0,LUCKNOW,LUCKNOW,"UTTAR PRADESH"
"ICICI BANK LIMITED",ICIC0001264,226229012,"FAIZABAD ROAD - LUCKNOW, UTTAR PRADESH","ICICI BANK LTD., SHOP NO. 17,18,18A & 19, LEKHRAJ KHAJANA COMPLEX, PLOT NO. D -2, SECTOR - 4, INDIRA NAGAR, FAIZABAD ROAD, LUCKNOW ┬û 226016, LUCKNOW DIST., UP.",0,LUCKNOW,LUCKNOW,"UTTAR PRADESH"
"ICICI BANK LIMITED",ICIC0001263,226229015,"LUCKNOW NIRALA NAGAR, UTTAR PRADESH","ICICI BANK LTD.,A-29, NIRALA NAGAR, LUCKNOW - 226020, LUCKNOW DIST., UTTAR PRADESH.",0,LUCKNOW,LUCKNOW,"UTTAR PRADESH"
"ICICI BANK LIMITED",ICIC0001262,226229014,"NADAN MAHAL ROAD-LUCKNOW, UTTAR PRADESH","ICICI BANK LTD., 253/24, NADAN MAHAL ROAD, LUCKNOW - 226003, LUCKNOW DIST., UTTAR PRADESH.",0,LUCKNOW,LUCKNOW,"UTTAR PRADESH"
"ICICI BANK LIMITED",ICIC0001261,226229013,"SADAR BAZAR-LUCKNOW CANTT, UTTAR PRADESH","ICICI BANK LTD., KRISHNA BHAWAN, 19, SADAR BAZAR, LUCKNOW CANTT - 226002, LUCKNOW DIST., UTTAR PRADESH.",0,LUCKNOW,LUCKNOW,"UTTAR PRADESH"
"ICICI BANK LIMITED",ICIC0001260,226229011,"ASHIANA LUCKNOW, UTTAR PRADESH","ICICI BANK LTD., A-1669, SECTOR I, LDA COLONY, AASHIANA, LUCKNOW-226012, LUCKNOW DIST., UTTAR PRADESH.",0,LUCKNOW,LUCKNOW,"UTTAR PRADESH"
"ICICI BANK LIMITED",ICIC0001259,226229019,"LUCKNOW - UNIVERSITY, UTTAR PRADESH","ICICI BANK LTD., 102 CROSS ROAD PLAZA, BADSHANAGAR, FAIZABAD ROAD - 226 004, LUCKNOW, UTTAR PRADESH",0,LUCKNOW,LUCKNOW,"UTTAR PRADESH"
"ICICI BANK LIMITED",ICIC0001258,226229018,"LUCKNOW - SITAPUR ROAD, UTTAR PRADESH","ICICI BANK LTD., SHOP3, PLOT NO 10, MANDIR MARH, MAHANAGAR - 226004, LUCKNOW, UTTAR PRADESH",0,LUCKNOW,LUCKNOW,"UTTAR PRADESH"
"ICICI BANK LIMITED",ICIC0001257,201229002,"MODINAGAR UTTAR PRADESH","ICICI BANK LTD.,PLOT NO.79/1,G.T ROAD,OPP.AMBER CINEMA,MODINAGAR.,DIST - GHAZIABAD -201204, UTTAR PRADESH",0,MODINAGAR,GHAZIABAD,"UTTAR PRADESH"
"ICICI BANK LIMITED",ICIC0001256,110229119,"CHOUDHARY MORE-GHAZIABAD","ICICI BANK LTD., PLOT NO.270, AMBEDKAR ROAD, OPP. NEHRU YUVAKENDRA, CHOUDHARY MORE, GHAZIABAD- 201001, GHAZIABAD DIST., UTTAR PRADESH.",0,GHAZIABAD,GHAZIABAD,"UTTAR PRADESH"
"ICICI BANK LIMITED",ICIC0001255,110229116,"VASUNDHARA, GHAZIABAD","ICICI BANK LTD, PLOT NO C-7 SEC-13 OPP JAIPURIA SCHOOL, VASUNDHARA, GHAZAIBAD - 201012, GHAZAIBAD DIST., UTTAR PRADESH",0,GHAZIABAD,GHAZIABAD,"UTTAR PRADESH"
"ICICI BANK LIMITED",ICIC0001254,110229117,"VAISHALI, GHAZIABAD","ICICI BANK LTD, SHOP NO-4 PLOT NO-18 AJNARA LANDMARK SEC-4 VAISHALI, GHAZAIABD - 201010, GHAZAIABD DIST., UTTAR PRADESH",0,GHAZIABAD,GHAZIABAD,"UTTAR PRADESH"
"ICICI BANK LIMITED",ICIC0001253,110229140,"NOIDA SECTOR - 18 WEALTH, UTTAR PRADESH","ICICI BANK LTD., B-12 SECTOR-18, NOIDA- 201301, UTTAR PRADESH",0,NOIDA,"GAUTAM BUDDHA NAGAR","UTTAR PRADESH"
"ICICI BANK LIMITED",ICIC0001252,400229190,"YOGI NAGAR, MUMBAI","ICICI BANK LTD., 351-A, HINAL PARK, SHOP NO1, BORIVALI VILLAGE, ESKAR ROAD., BORIVALI (W), MUMBAI-  400092, MAHARASHTRA.",0,MUMBAI,"GREATER BOMBAY",MAHARASHTRA
"ICICI BANK LIMITED",ICIC0001251,400229198,"YARI ROAD, ANDHERI (W), MUMBAI","ICICI BANK LTD., RIDHI SIDHI APARTMENT, OPPOSITE YARI ROAD POLICE STATION, YARI ROAD, VERSOVA, ANDHERI(W), MUMBAI - 400 061, MAHARASHTRA.",0,MUMBAI,"GREATER BOMBAY",MAHARASHTRA
"ICICI BANK LIMITED",ICIC0001250,400229159,"MUMBAI JB NAGAR HUL CAMPUS, MAHARASHTRA","ICICI BANK LTD UNILEVER HOUSE, B D SAWANT MARG, CHAKALA, ANDHERI (EAST), MUMBAI 400099.",0,MUMBAI,"GREATER BOMBAY",MAHARASHTRA
"ICICI BANK LIMITED",ICIC0001249,400229191,"VIKHROLI (E), MUMBAI","ICICI BANK LTD., ┬æA┬Æ WING, SAI SUMAN CHS, C.T.S. NO. 252, NEAR RELIANCE FRESH, STATION ROAD, VIKHROLI (E), MUMBAI - 400083, MHARASHTRA",0,MUMBAI,"GREATER BOMBAY",MAHARASHTRA
"ICICI BANK LIMITED",ICIC0001248,400229157,"SANTACRUZ , S V ROAD, MUMBAI","ICICI BANK LTD., 001/112, A WING, SUNDER VILLA, SV ROAD,  SANTACRUZ WEST,  MUMBAI 400054.",0,MUMBAI,"GREATER BOMBAY",MAHARASHTRA
"ICICI BANK LIMITED",ICIC0001247,400229140,"L&T BRANCH, MAHARASHTRA","ICICI BANK, L&T GATE NO:1, NEAR CANTEEN, SAKI VIHAR  ROAD, PO BOX NO:8901, MUMBAI 400 072",0,MUMBAI,"GREATER BOMBAY",MAHARASHTRA
"ICICI BANK LIMITED",ICIC0001246,400229117,"MULUND (W), MUMBAI","ICICI BANK LTD, SHOP NO. 1-3, ALPS HEIGHTS, NEAR VISHWAMAHAL HOTEL, MULUND (W), MUMBAI - 400080, MAHARASHTRA.",0,MUMBAI,"GREATER BOMBAY",MAHARASHTRA
"ICICI BANK LIMITED",ICIC0001245,400229168,"MUMBAI - POCHKKHANWALA RD WORLI, MAHARASHTRA","ICICI BANK LTD., SHOP NO.9, SHUBADA SAHAKARI GRIHANIRMAN SANSTHA MARYADIT, SIR POCHKANWALA ROAD, WORLI, MUMBAI ┬û 400025",0,MUMBAI,"GREATER BOMBAY",MAHARASHTRA
"ICICI BANK LIMITED",ICIC0001244,400229120,"VIKAS PARADISE-MULUND, MUMBAI","ICICI BANK LTD., SHOP NO.14-16, VIKAS PARADISE, BHAKTI MARG, OPP. BALRAJESHWAR MANDIR, MULUND (W), MUMBAI- 400080, MAHARASHTRA",0,MUMBAI,"GREATER BOMBAY",MAHARASHTRA
"ICICI BANK LIMITED",ICIC0001243,400229151,"MUMBAI ┬û CURRY ROAD, MAHARASHTRA","ICICI BANK LTD., SHOP NO. 2, 4, 5 CENTRE POINT BUILDING, BABA SAHEB AMBEDKAR ROAD, CURRY ROAD, MUMBAI - 400013, MAHARASHTRA.",0,MUMBAI,"GREATER BOMBAY",MAHARASHTRA
"ICICI BANK LIMITED",ICIC0001241,400229160,"MUMBAI - DAHISAR EAST, MAHARASHTRA","ICICI BANK LTD., JAYA APARTMENT, RAMKUMAR THAKUR ROAD,OPP DAHISAR SPORTS GROUND, DAHISAR EAST, MUMBAI - 400 068, MAHARASHTRA.",0,MUMBAI,"GREATER BOMBAY",MAHARASHTRA
"ICICI BANK LIMITED",ICIC0001240,400229153,"MUMBAI - KHAR LINKING ROAD, MAHARASHTRA","ICICI BANK LTD., SHOP NO. 2,3,4,5,6. , PLOT NO.482, CORNER OF 24, 33RD ROAD, OFF LINKING ROAD, KHAR, MUMBAI - 400052, MAHARASHTRA.",0,MUMBAI,"GREATER BOMBAY",MAHARASHTRA
"ICICI BANK LIMITED",ICIC0001239,400229152,"MUMBAI - VEER SAVARKAR ROAD, MAHARASHTRA","ICICI BANK LTD., SHREE ADINATH TOWER, SHOP NO.19 & 19A, VEER SAVARKAR ROAD, BORIVALI (E), MUMBAI- 400066, MAHARASHTRA",0,MUMBAI,"GREATER BOMBAY",MAHARASHTRA
"ICICI BANK LIMITED",ICIC0001238,400229163,"MUMBAI - ANDHERI W.E. HIGHWAY, MAHARASHTRA","ICICI BANK LTD., 349 BUSINESS POINT, WESTERN EXPRESS HIGHWAY, ANDHERI EAST, MUMBAI - 400069, MAHARASHTRA.",0,MUMBAI,"GREATER BOMBAY",MAHARASHTRA
"ICICI BANK LIMITED",ICIC0001237,400229164,"MUMBAI - MALAD EAST PODDAR SCHOOL","ICICI BANK LTD.SETH JUGGILAL PODDAR ACADEMY ,UPPER GOVING NAGAR MALAD (E) 400097",0,MUMBAI,"GREATER BOMBAY",MAHARASHTRA
"ICICI BANK LIMITED",ICIC0001236,400229186,"JOGESHWARI (E)","ICICI BANK LTD., SHOP NO. 4,5,9 & 10, KESAR PLAZA, STATION ROAD, JOGESHWARI (E), MUMBAI - 400 060.",0,MUMBAI,"GREATER BOMBAY",MAHARASHTRA
"ICICI BANK LIMITED",ICIC0001235,400229204,"DAHISAR (WEST)","ICICI BANK LTD,SHOP NO.1,16,17,PANKAJ PARAG MHATRE CHS,LT ROAD,DAHISAR WEST,MUMBAI-400068",0,MUMBAI,"GREATER BOMBAY",MAHARASHTRA
"ICICI BANK LIMITED",ICIC0001234,400229158,"JUHU TARA ROAD","SEA PEARL, CTS NO.1046 & 1047, NEAR SNDT UNIVERSITY, JUHU ROAD, SANTACRUZ (W), MUMBAI- 400049",0,MUMBAI,"GREATER BOMBAY",MAHARASHTRA
"ICICI BANK LIMITED",ICIC0001233,400229188,"KHETWADI, MUMBAI","ICICI BANK LTD, SHOP NO - 3/A, SIDDHI APT, KHETWADI 10TH LANE, MUMBAI ┬û 400004.",0,MUMBAI,"GREATER BOMBAY",MAHARASHTRA
"ICICI BANK LIMITED",ICIC0001232,400229165,"MUMBAI - BORIVALI SAIBABA NAGAR, MAHARASHTRA","ICICI BANK LTD., P & T OFFICIALS CHS LTD., BHUVNESHWARI, PLOT NO. 18 OF VILLAGE TALUKA BORIVALI, RAMNAGAR, SAIBABANAGAR, BORIVALI (W), MUMBAI - 400092, MAHARASHTRA.",0,MUMBAI,"GREATER BOMBAY",MAHARASHTRA
"ICICI BANK LIMITED",ICIC0001231,400229161,"BANDRA (E) MIG COLONY","ICICI BANK LTD,UNIT 2, GROUND FLOOR, HALLMARK PLAZA, BANDRA (E) MUMBAI 400 051",0,MUMBAI,"GREATER BOMBAY",MAHARASHTRA
"ICICI BANK LIMITED",ICIC0001230,400229154,"PAREL ┬û MUMBAI","ICICI BANK LTD, ABHINANDAN CHS, SHOP NO 3, AMBEDKAR ROAD, PAREL, MUMBAI 400012.",0,MUMBAI,"GREATER BOMBAY",MAHARASHTRA
"ICICI BANK LIMITED",ICIC0001229,400229194,"MUMBAI - AGAR BAZAR, MAHARASHTRA","ICICI BANK LTD, RELIANCE SAHAKARI BHANDAR, S.K.BOLE ROAD,DADAR WEST AGAR BAZAR 400028",0,MUMBAI,"GREATER BOMBAY",MAHARASHTRA
"ICICI BANK LIMITED",ICIC0001228,400229146,"MUMBAI SHIMPOLI, MAHARASHTRA","ICICI BANK LTD., SANSKRUTI APARTMENT,NEAR GREEN RIDGE TOWER, LINK ROAD, CHIKOOWADI, SHIMPOLI, BORIVALI WEST,MUMBAI - 400092, MAHARASHTRA",0,MUMBAI,"GREATER BOMBAY",MAHARASHTRA
"ICICI BANK LIMITED",ICIC0001227,400229156,"MUMBAI - CARNAC BUNDAR, MAHARASHTRA","ICICI BANK LTD., SHOP NO 17,18, VYAPAR BHAVAN, P D'MELLO ROAD, CARNAC BUNDAR, MUMBAI- 400009, MAHARASHTRA",0,MUMBAI,"GREATER BOMBAY",MAHARASHTRA
"ICICI BANK LIMITED",ICIC0001226,400229143,"MUMBAI NEHRU NAGAR KURLA, MAHARASHTRA","ICICI BANK LTD., SHOP NO. 3,4,5. BUILDING NO. 10, SAMRAT CHS, NEHRU NAGAR , KURLA EAST, MUMBAI - 400024, MAHARASHTRA",0,MUMBAI,"GREATER BOMBAY",MAHARASHTRA
"ICICI BANK LIMITED",ICIC0001225,400229139,"MUMBAI ANDHERI VEERA DESAI ROAD, MAHARASHTRA","ICICI BANK LTD., SHOP NO.7, BHARAT APT., VEERA DESAI ROAD, ANDHERI (W), MUMBAI- 400058, MAHARASHTRA",0,MUMBAI,"GREATER BOMBAY",MAHARASHTRA
"ICICI BANK LIMITED",ICIC0001224,400229162,"KEMPS CORNER","ICICI BANK LTD., 135, DOCTOR CENTRE, AUGUST KRANTI MARG, KEMPS CORNER, MUMBAI - 400 036, MAHARASHTRA.",0,MUMBAI,"GREATER BOMBAY",MAHARASHTRA
"ICICI BANK LIMITED",ICIC0001223,400229193,"BHAT BAZAAR, MUMBAI","ICICI BANK LTD., SHOP NO. G -1, PREM BHAVAN , 234/236 , NARSI NATHA STREET, BHAT BAZAAR, MUMBAI - 400009, MAHARASHTRA.",0,MUMBAI,"GREATER BOMBAY",MAHARASHTRA
"ICICI BANK LIMITED",ICIC0001222,400229199,"BORIVALI LT ROAD","ICICI BANK LTD,1ST FLOOR, GANESH DARSHAN BUILDING, L T ROAD ,BORIVALI WEST, MUMBAI -400092",0,MUMBAI,"GREATER BOMBAY",MAHARASHTRA
"ICICI BANK LIMITED",ICIC0001221,400229138,"LINK ROAD MALAD, MAHARASHTRA","ICICI BANK LTD., SHOP NO.6 & 7, LINKWAY ESTATE (E), LINK ROAD, MALAD (W), MUMBAI- 400064, MAHARASHTRA.",0,MUMBAI,"GREATER BOMBAY",MAHARASHTRA
"ICICI BANK LIMITED",ICIC0001220,400229144,"MUMBAI RAJAWADI GHATKOPAR (E)","ICICI BANK LTD., SHOP NO.1 & 2, PARMESHWAR DHAM, 7TH ROAD, RAJWADI, OPP. SANYAS ASHRAM, GHATKOPAR (E), MUMBAI - 400077, MAHARASHTRA",0,MUMBAI,"GREATER BOMBAY",MAHARASHTRA
"ICICI BANK LIMITED",ICIC0001219,400229166,"MUMBAI - MOHAMMED ALI ROAD, MAHARASHTRA","ICICI BANK LTD., SHOP NO. 3, DADA MANZIL, MOHAMMAD ALI ROAD, MUMBAI - 400003,  MAHARASHTRA.",0,MUMBAI,"GREATER BOMBAY",MAHARASHTRA
"ICICI BANK LIMITED",ICIC0001218,400229132,"GORAI - MUMBAI, MAHARASHTRA","ICICI BANK LTD., SHOP NO. 1, GORAI, RUBY CO., HSC SOC., GORAI 2, BORIVALI (W), MUMBAI- 400092, MAHARASHTRA.",0,MUMBAI,"GREATER BOMBAY",MAHARASHTRA
"ICICI BANK LIMITED",ICIC0001217,400229203,"BHARAT DIAMOND BOSURE BRANCH","ICICI BANK LTD BHARAT DIAMOND BOURSE, E TOWER GROUND FLOOR, BLDG. NO. 5, EAST CORE (WING) BKC, BANDRA E- 400 051",0,MUMBAI,"GREATER BOMBAY",MAHARASHTRA
"ICICI BANK LIMITED",ICIC0001216,400229155,"MUMBAI - NANA CHOWK, MAHARASHTRA","ICICI BANK LTD, GROUND FLOOR, MATRU MANDIR, JAOJEE DADAJEE ROAD, NANA CHOWK, MUMBAI ┬û 400007.",0,MUMBAI,"GREATER BOMBAY",MAHARASHTRA
"ICICI BANK LIMITED",ICIC0001215,400229127,"I C COLONY, BORIVALI - MUMBAI, MAHARASHTRA","ICICI BANK LTD., SHOP NO.1, FAIRY APT., HOLYCROSS ROAD, I.C.COLONY BORIVALI (W), MUMBAI - 400051, MAHARASHTRA.",0,MUMBAI,"GREATER BOMBAY",MAHARASHTRA
"ICICI BANK LIMITED",ICIC0001214,400229130,"TILAK NAGAR, MUMBAI","ICICI BANK LTD., SHOP NO.5,6,7 BUILDING NO. 27, ANIRUDHA CHS, TILAKNAGAR, MUMBAI-400089, MAHARASHTRA.",0,MUMBAI,"GREATER BOMBAY",MAHARASHTRA
"ICICI BANK LIMITED",ICIC0001213,400229187,"MUMBAI - CHEMBUR RCF MARG, MAHARASHTRA","ICICI BANK LTD.,┬á SHOP NO. 2-2A AND SHOP NO. 3,┬á B- WING, KAILASH ESPLANADE, OPP. SHREYAS TALKIES, LBS ROAD, GHATKOPAR (W), MUMBAI - 400086, MAHARASHTRA",0,MUMBAI,"GREATER BOMBAY",MAHARASHTRA
"ICICI BANK LIMITED",ICIC0001212,400229185,"HCC VIKHROLI","ICICI BANK LTD, 301, 3RD FLOOR, B WING, 247 PARK, HINCON HOUSE LBS MARG,  VIKHROLI (WEST) - 400083",0,MUMBAI,"GREATER BOMBAY",MAHARASHTRA
"ICICI BANK LIMITED",ICIC0001211,400229129,"SHERLY ROAD-BANDRA, MUMBAI","ICICI BANK LTD., SHABBIR APT., 40 SHERLY ROAD, BANDRA (W), MUMBAI - 400050, MAHARASHTRA.",0,MUMBAI,"GREATER BOMBAY",MAHARASHTRA
"ICICI BANK LIMITED",ICIC0001210,400229167,"MUMBAI - ZAVERA ROAD MULUND, MAHARASHTRA","ICICI BANK LTD , SHOP NO. 1 ,2 & 3 , NEERA COMPLEX , SILENT PARK , BHAYANDER EAST ┬û 401105",0,MUMBAI,"GREATER BOMBAY",MAHARASHTRA
"ICICI BANK LIMITED",ICIC0001209,400229195,"MAHAVIR NAGAR, KANDIVALI (W), MUMBAI","ICICI BANK LTD., GOVARDHAN NAGAR BUILDING, MAHAVIR NAGAR, KANDIVALI (W), MUMBAI - 400067, MAHARASHTRA.",0,MUMBAI,"GREATER BOMBAY",MAHARASHTRA
"ICICI BANK LIMITED",ICIC0001208,400229192,"CHEMBUR NAKA, MUMBAI","ICICI BANK LTD., SHOP NO 1 TO 4, CHAUHAN APARTMENT, V N PURAV MARG,  SION TROMBAY ROAD, CHEMBUR NAKA, CHEMBUR, MUMBAI - 400071, MAHARASHTRA.",0,MUMBAI,"GREATER BOMBAY",MAHARASHTRA
"ICICI BANK LIMITED",ICIC0001207,400229119,"PANT NAGAR, GHATKOPAR(E), MUMBAI","ICICI BANK LTD., JAI KISAN CO-OPERATIVE HOUSING SOCIETY LTD, SHOP NO. 3 & 4, PLOT NO.296, PANT NAGAR, GHATKOPAR (E),MUMBAI - 400 077, MAHARASHTRA.",0,MUMBAI,"GREATER BOMBAY",MAHARASHTRA
"ICICI BANK LIMITED",ICIC0001206,400229128,"AAREY ROAD, GOREGAON (E), MUMBAI","ICICI BANK LTD., SHOP NO.1 & 2, C-WING, GREEN LAWNS APT., OPP. ST. PIUS COLLEGE, AAREY ROAD, GOREGAON EAST, MUMBAI - 400063, MAHARASHTRA",0,MUMBAI,"GREATER BOMBAY",MAHARASHTRA
"ICICI BANK LIMITED",ICIC0001205,400229142,SHER-E-PUNJAB,"ICICI BANK LTD , SHOP NO. 1 & 2, 153 SHER-E-PUNJAB,  NEAR TOLANI COLLEGE, SHER-E-PUNJAB, ANDHERI(E), MUMBAI ┬û 400093",0,MUMBAI,"GREATER BOMBAY",MAHARASHTRA
"ICICI BANK LIMITED",ICIC0001204,400229141,"POONAM NAGAR BRANCH","ICICI BANK LTD , 6, BRINDAVAN BUILDING, POONAM NAGAR, OPP. MAHAKALI  CAVES ROAD, ANDHERI(E), MUMBAI ┬û 400093",0,MUMBAI,"GREATER BOMBAY",MAHARASHTRA
"ICICI BANK LIMITED",ICIC0001202,400229147,"MUMBAI - LBS MARG KURLA, MAHARASHTRA","ICICI BANK LTD.,SHOP NO.5, SAI KUTIR, PLOT NO.161, LBS MARG,  KURLA,  MUMBAI- 400 070",0,MUMBAI,"GREATER BOMBAY",MAHARASHTRA
"ICICI BANK LIMITED",ICIC0001201,400229202,SEWRI,"ICICI BANK LTD., SHOP NO. 17 & 18, REGAL INDUSTRIES COMMERCIAL BUILDING, A. D. MARG, SEWRI, MUMBAI - 400015, MAHARASHTRA.",0,MUMBAI,"GREATER BOMBAY",MAHARASHTRA
"ICICI BANK LIMITED",ICIC0001200,400229118,"VAKOLA, SANTACRUZ","ICICI BANK LTD -HARMONY , JAWAHARLAL NEHRU ROAD, VAKOLA, SANTACRUZ (E), MUMBAI",0,MUMBAI,"GREATER BOMBAY",MAHARASHTRA
"ICICI BANK LIMITED",ICIC0001199,400229125,"VASANT GARDEN, MULUND W","ICICI BANK LTD, 3&4, GOLDEN WILLOWS, OFF BALRAJESHWAR ROAD VASANT GARDEN, MULUND WEST MUMBAI-400080.",0,MUMBAI,"GREATER BOMBAY",MAHARASHTRA
"ICICI BANK LIMITED",ICIC0001198,400229150,"MUMBAI - NAVY NAGAR, MAHARASHTRA","ICICI BANK LTD., INDIAN NAVAL CANTEEN, OFFICERS BLOCK, NOFRA, NAVY NAGAR, COLABA, MUMBAI- 400005, MAHARASHTRA.",0,MUMBAI,"GREATER BOMBAY",MAHARASHTRA
"ICICI BANK LIMITED",ICIC0001196,400229197,"GODREJ IT PARK, VIKHROLI (W), MUMBAI","ICICI BANK LTD GODREJ AND BOYSE MANUFACTURING CO LTD,BLOCK B, GODREJ IT PARK, P-2 PHIROJSHAH NAGAR, VIKROLI(W), MUMBAI-79",0,MUMBAI,"GREATER BOMBAY",MAHARASHTRA
"ICICI BANK LIMITED",ICIC0001195,400229145,"MUMBAI - MULUND LBS MARG, MAHARASHTRA","ICICI BANK LTD, HALLMARK BLOCK, VASANT OSCAR, NEAR NIRMAL LIFESTYLE, LBS MARG, MULUND WEST, MUMBAI ┬û 400080",0,MUMBAI,"GREATER BOMBAY",MAHARASHTRA
"ICICI BANK LIMITED",ICIC0001194,400229113,"JOGESHWARI (W)-MUMBAI, MAHARASHTRA","ICICI BANK LTD, SHOP NO.3,4 & 5, AYESHA TOWER, PLOT NO. 220, S V ROAD, JOGESHWARI (W), MUMBAI - 400102, MAHARASHTRA.",0,MUMBAI,"GREATER BOMBAY",MAHARASHTRA
"ICICI BANK LIMITED",ICIC0001193,462229014,"BHOPAL-HEERA COMPLEX","ICICI BANK LTD., HEERA COMPELX, Z-14, MP NAGAR, ZONE-I, BHOPAL-462011 (M.P.)",0,BHOPAL,BHOPAL,"MADHYA PRADESH"
"ICICI BANK LIMITED",ICIC0001192,462229013,"BHOPAL-HOSHANGABAD ROAD","ICICI BANK LTD., NIRUPAM SHOPPING MALL, SHOP NO. 1,2,18,19,20, HOSHANGABAD ROAD, BHOPAL-462026 (M.P.)",0,HOSHANGABAD,HOSHANGABAD,"MADHYA PRADESH"
"ICICI BANK LIMITED",ICIC0001191,462229007,"BAIRAGARH-BHOPAL, MADHYA PRADESH","ICICI BANK LTD., B-14/23, NEAR RAJKUMAR MARKET, BAIRAGARH, BHOPAL - 462030, BHOPAL DIST., MADHYA PRADESH",0,"BAIRAGARH CHICHLI",BHOPAL,"MADHYA PRADESH"
"ICICI BANK LIMITED",ICIC0001190,462229010,"KOLAR - BHOPAL, MADHYA PRADESH","ICICI BANK LTD., SHOP NO. 8-11 ULTIMATE ARCADE, KOLAR ROAD, BHOPAL - 462042, BHOPAL DIST., MADHYA PRADESH.",0,BHOPAL,BHOPAL,"MADHYA PRADESH"
"ICICI BANK LIMITED",ICIC0001189,462229009,BHOPAL-LALGHATI,"ICICI BANK LTD.,ALARK SHOPPING MALL, NEAR LALGHATI SQUARE, LALGHATI , BHOPAL. MADHYAPRADESH. 462030.",0,BHOPAL,BHOPAL,"MADHYA PRADESH"
"ICICI BANK LIMITED",ICIC0001188,462229008,"TIRAHA-BHOPAL, MADHYA PRADESH","ICICI BANK LTD., 24-A, INDRAPURI, NEAR J.K.ROAD, TIRAHA, BHOPAL - 462023, BHOPAL DIST., MADHYA PRADESH.",0,BHOPAL,BHOPAL,"MADHYA PRADESH"
"ICICI BANK LIMITED",ICIC0001187,680229004,"THRISSUR - 2, KERALA","ICICI BANK LTD., WEST FORT TOWER, WEST FORT JUNCTION, CIVIL LANE ROAD, THRISSUR - 680004, THRISSUR DIST., KERALA.",0,THRISSUR,THRISSUR,KERALA
"ICICI BANK LIMITED",ICIC0001186,680229252,"KODANGALLOOR, KERALA","ICICI BANK LTD., MANSION CENTRE, WEST NADA, DIST - THRISSUR, KODANGALLOOR- 680666, KERALA",0,KODUNGALLUR,THRISSUR,KERALA
"ICICI BANK LIMITED",ICIC0001185,533229103,"RAJAHMUNDRY, ANDHRA PRADESH","ICICI BANK LTD., SIVA TOWERS, D.NO. 46-20-15, MAIN ROAD, DANAVAIPETA, RAJAHMUNDRY - 533108, EAST GODAVARI DIST., ANDHRA PRADESH.",0,RAJAHMUNDRY,"EAST GODAVARI","ANDHRA PRADESH"
"ICICI BANK LIMITED",ICIC0001184,363229071,"WANKANER, GUJARAT","ICICI BANK LTD., J P COMPLEX, GROUND FLOOR, JINPARA ROAD, WANKANER - 363621, GUJARAT",0,WANKANER,RAJKOT,GUJARAT
"ICICI BANK LIMITED",ICIC0001183,380229026,"GANDHINAGAR - INFOCITY, GUJARAT","ICICI BANK LTD., IT TOWER-3, INFOCITY, GANDHI NAGAR - 382009, GUJARAT",0,GANDHINAGAR,GANDHINAGAR,GUJARAT
"ICICI BANK LIMITED",ICIC0001182,305229025,"BEAWAR, RAJASTHAN","ICICI BANK LTD, PLOT NO 4,HIGHWAY COLONY, STATION ROAD, BEAWAR, DIST.- AJMER, RAJASTHAN-305901",0,BEAWAR,AJMER,RAJASTHAN
"ICICI BANK LIMITED",ICIC0001181,695229010,"INFOSYS - TECHNOPARK, THIRUVANANTHAPURAM","ICICI BANK LTD., INFOSYS TECHNOLOGIES LTD., ITL-TVM-SEZ, UNIT NO.1, TECHNOPARK CAMPUS II, ATTIPARA VILLAGE, THIRUVANANTHAPURAM ┬û 695581, THIRUVANANTHAPURAM DIST., KERALA.",0,THIRUVANANTHAPURAM,THIRUVANANTHAPURAM,KERALA
"ICICI BANK LIMITED",ICIC0001180,695229009,"SASTHAMANGALAM, THIRUVANANTHAPURAM","ICICI BANK LTD., AJITH BUILDINGS, TC 9/1106, SASTHAMANGALAM, THIRUVANANTHAPURAM - 695010, THIRUVANANTHAPURAM DIST., KERALA.",0,THIRUVANANTHAPURAM,THIRUVANANTHAPURAM,KERALA
"ICICI BANK LIMITED",ICIC0001179,695229008,"MANACAUD - THIRUVANANTHAPURAM, KERALA","ICICI BANK LTD., TC 41/1710(3), MANSSA COTTAGE, ATTAKULANGARA, MANACAUD, THIRUVANANTHAPURAM - 695009, THIRUVANANTHAPURAM DIST., KERALA.",0,THIRUVANANTHAPURAM,THIRUVANANTHAPURAM,KERALA
"ICICI BANK LIMITED",ICIC0001178,695229007,"KARAMANA - THIRUVANANTHAPURAM, KERALA","ICICI BANK LTD., TC 20/2649, 2650, RAJALAKSHMI, KARAMANA, THIRUVANANTHAPURAM - 695002, THIRUVANANTHAPURAM DIST., KERALA.",0,THIRUVANANTHAPURAM,THIRUVANANTHAPURAM,KERALA
"ICICI BANK LIMITED",ICIC0001177,695229006,"PATTOM-THIRUVANANTHAPURAM, KERALA","ICICI BANK LTD., LEELA TOWERS, TC 3/1791- 1, PUNNCACKATTU PATTOM, THIRUVANANTHAPURAM - 695004, THIRUVANANTHAPURAM DIST., KERALA.",0,THIRUVANANTHAPURAM,THIRUVANANTHAPURAM,KERALA
"ICICI BANK LIMITED",ICIC0001176,246229002,"SRINAGAR - BADRINATH ROAD , UTTARANCHAL","ICICI BANK LTD., NEW RAJHANS HOTEL, BADRINATH ROAD, SRINAGAR GARHWAL, UTTARANCHAL- 246174",0,SRINAGAR,GARHWAL,UTTARAKHAND
"ICICI BANK LIMITED",ICIC0001175,689229252,"RANNI, KERALA","ICICI BANK LTD., EMCEE TOWERS, MAMUKKU, PAZHAVANGADI, RANNI - 689673, PATHANAMTHITTA DIST., KERALA",0,RANNI,PATHANAMTHITTA,KERALA
"ICICI BANK LIMITED",ICIC0001174,679229352,"PATTAMBI, KERALA","ICICI BANK LTD., SAROVARAM BUILDING, PALAKKAD ROAD, MELE PATTAMBI, PATTAMBI - 679329, PALAKKAD DIST., KERALA",0,PATTAMBI,PALAKKAD,KERALA
"ICICI BANK LIMITED",ICIC0001173,NA,MANNARKAD,"ICICI BANK LTD- PAZHERI PLAZA- KODATHIPADI- MANNARKAD(P.O)- PALAKKAD DIST 678582",0,MANNARKAD,PALAKKAD,KERALA
"ICICI BANK LIMITED",ICIC0001172,673229006,"KOZHIKODE - MAVOOR ROAD, KERALA","ICICI BANK LTD ,GKW BUILDING, POTTAMMAL JUNCTION ,MAVOOR ROAD, KOZHIKODE, 673017",0,MAVOOR,KOZHIKODE,KERALA
"ICICI BANK LIMITED",ICIC0001171,686229602,"VAIKOM, KERALA","ICICI BANK LTD., KANIAMPARAMBIL BONANZA, WEST GATE, VAIKOM-686141, KOTTAYAM DIST., KERALA",0,VAIKOM,KOTTAYAM,KERALA
"ICICI BANK LIMITED",ICIC0001170,NA,KANHANGAD,"ICICI BANK LTD-BANGACHERRY COMPLEX-T B ROAD JUNCTION KANHANGAD. 671315",0,KANHANGAD,KASARAGOD,KERALA
"ICICI BANK LIMITED",ICIC0001169,670229052,"TALIPARAMBA, KERALA","ICICI BANK LTD,FIRST FLOOR , PANAMA ARCADE ,TALIPARAMBA ( 1169 ) KANNUR ( DIST ) .KERALA .",0,TALIPARAMBA,CANNUR,KERALA
"ICICI BANK LIMITED",ICIC0001168,670229003,"KANNUR - TALAP, KERALA","ICICI BANK LTD KANNUR TALAP BRANCH DOWN TOWN COMPLEX TALAP KANNUR 670004 KERALA",0,CANNUR,CANNUR,KERALA
"ICICI BANK LIMITED",ICIC0001167,679229302,"EDAPPAL, KERALA","ICICI BANK LTD , AMANA MALL THRISSUR ROAD EDAPPAL - 679576 KERALA",0,EDAPPAL,MALAPPURAM,KERALA
"ICICI BANK LIMITED",ICIC0001166,517229102,"CHITTOOR, ANDHRA PRADESH","ICICI BANK LTD., VIKAS COMPLEX, KONGAREDDY, PALLI PUTTUR, CHITTOOR - 517001, CHITTOOR DIST., ANDHRA PRADESH.",0,CHITTOOR,CHITTOOR,"ANDHRA PRADESH"
"ICICI BANK LIMITED",ICIC0001165,363229021,"MORVI, GUJARAT","ICICI BANK LTD, HARIOM  COMPLEX,RAVAPAR ROAD, MORVI-363641,GUJARAT-INDIA.",0,MORVI,RAJKOT,GUJARAT
"ICICI BANK LIMITED",ICIC0001164,682229016,"KOCHI - WELLINGTON ISLAND KERELA","ICICI BANK LTD, OLD DLB BUILDING, WILLINGDON ISLAND, KOCHI - 682 009.KERALA",0,KOCHI,ERNAKULAM,KERALA
"ICICI BANK LIMITED",ICIC0001163,682229014,"CHEMBUMUKKU- KOCHI, KERALA","ICICI BANK LTD., PALACKAL BUILDING, CHEMBUMUKKU, KAKKANAD, KOCHI- 682030, ERNAKULAM DIST., KERALA.",0,KOCHI,ERNAKULAM,KERALA
"ICICI BANK LIMITED",ICIC0001162,682229013,"RAVI PURAM - KOCHI, KERALA","ICICI BANK LTD., TEEPEYEM TOWER, OPP. SHIPYARD, RAVI PURAM, KOCHI - 682020, ERNAKULAM DIST., KERALA.",0,KOCHI,ERNAKULAM,KERALA
"ICICI BANK LIMITED",ICIC0001161,682229012,"KALOOR - KOCHI, KERALA","ICICI BANK LTD., NADUPARAMBIL HOUSE, KALOOR-KADAVANTHRA ROAD, KALOOR, KOCHI- 682017, ERNAKULAM DIST., KERALA.",0,KALOOR,ERNAKULAM,KERALA
"ICICI BANK LIMITED",ICIC0001160,682229017,"KOCHI - ELAMAKKARA, KERALA","ICICI BANK LTD., BROADWAYS ARCADE, PUNNAKAL JUN, ELAMAKKARA, KOCHI - 682026, ERNAKULAM DIST., KERALA",0,KOCHI,ERNAKULAM,KERALA
"ICICI BANK LIMITED",ICIC0001159,682229011,"KALAMASSERY-KOCHI,KERALA","ICICI BANK LTD., WARD - 3, DOOR NO.284 & 285, RAJAGIR ROAD, KALAMASSERY, KOCHI - 683104, ERNAKULAM DIST., KERALA.",0,KALAMASSERY,ERNAKULAM,KERALA
"ICICI BANK LIMITED",ICIC0001158,690229002,"HARIPPAD, KERALA","ICICI BANK LTD, JANAKISANKAR TOWERS, EZHILKKAKATHU JUNCTION, HARIPPAD- 690514, ALAPUZHA DIST., KERALA.",0,HARIPAD,ALAPUZHA,KERALA
"ICICI BANK LIMITED",ICIC0001157,688229252,"CHERTALA, KERALA","ICICI BANK LTD., SALU SHOPPING COMPLEX, X RAY JUNCTION, CHERTHALA - 688524 , ALAPURZHA DIST., KERALA.",0,CHERTHALA,ALAPUZHA,KERALA
