BANK,IFSC,MICR,BRANCH,ADDRESS,CONTACT,CITY,DISTRICT,STATE
"ICICI BANK LIMITED",ICIC0003789,142229057,"JAGRAON NEW GRAIN MARKET","ICICI BANK LTD,JAGRAON,NEW GRAIN MARKET,SHOP NO.72,DISTT.LUDHIANA,PUNJAB -142026",0,JAGRAON,LUDHIANA,PUNJAB
"ICICI BANK LIMITED",ICIC0003788,136229155,KALAYAT,"RAILWAY ROAD NEAR ANAJ MANDI OPPOSIT HOTEL BLUE STAR KALAYAT-136117 HARYANA",9467618493,KALAYAT,KAITHAL,HARYANA
"ICICI BANK LIMITED",ICIC0003787,NA,KOVVUR,"ICICI BANK LTD 7-5-22 KODURI VARI STREET KOVVUR - 535350 WEST GODAVARI",0,KOVVUR,"WEST GODAVARI","ANDHRA PRADESH"
"ICICI BANK LIMITED",ICIC0003786,NA,DHAND,"ICICI BANK LTD NEAR NAIN HOSPITAL OLD KURUKSHETRA ROAD DHAND",1746250130,DHAND,KAITHAL,HARYANA
"ICICI BANK LIMITED",ICIC0003785,625229033,USILAMPATTI,"ICICI BANK LTD NO.149 B4 MADURAI ROAD USILAMPATTI-625532",251511,USILAMPATTI,MADURAI,"TAMIL NADU"
"ICICI BANK LIMITED",ICIC0003784,605229027,VANDAVASI,"ICICI BANK LTD NO 8 SEETHARAMA NAIDU STREET VANDAVASI 604408 DIST TIRUVANNAMALAI TAMILNADU",9840879949,VANDAVASI,TIRUVANNAMALAI,"TAMIL NADU"
"ICICI BANK LIMITED",ICIC0003783,591229602,RAMDURG,"ICICI BANK LIMITED CTS NO 2886 AND 2887 JUNIPETH,SBM ROAD RAMDURG - 591123",9916814007,RAMDURG,BELGAUM,KARNATAKA
"ICICI BANK LIMITED",ICIC0003782,577229529,HONNALI,"ICICI BANK LTD SHRI SHAKTHI ARCHADE T M ROAD HONNALI -577217",9035051193,HONNALI,DAVANGERE,KARNATAKA
"ICICI BANK LIMITED",ICIC0003781,577229528,CHANNAGERI,"ICICI BANK LTD.WARD NO.09,OLD SANTHE MAIDAN AREA,NH.13MAIN ROAD CHANNAGIRI",7816977204,CHANNAGIRI,DAVANGERE,KARNATAKA
"ICICI BANK LIMITED",ICIC0003780,NA,RAJAM,"ICICI BANK LTD 6-1-234 SRIKAKULAMROAD NEAR LIC BUILDING RAJAM 532127",0,RAJAM,SRIKAKULAM,"ANDHRA PRADESH"
"ICICI BANK LIMITED",ICIC0003779,524229582,KOVUR,"ICICI BANK LTD,2-7-255/A,MYTHALI CENTRE,KOVUR,NELLORE DIST-524137",7569157740,KOVUR,NELLORE,"ANDHRA PRADESH"
"ICICI BANK LIMITED",ICIC0003778,533229502,MANDAPETA,"ICICI BANK LIMITED,D NO 32-01-19, GROUND FLOOR, MAIN ROAD, MANDAPETA, PIN-533308",9533673201,MANDAPETA,"EAST GODAVARI","ANDHRA PRADESH"
"ICICI BANK LIMITED",ICIC0003777,509229584,NAGARKURNOOL,"ICICI BANK LTD,15-19/4 BESIDE TELEPHONE EXCHANGE NAGARKURNOOL MHABUBNAGAR-509209",9533146492,NAGARKURNOOL,MAHBUBNAGAR,TELANGANA
"ICICI BANK LIMITED",ICIC0003776,143229106,MAKHU,"ICICI BANK LTD WARD NO 9 RAILWAY ROAD MAKHU DIST FEROZEPUR",7087038670,MAKHU,FEROZPUR,PUNJAB
"ICICI BANK LIMITED",ICIC0003775,626229402,SATTUR,"ICICI BANK LTD NO 23 NEW COLONY SATTUR VIRUDHUNAGAR DIST PIN 626203",0,SATTUR,VIRUDHUNAGAR,"TAMIL NADU"
"ICICI BANK LIMITED",ICIC0003774,520229722,KAIKALUR,"10-88 ABOVE VARASANJEEVINI HOSPITAL BESIDE VENKATARAMANA THEATER KAIKALUR KRISHNA DIST",0,KAIKALUR,KRISHNA,"ANDHRA PRADESH"
"ICICI BANK LIMITED",ICIC0003773,NA,GHARSANA,"ICICI BANK LTD 83 NEW ANAJ MANDI,GHARSANA,RAJASTHAN",9529122022,GHARSANA,GANGANAGAR,RAJASTHAN
"ICICI BANK LIMITED",ICIC0003772,126229053,UCHANA,"ICICI BANK LTD AGRASEN CHOWK NEAR GRAIN MARKET UCHANA 126115",1684230305,UCHANA,JIND,HARYANA
"ICICI BANK LIMITED",ICIC0003771,517229662,PUNGANUR,"D.NO28-100/4-2,CHOWDEPALLI,PUNGANUR,ANDHRA PRADESH,517247.",857326737,PUNGANUR,CHITTOOR,"ANDHRA PRADESH"
"ICICI BANK LIMITED",ICIC0003770,522229702,MACHERLA,"14-1-323 SANTHI NAGAR SRISAILAM ROAD MACHERLA 522426",0,MACHERLA,GUNTUR,"ANDHRA PRADESH"
"ICICI BANK LIMITED",ICIC0003769,503229562,BODHAN,"1-4-354 SARASWATI NAGAR BESIDE BUS STAND BODHAN NIZAMABAD 503185",0,BODHAN,NIZAMABAD,"ANDHRA PRADESH"
"ICICI BANK LIMITED",ICIC0003768,431229507,SAILU,"ICICI BANK LTD,GROUND FLOOR,PLOT NO 1032,NR SBH JAWAHAR ROAD,RATI GALLI,SAILU,PINCODE 431503",2451223974,SAILU,PARBHANI,MAHARASHTRA
"ICICI BANK LIMITED",ICIC0003767,431229504,PARTUR,"OPP.TEHSIL OFFICE,MAIN ROAD,PARTUR,DIST-JALNA,MAHARASHTRA,PIN CODE 431501",9373648813,PARTUR,JALNA,MAHARASHTRA
"ICICI BANK LIMITED",ICIC0003766,431229509,GEORAI,"ICICI BANK LTD,FIRST FLOOR,MONDHA ROAD,GEORAI,DIST.BEED,MAHARASHTRA 431127",2447262050,GEORAI,BID,MAHARASHTRA
"ICICI BANK LIMITED",ICIC0003765,431229505,GANGAPUR,"ICICI BANK LTD UPPER GROUND FLOOR SHUTTER NO 24 25 26 27 GOKUL TRADE CENTER LASUR NAKA AURANGABAD ROAD",0,GANGAPUR,AURANGABAD,MAHARASHTRA
"ICICI BANK LIMITED",ICIC0003764,423229352,YEVLA,"PLOT NO 3,S NO 93/A,LONARI NAGAR,NR HOTEL JAIN PALACE,NAGAR MANMAD ROAD,YEVLA,NASHIK 423401",2559265805,YEOLA,NASIK,MAHARASHTRA
"ICICI BANK LIMITED",ICIC0003763,NA,RAHATA,"ICICI BANK LTD H NO.1629 SR NO.324/2A/1 IN FRONT OF SHARADA VIDHYA MANDIR NAGAR MANMAD HIGHWAY RAHATA TAL",0,RAHATA,AHMADNAGAR,MAHARASHTRA
"ICICI BANK LIMITED",ICIC0003762,413229606,BHOOM,"ICICI BANK LTD HOUSE NO 2912 UDAY NAGAR PETH OSMANABAD ROAD BHOOM 413504",2478272373,ACHLER,OSMANABAD,MAHARASHTRA
"ICICI BANK LIMITED",ICIC0003761,413229535,MOHOL,"HOUSE NO 3332/3579 KALASE NAGAR MOHOL PANDHARPUR ROAD TAL MOHOL DIST SOLAPUR MAHARASHTRA 413213",9272202240,MOHOL,SOLAPUR,MAHARASHTRA
"ICICI BANK LIMITED",ICIC0003760,136229202,PUNDRI,"ICICI BANK LTD OPP HUDA MARKET PUNDRI SOL ID 3760 DISTT KAITHAL HARYANA",1746310826,PUNDRI,KAITHAL,HARYANA
"ICICI BANK LIMITED",ICIC0003759,520229642,VUYYURU,"ICICI BANK LTD 1 328 FIRST FLOOR PRASAD PLAZA VUYYURU",8676,VUYYURU,KRISHNA,"ANDHRA PRADESH"
"ICICI BANK LIMITED",ICIC0003758,517229302,SRIKALAHASTI,"DR.NO 3-1065-1,NAGARI STREET,SRIKALAHASTI,CHITTOOR DIST,ANDHRA PRADESH-517644",0,SRIKALAHASTI,CHITTOOR,"ANDHRA PRADESH"
"ICICI BANK LIMITED",ICIC0003757,364229111,TALAJA,"ICICI BANK LTD GROUNG FLOOR PUJAN COMPLEX GOPNATH ROAD TALAJA GUJ 364140",0,TALAJA,BHAVNAGAR,GUJARAT
"ICICI BANK LIMITED",ICIC0003756,609229202,SIRKALI,"NO 5 PIDARI WEST STREET SUMATHI MAHAL SIRKALI NAGAPATTINAM 609110",4364273757,SIRKALI,NAGAPATTINAM,"TAMIL NADU"
"ICICI BANK LIMITED",ICIC0003755,517229603,PILER,"ICICI BANK LTD SURVAY NO 532 WARD NO 2 PILERU VILLAGE CHITTOOR DIST-517214.ANDHRA PRADESH",9346682663,PILER,CHITTOOR,"ANDHRA PRADESH"
"ICICI BANK LIMITED",ICIC0003754,431229506,KANNAD,"ICICI BANK LTD,PANDE SQURE,PISHOR NAKA,CHALISGAON RAOD,KANNAD,AURANGABAD-431147",2435220011,KANNAD,AURANGABAD,MAHARASHTRA
"ICICI BANK LIMITED",ICIC0003753,413229533,KARMALA,"ICICI BANK LTD SR NO 3976,2,3 KAMALA DEVI ROAD,KARMALA 413203",7620423942,KARMALA,SOLAPUR,MAHARASHTRA
"ICICI BANK LIMITED",ICIC0003752,303229008,"ACHROL-NIMS UNIVERSITY","ICICI BANK LTD.NIMS UNIVERSITY SHOBHA NAGAR NEAR ACHROL JAIPUR -DELHI HIGHWAY ACHROL DISTT JAIPUR-303121",0,ACHROL,JAIPUR,RAJASTHAN
"ICICI BANK LIMITED",ICIC0003751,402229051,PEN,"ICICI BANK LTD VEER SAVARKAR MARG ANTORA ROAD OPPOSITE MSEB OFFICE PEN RAIGAD-402107",9272201984,PEN,RAIGAD,MAHARASHTRA
"ICICI BANK LIMITED",ICIC0003749,231229302,OBRA,"ICICI BANK LTD VIP ROAD NEAR MASJID OBRA - SONBHADRA U.P -231219",7849940129,OBRA,SONBHADRA,"UTTAR PRADESH"
"ICICI BANK LIMITED",ICIC0003748,144229903,"LOHIAN KHAS","ICICI BANK LIMITED WARD NO.2 INDRA DANA MANDI VPO LOHIAN KHAS DISTT.JALANDHAR PUNJAB-144629",9317793391,"LOHIAN KHAS",JALANDHAR,PUNJAB
"ICICI BANK LIMITED",ICIC0003747,144229988,NADALA,"ICICI BANK LTD VPO NADALA SUBHANPUR ROAD OPP.BUS STAND NADALA DISTT.KAPURTHALA PIN 144624",9888061947,NADALA,KAPURTHALA,PUNJAB
"ICICI BANK LIMITED",ICIC0003746,143229303,CHABAL,"AMRITSAR CHABAL ROAD NEAR KOHINOOR FARM ADDA CHABAL DISTT TARN TARAN 143301",8054581591,CHABHAL,AMRITSAR,PUNJAB
"ICICI BANK LIMITED",ICIC0003745,144229977,BHOGPUR,"ICICI BANK LTD.SHOP NO.8 NEW GRAIN MARKET.BHOGPUR DISTT.JALANDHAR PIN 144201",9888789930,BHOGPUR,JALANDHAR,PUNJAB
"ICICI BANK LIMITED",ICIC0003744,176229054,JASSUR,"ICICI BANK LTD RL ARCADEBUILDING PTK - MANDI HIGHWAY POST OFFICE JASSUR DISTT KANGRA HP 176201",9816667700,KANGRA,KANGRA,"HIMACHAL PRADESH"
"ICICI BANK LIMITED",ICIC0003743,145229006,"BHUNGAL MAMUN MILITARY STATION","ICICI BANK LTD BHUNGAL BHATTACHARJEE ENCLAVE MILITARY STATION BHUNGAL DISTT PATHANKOT PUNJAB 145001",2243200,BUNGAL,GURDASPUR,PUNJAB
"ICICI BANK LIMITED",ICIC0003742,143229020,VERKA,"ICICI BANK LTD.K NO.M1327 BATALA ROAD,VERKA 143501",0,VERKA,AMRITSAR,PUNJAB
"ICICI BANK LIMITED",ICIC0003741,175229052,MANALI,"ICICI BANK LTD MANALI HIMALAYA SHOPPING ARCADE OPPOSITE NAGAR PARISHAD THE MALL MANALI DISTT KULLU HP-175131",0,MANALI,KULU,"HIMACHAL PRADESH"
"ICICI BANK LIMITED",ICIC0003740,WAITING,MAHILPUR,"ICICI BANK LTD, SH-24, GARSHANKAR ROAD,MAHILPUR PUNJAB 146105.",87235272,MAHALPUR,HOSHIARPUR,PUNJAB
"ICICI BANK LIMITED",ICIC0003739,144229205,"HOSHIARPUR ROAD PHAGWARA","ICICI BANK LTD SCF 373 SBS NAGAR HOSHIARPUR ROAD PHAGWARA",9316407172,PHAGWARA,KAPURTHALA,PUNJAB
"ICICI BANK LIMITED",ICIC0003738,176229053,MCLEODGANJ,"ICICI BANK LTD MCLEODGANJ TIPPA ROAD TEHSIL DHARAMSHALA DISTT KANGRA HP 176219",9816667700,KANGRA,KANGRA,"HIMACHAL PRADESH"
"ICICI BANK LIMITED",ICIC0003737,160229056,"SEC PANCHKULA","SCO 115 SEC 25 PANCHKULA HARYANA 134116",8355114411,PANCHKULA,PANCHKULA,HARYANA
"ICICI BANK LIMITED",ICIC0003736,160229054,PARWANOO,"ICICI BANK LTD PARWANOO KH NO.434/25/12,MAUJA UP MOHAL SECTOR-1 PARWANOO DISTT SOLAN H.P 173220",9318885070,PARWANOO,SOLAN,"HIMACHAL PRADESH"
"ICICI BANK LIMITED",ICIC0003735,110229256,BIDHAL,"OPPOSITE GOVT.PRIMARY SCHOOL,GOHANA ROAD VILLAGE BIDHAL TEHSIL GOHANA DISTT.SONEPAT",0,GOHANA,SONIPAT,HARYANA
"ICICI BANK LIMITED",ICIC0003734,110229248,"KUNDLI SECTOR","PARKER MALL CUM MULTIPLEX,SECTOR-62,GT ROAD,KUNDLI -131028,DISTT SONEPAT,HARYANA",0,KUNDLI,SONIPAT,HARYANA
"ICICI BANK LIMITED",ICIC0003733,171229008,ROHRU,"JANKI DAS MARKET WARD NO 7, SHIMLA ROAD ROHRU, DISTRICT SHIMLA, PIN 171207",0,ROHRU,SIMLA,"HIMACHAL PRADESH"
"ICICI BANK LIMITED",ICIC0003732,144229015,"JALANDHAR CANTT","ICICI BANK LTD.VAJRA GOLDEN LION SAINIK SUVIDHA KENDRA,JALANDHAR CANTT-144001",9781993569,JALANDHAR,JALANDHAR,PUNJAB
"ICICI BANK LIMITED",ICIC0003730,133229012,"NOVELTY CHOWK","ICICI BANK LTD PROPERTY NO.907-A,BLOCK-6,WARD NO.6,NEAR IMPERIAL BANQUET,CIRCULAR ROAD,AMBALA CITY",9254300883,AMBALA,AMBALA,HARYANA
"ICICI BANK LIMITED",ICIC0003729,173229053,"KALA AMB","ICICI BANK LIMITED,VILLAGE OGLI,KALA AMB,DISTT SIRMOUR,HIMACHAL PRADESH,PIN-173001",9625592958,"KALA AMB",SIRMAUR,"HIMACHAL PRADESH"
"ICICI BANK LIMITED",ICIC0003728,NA,"BHAGTA MANDI","ICICI BANK LTD MALUKA COMPLEX BAJA KHANA ROAD,BHAGTA MANDI",0,BHAGTA,BATHINDA,PUNJAB
"ICICI BANK LIMITED",ICIC0003727,160229055,NALAGARH,"ICICI BANK LTD, ROPAR ROAD, DIST SOLAN, NALAGARH.",1795200000,NALAGARH,SOLAN,"HIMACHAL PRADESH"
"ICICI BANK LIMITED",ICIC0003726,132229007,"PANIPAT SEC-","ICICI BANK LTD,SCO-182,HUDA MARKET,SECTOR-13,PANIPAT,HARYANA",0,ADYANA,PANIPAT,HARYANA
"ICICI BANK LIMITED",ICIC0003725,382229041,VIJAPUR,"ICICI BANK LTD SB EMPIRE TB ROAD VIJAPUR DIST MAHESANA GUJRAT 372870.",220088,VIJAPUR,MAHESANA,GUJARAT
"ICICI BANK LIMITED",ICIC0003724,491229301,BEMETARA,"ICICI BANK LTD PATEL COMPLEX INFRONT OF KRISHI UPAJ MANDI DURG ROAD BEMETARA CHHATTISGARH 491335",7389941420,BEMETARA,DURG,CHANDIGARH
"ICICI BANK LIMITED",ICIC0003723,496229504,DHARAMJAIGARH,"ICICI BANK LTD., OLD JANPAD PANCHAYAT BUILDING, DHARAMJAIGARH, CG 496116",0,DHARAMJAIGARH,RAIGARH,CHHATTISGARH
"ICICI BANK LIMITED",ICIC0003722,496229503,GHARGHODA,"ICICI BANK LTD JANPAD PANCHAYAT BUILDING GHARGHODA RAIGARH 496111",300625,GHARGHODA,RAIGARH,CHHATTISGARH
"ICICI BANK LIMITED",ICIC0003721,NA,KUSMI,"ICICI BANK LTD OLD CO-OPERATIVE BUILDING MAIN ROAD KUSMI BLOCK KUSMI DIST -BALRAMPUR CG -497224",7225025416,KUSMI,SURGUJA,CHHATTISGARH
"ICICI BANK LIMITED",ICIC0003718,NA,SARANGARH,"ICICI BANK LTD VIKAS BHAWAN IN FRONT OF JANPAD PANCHAYAT SARANGARH",96865,SARANGARH,RAIGARH,CHHATTISGARH
"ICICI BANK LIMITED",ICIC0003717,494229101,KANKER,"KANKALIN PARA,IN FORNT OF FOREST DEPT,JAGDALPUR ROAD,KANKER.C.G -494334",7509900080,KANKER,KANKER,CHANDIGARH
"ICICI BANK LIMITED",ICIC0003716,493229502,DHAMTARI,"BESIDE NAGAR PANCHAYAT PARISHAR SAMUDAIK BHAWAN KURUD DIST DHAMTARI PIN 493663",7583800231,KURUD,DHAMTARI,CHANDIGARH
"ICICI BANK LIMITED",ICIC0003713,160229048,"CHANDIGARH SECTOR D","ICICI BANK LTD.SCO 314 SECTOR 40 D CHANDIGARH 160036",1720000000,CHANDIGARH,CHANDIGARH,CHANDIGARH
"ICICI BANK LIMITED",ICIC0003712,400229238,"KALINA CST RD BR","ICICI BANK LTD KALINA CST RD BR UNIT NO 1 AMAR BRASS COMD SANTACRUZ EAST MUMBAI 400098",0,MUMBAI,"GREATER BOMBAY",MAHARASHTRA
"ICICI BANK LIMITED",ICIC0003711,WAITING,DARIBA,"ICICI BANK LIMITED HINDUSTAN ZINC LIMITED DARIBA DISTRICT RAJSAMAND RAJASTHAN PIN 313211",0,DARIBA,RAJSAMAND,RAJASTHAN
"ICICI BANK LIMITED",ICIC0003710,313229106,DHARIAWAD,"ICICI BANK LTD BUILDING OF SARASWATI BHARTI PRATAPGARH ROAD NEAR HERO HONDA SHOWROOM DHARIAWAD 313605 PRATAPGARH",8875013423,PRATAPGARH,CHITTAURGARH,RAJASTHAN
"ICICI BANK LIMITED",ICIC0003709,110229242,"SECTOR TWENTY-ONE GURGAON","SHOP 5 A SUNCITY PROJECT SEC 21 OLD DELHI ROAD GURGAON - 122013",7042694088,GURGAON,GURGAON,HARYANA
"ICICI BANK LIMITED",ICIC0003708,801229002,BIHTA,"ICICI BANK LTD OPP.SBI ADB BRANCH MAIN ROAD BIHTA",9934305585,BIHTA,PATNA,BIHAR
"ICICI BANK LIMITED",ICIC0003707,813229102,KAHALGAON,"ICICI BANK LTD HOTEL SIDDHARTH NTPC ROAD KAHALGAON",0,BHAGALPUR,BHAGALPUR,BIHAR
"ICICI BANK LIMITED",ICIC0003706,813229002,BANKA,"HOTEL KRISHNA INTERNATIONAL MALIK TOLA ROAD VEER KUNWAR SINGH MAIDAN BANKA BIHAR - 813102",7541806391,BANKA,BANKA,BIHAR
"ICICI BANK LIMITED",ICIC0003705,160229049,"CHD SECTOR","SCO-391 SECTOR-37-D CHD",1725008338,CHANDIGARH,CHANDIGARH,CHANDIGARH
"ICICI BANK LIMITED",ICIC0003704,160229052,"CHANDIGARH SECTOR D","ICICI BANK LTD OPP CIVIL DISPENSARY SECTOR-20D CHANDIGARH-160020",0,CHANDIGARH,CHANDIGARH,CHANDIGARH
"ICICI BANK LIMITED",ICIC0003703,WAITING,"KARNAL SECTOR","ICICI BANK LTD SCO 103 URBAN ESTATE SECTOR 7 KARNAL 132001",9812616322,KARNAL,KARNAL,HARYANA
"ICICI BANK LIMITED",ICIC0003702,171229007,"NEW SHIMLA","ICICI BANK LTD NH 22 BCS NEW SHIMLA HP 171009",0,SIMLA,SIMLA,"HIMACHAL PRADESH"
"ICICI BANK LIMITED",ICIC0003699,822229102,"GARHWA BRANCH","ICICI BANK LTD H K PETROLIUM PIPRA KALAN KUTCHERY ROAD GARHWA JHARKHAND PIN 822114",6561222461,GARHWA,GARHWA,JHARKHAND
"ICICI BANK LIMITED",ICIC0003698,560229104,BHATTARAHALLI,"ICICI BANK LTD NO.29 BHATTARAHALLI VILLAGE BATTARAHALLI HOBLI BANGALORE EAST TALUK OLD MADRAS ROAD BANGALORE -560049 KARNATAKA",8025619001,BOMMANAHALLI,"BANGALORE URBAN",KARNATAKA
"ICICI BANK LIMITED",ICIC0003696,560229131,THUBRAHALLI,"ICICI BANK LTD NO 2 THUBRAHALLI WHITEFEILD POST VARTHUR MAIN ROAD BANGALORE 560066",8095836911,BANGALORE,"BANGALORE URBAN",KARNATAKA
"ICICI BANK LIMITED",ICIC0003695,560229107,NAGARBHAVI,"NO 888 80 FEET RAOD PAPAREDDY PALLYA NAGARBHAVI 2ND STAGE BANGALORE -560072",9538344098,NAGARABAVI,"BANGALORE URBAN",KARNATAKA
"ICICI BANK LIMITED",ICIC0003694,560229105,MAHADEVAPURA,"ICICI BANK LTD P3 ITI ANCILLARYY INDUSTRIES ESTATE MAHADEVAPURA BANGALORE 560048",8028530077,BANGALORE,"BANGALORE URBAN",KARNATAKA
"ICICI BANK LIMITED",ICIC0003693,560229119,GANDHINAGAR,"ICICI BANK LTD NO2 Y RAMCHANDRA ROAD GANDHINAGAR BANGALORE-560009.KARNATAKA INDIA",9379301038,BANGALORE,"BANGALORE URBAN",KARNATAKA
"ICICI BANK LIMITED",ICIC0003692,411229052,"SAHAKAR NAGAR","SHOP NO 1 TO 3 GROUND FLOOR SR NO 82 ARNESHWAR PARK SAHAKAR NAGAR PUNE 411030",2406940021,PUNE,PUNE,MAHARASHTRA
"ICICI BANK LIMITED",ICIC0003691,751229501,PATIA,"PLOT NO516/1755,GR FLOOR AND FIRST FLOOR,MARUTI CORNER,PATIA,BHUBANESWAR,751024",6742726362,PATRAPARA,KHORDHA,ODISHA
"ICICI BANK LIMITED",ICIC0003690,767229102,SONEPUR,"AT PALACE GARDEN CHOWK NEAR POLICE STATION SONEPUR 767017",7894470959,SONEPUR,SONEPUR,ODISHA
"ICICI BANK LIMITED",ICIC0003689,764229302,MALKANGIRI,"ICICI BANK LTD MAIN ROAD OPPOSITE COLLECTORAL OFFICE MALKANGIRI 764045",7091649283,MALKANGIRI,MALKANGIRI,ODISHA
"ICICI BANK LIMITED",ICIC0003688,758229502,CHAMPUA,"ICICI BANK LTD CHAMPUA MAIN ROAD CHAMPUA KEONJHAR ODISHA 758041",0,CHAMPUA,KEONJHAR,ODISHA
"ICICI BANK LIMITED",ICIC0003687,756229503,PANCHHAPADA,"RAJIV GANDHI SEWA KENDRA PANCHHAPADA PANCHAYAT OFFICE CHANDBALI BHADRAK",0,BHADRAK,BHADRAK,ODISHA
"ICICI BANK LIMITED",ICIC0003686,752229502,JAYAPUR,"JAYAPUR BRANCH ICICI BANK LTD.VILL-JAYAPUR PO-SAKHIGOPAL PS-SATYABADI PURI ODISHA-752014",0,SAKHIGOPAL,PURI,ODISHA
"ICICI BANK LIMITED",ICIC0003685,751229017,"PRATAP SASAN","ICICI BANK LTD.AT PRATAP SASAN NEAR BALAKATI BAZAR PO-BALAKATI PS-BALIANTA DIST-KHURDA ODISHA",0,BALAKATI,KHURDA,ODISHA
"ICICI BANK LIMITED",ICIC0003684,766229501,"KHARIAR ROAD","GROUND FLOOR SHANTI NAGAR WARD NO-18 AM SENA CHOWK KHARIAR ROAD NUAPADA ODISHA-766104",0,"KHARIAR ROAD",NAWAPARA,ODISHA
"ICICI BANK LIMITED",ICIC0003683,768229102,DEOGARH,"NT,NW,NZ,TE,76818",9337098870,DEOGARH,DEOGARH,ODISHA
"ICICI BANK LIMITED",ICIC0003682,762229102,BOUDHGARH,"ICICI BANK LTD SHIBANI MARKET JD HIGH SCHOOL ROAD BAUDHGARH ODISHA 762014",7389944689,BOUDH,BOUDH,ODISHA
"ICICI BANK LIMITED",ICIC0003681,WAITING,"NISA JINDAL CAMPUS","ICICI BANK LTD NISA JINDAL CAMPUS BRANCH NISA ANGUL-759111 ODISHA",6764605030,ANGUL,ANGUL,ODISHA
"ICICI BANK LIMITED",ICIC0003679,768229502,TELENPALI,"ICICI BANK LTD,TELENPALI,NEAR PANCHAYAT OFFICE,JHARSUGUDA-768234",9438482790,LAKHANPUR,JHARSUGUDA,ODISHA
"ICICI BANK LIMITED",ICIC0003678,768229501,BHEUNRIA,"AT BY PO BHEUNRIA PADAMPUR BARGARH ODISHA 768036",0,PADAMPUR,BARGARH,ODISHA
"ICICI BANK LIMITED",ICIC0003677,767229501,RUSUDA,"ICICI BANK LTD,RAJEEV GANDHI SEVA SADAN,GUDVELLA,RUSUDA,BOLANGIR,ODISHA-767067",0,BOLANGIR,BALANGIR,ODISHA
"ICICI BANK LIMITED",ICIC0003676,767229502,GANAPATRAPALI,"ICICI BANK GANDAPTARAPALI BRANCH,SINHA COMPLEX,PHAPSI CHOWK,DIST-BALANGIR-ODISHA-767032",0,BOLANGIR,BALANGIR,ODISHA
"ICICI BANK LIMITED",ICIC0003675,768229402,BARPALI,"ICICI BANK LTD OPP OF POST OFFICE BARPALI DIST BARGARH ODISHA 768029",0,BARPALI,BARGARH,ODISHA
"ICICI BANK LIMITED",ICIC0003674,759229508,DHAURAPALI,"ICICI BANK LTD DHURAPALI GRAM PANCHAYAT OFFICE.KISHORENAGAR DIST-ANGUL PIN759126",6763257070,KISHORENAGAR,ANGUL,ODISHA
"ICICI BANK LIMITED",ICIC0003673,WAITING,"MODEL TOWN PHAGWARA","ICICI BANK LTD OHRI TOWERS MODEL TOWN PHAGWARA PUNJAB",0,PHAGWARA,KAPURTHALA,PUNJAB
"ICICI BANK LIMITED",ICIC0003672,173229003,DARALAGHAT,"BILASPUR SHIMLA HIGHWAY VPO DARLAGHAT DISTRICT SOLAN PIN 171102",0,SOLAN,SOLAN,"HIMACHAL PRADESH"
"ICICI BANK LIMITED",ICIC0003671,NA,"MODEL TOWN BATHINDA","MODEL TOWN PHASE 1 BATHINDA",8146624667,BHATINDA,BATHINDA,PUNJAB
"ICICI BANK LIMITED",ICIC0003670,NA,"TINKONI CHOWK BATHINDA","TINKOINI CHOWK, OPPOSITE HOTEL SEPAL, GT ROAD BATHINDA.",8146624667,BHATINDA,BATHINDA,PUNJAB
"ICICI BANK LIMITED",ICIC0003669,160229050,"SECTOR MOHALI","SCO 31 SECTOR 67 MOHALI PUNJAB 160059",9115002610,"SAS NAGAR MOHALI",RUPNAGAR,PUNJAB
"ICICI BANK LIMITED",ICIC0003668,171229005,KASUMPTI,"SCO 14 15 16 BLOCK NO.3 SDA COMPLEX KASUMPTI SHIMLA 171009",2625985,"KASUMPTI JUNGA",SIMLA,"HIMACHAL PRADESH"
"ICICI BANK LIMITED",ICIC0003667,143229014,"RANIKA BAGH","485-B/3 MCLEAD ROAD RANIKA BAGH AMRITSAR",0,AMRITSAR,AMRITSAR,PUNJAB
"ICICI BANK LIMITED",ICIC0003666,143229017,"AIRPORT ROAD","ICICI BANK LTD.203 B GURU AMAR DASS AVENUE C - BLOCK AIRPORT ROAD AMRITSAR 143001 PUNJAB",0,AMRITPUR,AMRITSAR,PUNJAB
"ICICI BANK LIMITED",ICIC0003665,143229016,"COURT ROAD","ICICI BANK LTD 26-D COURT ROAD AMRITSAR PUNJAB - 143001",1835070616,AMRITSAR,AMRITSAR,PUNJAB
"ICICI BANK LIMITED",ICIC0003664,124229007,"MADINA GINDHRAN","ICICI BANK LTD MADINA GINDRAN PROPERTY NO.750 MAIN ROAD,N.H - 10,TEHSIL - MEHAM ROHTAK - 124111",8295908308,MADINA,ROHTAK,HARYANA
"ICICI BANK LIMITED",ICIC0003663,NA,"DHANDARI KALAN LUDHIANA","ICICI BANK LTD PLOT NO 6 NEAR GREAT WAY EVELINE DHANDARI KALAN LUDHIANA -141014 PUNJAB",0,LUDHIANA,LUDHIANA,PUNJAB
"ICICI BANK LIMITED",ICIC0003662,NA,"BAHADUR KE ROAD LUDHIANA","SCO.26 FEILDGANJ LUDHIANA PUNJAB - 141008 PUNJAB",0,LUDHIANA,LUDHIANA,PUNJAB
"ICICI BANK LIMITED",ICIC0003661,NA,"FIELD GANJ LUDHIANA","SCO.26 FEILDGANJ LUDHIANA PUNJAB - 141008 PUNJAB",0,LUDHIANA,LUDHIANA,PUNJAB
"ICICI BANK LIMITED",ICIC0003660,NA,"SHINGAR ROAD LUDHIANA","ICICI BANK LTD.1177/4B BABA THAN SINGH CHOWK SHINGAR CINEMA ROAD LUDHIANA -141008 PUNJAB",0,LUDHIANA,LUDHIANA,PUNJAB
"ICICI BANK LIMITED",ICIC0003659,WAITING,"LUDHIANA-HAMBRAN ROAD","ICICI BANK LTD B 1 1447 2A 2 NEAR KALA MATA MANDIR HAMBRAN ROAD LUDHIANA PUNJAB 141001",0,LUDHIANA,LUDHIANA,PUNJAB
"ICICI BANK LIMITED",ICIC0003658,600229124,AKKARAI,"ICICI BANK LTD PLOT NO 1,SHOP NO 9,E1,SEA CLIFF ENCLAVE VGP MAIN STREET,ECR,AKKARAI,SHOLINGANALLUR",9244900161,"TAMIL NADU",CHENNAI,"TAMIL NADU"
"ICICI BANK LIMITED",ICIC0003657,620229013,MUSIRI,"NO 22-3",0,MUSIRI,TIRUCHIRAPALLI,"TAMIL NADU"
"ICICI BANK LIMITED",ICIC0003656,621229305,PERAMBALUR,"ICICI BANK LTD.NO 23A VENKATESHAPURAM TRICHY MAIN ROAD PERAMBALUR 621212",4328291007,PERAMBALUR,PERAMBALUR,"TAMIL NADU"
"ICICI BANK LIMITED",ICIC0003655,621229306,KUNNAM,"2/270 ARIYALUR MAIN ROAD KUNNAM PERAMBALUR 621708 PIN 621708",0,KUNNAM,PERAMBALUR,"TAMIL NADU"
"ICICI BANK LIMITED",ICIC0003654,364229054,"BOTAD - STATION ROAD","ICICI BANK LTD GROUND FLOOR SHALIBHADRA MARKET TOWER ROAD BOTAD",0,BOTAD,BHAVNAGAR,GUJARAT
"ICICI BANK LIMITED",ICIC0003653,606229104,SANKARAPURAM,"372 SRI LAKSHMI COMPLEX OPP TO BUS STAND POOTAI ROAD SANKARAPURAM VILLUPURAM-606401",8939817861,SANKARAPURAM,VILLUPURAM,"TAMIL NADU"
"ICICI BANK LIMITED",ICIC0003652,464229510,SILWANI,"ICICI BANK LTD NEAR OLD BUS STAND BHOPAL STATE HIGHWAY SILWANI-464886 DIST RAISEN MP",9993027979,SILWANI,RAISEN,"MADHYA PRADESH"
"ICICI BANK LIMITED",ICIC0003651,466229502,NASRULLAGANJ,BTOPPTMMBPRUJ41DTSMP,7389941421,NASRULLAGANJ,SEHORE,"MADHYA PRADESH"
"ICICI BANK LIMITED",ICIC0003650,455229505,HATPIPLIYA,"H.NO 69 NEVRI BAGLI MARG HATPIPLIYA DIST DEWAS 455223",727100000,DEWAS,DEWAS,"MADHYA PRADESH"
"ICICI BANK LIMITED",ICIC0003649,487229004,KARELI,"ICICI BANK LTD BURMAN SQUARE RAM WARD KARELI-487221 NARSINGHPUR M.P",8269313696,KARELI,NARSIMHAPUR,"MADHYA PRADESH"
"ICICI BANK LIMITED",ICIC0003648,461229511,TIMARNI,"ICICI BANK LTD WARD NO8 GANDHI CHOWK TIMARNI-461228 HARDA MP",9584771234,TIMARNI,HARDA,"MADHYA PRADESH"
"ICICI BANK LIMITED",ICIC0003647,454229502,BADNWAR,"ICICI BANK LTD 143 SHIV SHAKTI NAGAR LALA LAJPAT MARG BADNAWAR PIN-454660",7295234046,BADNAWAR,DHAR,"MADHYA PRADESH"
"ICICI BANK LIMITED",ICIC0003646,586229502,SINDGI,"ICICI BANK LTD WARD NO 12/1 2741/1 MAIN ROAD SINDGI DIST VIJAPUR KARNATAKA -586128",8861299119,SINDGI,BIJAPUR,KARNATAKA
"ICICI BANK LIMITED",ICIC0003645,587229509,MAHALINGPUR,"CTS NO89/1B APMC ROAD BANK STREET MAHALINGPUR BAGALKOT-587312",8350270057,MAHALINGPUR,BAGALKOTE,KARNATAKA
"ICICI BANK LIMITED",ICIC0003644,583229505,SIRUGUPPA,"ICICI BANK LTD MANJUNATH TRADE CENTRE BALLARI ROAD SIRUGUPPA DIST. BALLARI KARNATAKA-583121",9738659759,SIRUGUPPA,BELLARY,KARNATAKA
"ICICI BANK LIMITED",ICIC0003643,584229506,MANVI,"ICICI BANK LTD SURVEY NO-13-1-69 1 GROUND FLOOR SBH COLONY DIST-RAICHUR MANVI-584123 KARNATAKA",9741126200,MANVI,RAICHUR,KARNATAKA
"ICICI BANK LIMITED",ICIC0003642,247229103,BHAGWANPUR,"ICICI BANK LTD,HOTEL ROYAL INN,OPP CANARA BANK,DEHRADUN ROAD,BHAGWANPUR,ROORKEE 247661",8899633361,BHAGWANPUR,HARIDWAR,UTTARAKHAND
"ICICI BANK LIMITED",ICIC0003641,577229152,SHIKARIPUR,"574 A JAYADEVA RICE MILL AREA S S ROAD SHIKARIPUR SHIMOGA DIST.KARNATAKA-577427",8187222051,SHIKARIPUR,SHIMOGA,KARNATAKA
"ICICI BANK LIMITED",ICIC0003640,383229501,DHANSURA,"ICICI BANK LTD DEHGAM ROAD DHASNURA 393310",2774222202,DHANSURA,"SABAR KANTHA",GUJARAT
"ICICI BANK LIMITED",ICIC0003639,WAITING,DAKOR,"ICICI BANK LTD.SHOP NO.1 AND 2 GROUND FLOOR DWARKESH COMPLEX DAKOR DIST.KHEDA -388225",2696223973,DAKOR,KHEDA,GUJARAT
"ICICI BANK LIMITED",ICIC0003638,361229091,DHROL,"ICICI BANK LTD NEAR MUKESH MANDAP SERVICE RAJKOT ROAD DHROL -361210 DIST -JAMNAGAR",2897224162,DHROL,JAMNAGAR,GUJARAT
"ICICI BANK LIMITED",ICIC0003637,360229161,BHANVAD,"ICICI BANK LTD GROUNG FLOOR OPP CHANDRAVADIA HOSPITAL NEAR VERAD NAKA BHANVAD",0,BHANVAD,JAMNAGAR,GUJARAT
"ICICI BANK LIMITED",ICIC0003636,365229502,BAGASARA,"ICICI BANK LTD GROUND FLOOR MURLIDHAR COMPLEX OPP AMARPARA BAGASARA",0,BAGASARA,AMRELI,GUJARAT
"ICICI BANK LIMITED",ICIC0003635,363229051,DHRANGADHRA,"ICICI BANK LTD NEAR POWER HOUSE CIRCLE CLUB ROAD DHRANGADHRA",0,DHRANGADHRA,SURENDRANAGAR,GUJARAT
"ICICI BANK LIMITED",ICIC0003634,383229091,TALOD,"GROUND FLOOR OPP NAGAR PALIKA MAIN BAZAR - TALOD-383215",2770222128,TALOD,"SABAR KANTHA",GUJARAT
"ICICI BANK LIMITED",ICIC0003633,508229302,KODAD,"ICICI BANK LTD 4-112/1/A MAIN ROAD OPP TELEPHONE EXCHANGE KODAD NALGONDA DISTRICT TELANGANA 508206",0,KODAD,NALGONDA,TELANGANA
"ICICI BANK LIMITED",ICIC0003632,505229504,SIRICILLA,"ICICI BANK LTD, D NO 12 6 39, GOPAL NAGAR, SIRICILLA, KARIMNAGAR 505301.",1000000,SIRICILLA,KARIMNAGAR,TELANGANA
"ICICI BANK LIMITED",ICIC0003631,NA,PALAMANER,"ICICI BANK LTD OPP GUNDU BAVI MPL ROAD PALAMANER CHITTOOR DISTRICT AP-517408",8579252749,PALAMANER,CHITTOOR,"ANDHRA PRADESH"
"ICICI BANK LIMITED",ICIC0003630,520229006,GOLLAPUDI,"D NO 7-26 MAIN ROAD GOLLAPUDI KRISHNA DISTRICT",9885586660,GOLLAPUDI,KRISHNA,"ANDHRA PRADESH"
"ICICI BANK LIMITED",ICIC0003629,505229204,HUZURABAD,"12-293,WARANGAL ROAD,HUZURABAD, KARIMNAGAR, TELANGANA.",8727251577,HUZURABAD,KARIMNAGAR,TELANGANA
"ICICI BANK LIMITED",ICIC0003628,533229622,RAVULAPALEM,"D NO 8-388 V - SQUARE TADI CHINA VENKATA REDDY ARCADE NH-5 RAVULAPALEM-533238",0,RAVULAPALEM,"EAST GODAVARI","ANDHRA PRADESH"
"ICICI BANK LIMITED",ICIC0003627,517229822,"SIDDAMMA AGRAHARAM SRICITY",HASHB0AEXWASSH554.,0,CHITTOOR,CHITTOOR,"ANDHRA PRADESH"
"ICICI BANK LIMITED",ICIC0003626,522229582,THULLUR,"ICICI BANK 10-126 COLLEGE ROAD THULLUR -522237 DIST.GUNTUR ANDHRA PRADESH",0,THULLUR,GUNTUR,"ANDHRA PRADESH"
"ICICI BANK LIMITED",ICIC0003625,392229004,MOHAMMADPURA,"1ST FLOOR MEHFUZ COMPLEX OPP.WELFARE HOSPITAL JAMBUSAR ROAD BHARUCH - GUJARAT 392001",9924596367,BHARUCH,BHARUCH,GUJARAT
"ICICI BANK LIMITED",ICIC0003624,363229023,"MORVI MAHENDRANAGAR","ICICI BANK LTD CITY POINT SHOP NO 4 5 6 MAHENDRA NAGAR HALWAD ROAD",2822111111,MORVI,RAJKOT,GUJARAT
"ICICI BANK LIMITED",ICIC0003623,NA,"NEAR POST OFFICE ROAD MAIN BAZAR","NEAR POST OFFICE ROAD MAIN MARKET LEH",0,LEH,LEH,"JAMMU AND KASHMIR"
"ICICI BANK LIMITED",ICIC0003619,302229071,"JDA CHITRAKOOT","JDA OFFICE,CHITRAKOOT STADIUM,CHITRAKOOT JAIPUR 302021 - RAJ",9214201073,JAIPUR,JAIPUR,RAJASTHAN
