BANK,IFSC,MICR,BRANCH,ADDRESS,CONTACT,CITY,DISTRICT,STATE
"YES BANK",YESB0DCBU08,NA,"UTTARKASHI ZILA SAH BANK MORI","BLOCK MORI, P O MORI, UTTARKASHI - 249185",4222246,MORI,"UTTAR KASHI",UTTARAKHAND
"YES BANK",YESB0DCBU07,NA,"UTTARKASHI ZILA SAH BANK PUROLA","BLOCK PUROLA, P O PUROLA, UTTARKASHI - 249185",4222246,PURAULA,"UTTAR KASHI",UTTARAKHAND
"YES BANK",YESB0DCBU06,NA,"UTTARKASHI ZILA SAH BANK BARKOT","BLOCK NAUGAON, P O BARKOT, UTTARKASHI - 249171",4222246,BARKOT,"UTTAR KASHI",UTTARAKHAND
"YES BANK",YESB0DCBU05,NA,"UTTARKASHI ZILA SAH BANK CHINYLISAR","P O CHINYALISAUR, UTTARKASHI - 249196",4222246,CHINYALISAUR,"UTTAR KASHI",UTTARAKHAND
"YES BANK",YESB0DCBU04,NA,"UTTARKASHI ZILA SAH BANK DUNDA","BLOCK DUNDA, P O DUNDA, UTTARKASHI - 249151",4222246,DUNDA,"UTTAR KASHI",UTTARAKHAND
"YES BANK",YESB0DCBU03,NA,"UTTARKASHI ZILA SAH BANK BHATWARI","BLOCK BHATWARI, P O BHATWARI, UTTARKASHI - 249193",4222246,BHATWARI,"UTTAR KASHI",UTTARAKHAND
"YES BANK",YESB0DCBU02,NA,"UTTARKASHI ZILA SAH BANK MAIN BRNCH","MAIN BRANCH, MALL ROAD, UTTARKASHI - 249193",4222246,UTTARKASHI,"UTTAR KASHI",UTTARAKHAND
"YES BANK",YESB0DCBU01,NA,"UTTARKASHI ZILA SAH BANK","MALL ROAD, UTTARKASHI - 249193",4222246,UTTARKASHI,"UTTAR KASHI",UTTARAKHAND
"YES BANK",YESB0DBBK01,NA,"DISTRICT COOP BANK LTD BARABANKI","MOHALLA SUBHASH NAGAR, FAIZABAD ROAD, BARABANKI - 225001",8222293,"BARA BANKI","BARA BANKI","UTTAR PRADESH"
"YES BANK",YESB0CUB402,755802002,"UCB CUTTACK JAJPUR TOWN","JAIPUR TOWN 755001",222618,"JAJPUR TOWN",JAJPUR,ODISHA
"YES BANK",YESB0CUB302,754802302,"UCB CUTTACK SALIPUR","SALIPUR 754202",2352300,CUTTACK,CUTTACK,ODISHA
"YES BANK",YESB0CUB202,754800202,"UCB CUTTACK JAGATSINGPUR","JAGATSINGPUR 754103",220402,JAGATSINGHAPUR,JAGATSINGHPUR,ODISHA
"YES BANK",YESB0CUB102,755802102,"CUTTACK BANK STREET JAJPUR ROAD","BANK STREET JAIPUR ROAD 755019",220080,"JAJPUR ROAD",JAJPUR,ODISHA
"YES BANK",YESB0CUB013,753802013,"UCB CUTTACK GANDHI CHAK","GANDHI CHAK 754071",2394646,CUTTACK,CUTTACK,ODISHA
"YES BANK",YESB0CUB012,753802012,"UCB CUTTACK NUAPATNA MANGALABAG","NUAPATNA MANGALABAG 753001",2411762,CUTTACK,CUTTACK,ODISHA
"YES BANK",YESB0CUB011,753802011,"UCB CUTTACK MALGODOWN","MALGODOWN 753003",2511752,CUTTACK,CUTTACK,ODISHA
"YES BANK",YESB0CUB010,753802010,"UCB CUTTACK LINK ROAD","LINK ROAD 753012",2312481,CUTTACK,CUTTACK,ODISHA
"YES BANK",YESB0CUB009,753802009,"UCB CUTTACK JAGATPUR SQUARE","JAGATPUR SQUARE 754021",2491271,CUTTACK,CUTTACK,ODISHA
"YES BANK",YESB0CUB008,753802008,"UCB CUTTACK GANDARPUR NH","GANDARPUR NH5 753003",2441333,CUTTACK,CUTTACK,ODISHA
"YES BANK",YESB0CUB007,753802007,"UCB CUTTACK DOLAMUNDAI","DOLAMUNDAI 753001",2311018,CUTTACK,CUTTACK,ODISHA
"YES BANK",YESB0CUB006,753802006,"UCB CUTTACK COLLEGE SQUARE","COLLEGE SQAURE 753003",2547537,CUTTACK,CUTTACK,ODISHA
"YES BANK",YESB0CUB005,753802005,"UCB CUTTACK CHAULIAGANJ","CHAULIAGANJ 753004",2441444,CUTTACK,CUTTACK,ODISHA
"YES BANK",YESB0CUB004,753802004,"UCB CUTTACK CHANDINI CHOWK","CHANDINI CHOWK 753002",2508036,CUTTACK,CUTTACK,ODISHA
"YES BANK",YESB0CUB003,753802003,"UCB CUTTACK SEC CDA BIDANASI","SECTOR 6 CDA BIDANASI 753014",2360238,CUTTACK,CUTTACK,ODISHA
"YES BANK",YESB0CUB002,753802002,"UCB CUTTACK TINIKONIA BAGICHA","TINILONIA BAGICHA 753001",2423748,CUTTACK,CUTTACK,ODISHA
"YES BANK",YESB0CSB001,560006252,"CHARTERED SAHAKARI BANK NIYAMITHA","1ST MAIN, 1ST BLOCK, KORAMANGALA, BANGALORE - 560034",9448276266,BANGALORE,"BANGALORE URBAN",KARNATAKA
"YES BANK",YESB0CMSNOC,NA,"CMS NATIONAL OPERATING CENTRE MMR","YES BANK TOWER IFC2 8TH FLOOR SB MARG ELPHINSTONE MUMBAI 400013",33479198,MUMBAI,"GREATER BOMBAY",MAHARASHTRA
"YES BANK",YESB0CKPBL1,400082268,"THE CKP COOPERATIVE BANK LTD","ASHAT IT PARK, 01ST FLOOR, WAGLE ESTATE, ROAD NO 16Z, THANE (WEST) -400604",61368282,THANE,THANE,MAHARASHTRA
"YES BANK",YESB0CJ0116,NA,"CITIZENS COOP BANK JAMMU TALABTILLO","JAWAHAR NAGAR, TALAB TILLO, JAMMU-180002",2555361,TALAB-TILLO,JAMMU,"JAMMU AND KASHMIR"
"YES BANK",YESB0CJ0115,NA,"CITIZENS COOP BANK JAMMU SHEIKHNGR","SHEIKH NAGAR (BAHU FORT), JAMMU-180006",2452318,JAMMU,JAMMU,"JAMMU AND KASHMIR"
"YES BANK",YESB0CJ0114,NA,"CITIZENS COOP BANK JAMMU CHANIHIMAT","CHANNI HIMMAT, JAMMU-180015",2462108,"CHHANI HIMMAT",JAMMU,"JAMMU AND KASHMIR"
"YES BANK",YESB0CJ0113,NA,"CITIZENS COOP BANK JAMMU JANIPUR","NEAR MAIN CHOWK, JANIPUR, JAMMU-180007",2532812,JAMMU,JAMMU,"JAMMU AND KASHMIR"
"YES BANK",YESB0CJ0112,NA,"CITIZENS COOP BANK JAMMU R S PURA","NEAR BUS STAND, R.S. PURA, JAMMU-181102",250488,"RANBIR SINGH PORA",JAMMU,"JAMMU AND KASHMIR"
"YES BANK",YESB0CJ0111,NA,"CITIZENS COOP BANK JAMMU VIJAYPUR","VIJAYPUR, DISTT. SAMBA, JAMMU-180006",231036,SAMBA,JAMMU,"JAMMU AND KASHMIR"
"YES BANK",YESB0CJ0110,NA,"CITIZENS COOP BANK JAMMU AKHNOOR","NEAR BUS STAND, AKHNOOR, JAMMU-181201",252000,AKHNOOR,JAMMU,"JAMMU AND KASHMIR"
"YES BANK",YESB0CJ0109,NA,"CITIZENS COOP BANK JAMMU VINAIK BZR","VINAIK BAZAR, JAMMU-180001",2548433,JAMMU,JAMMU,"JAMMU AND KASHMIR"
"YES BANK",YESB0CJ0108,NA,"CITIZENS COOP BANK JAMMU TRNSPRTNGR","TRANSPORT NAGAR, JAMMU-180006",2456864,JAMMU,JAMMU,"JAMMU AND KASHMIR"
"YES BANK",YESB0CJ0107,NA,"CITIZENS COOP BANK JAMMU SHASTRINGR","242 A SHASTRI NAGAR, JAMMU-180004",2452107,JAMMU,JAMMU,"JAMMU AND KASHMIR"
"YES BANK",YESB0CJ0106,NA,"CITIZENS COOP BANK JAMMU KANAKMANDI","AHATA SHRI NIWAS SHAH, KANAK MANDI, JAMMU-180001",2544712,JAMMU,JAMMU,"JAMMU AND KASHMIR"
"YES BANK",YESB0CJ0105,NA,"CITIZENS COOP BANK JAMMU GANYAL","NATIONAL HIGHWAY, GANGYAL, JAMMU-180010",2480491,GANGYAL,JAMMU,"JAMMU AND KASHMIR"
"YES BANK",YESB0CJ0104,NA,"CITIZENS COOP BANK JAMMU WARE HOUSE","WARE HOUSE, JAMMU-180004",2430076,JAMMU,JAMMU,"JAMMU AND KASHMIR"
"YES BANK",YESB0CJ0103,NA,"CITIZENS COOP BANK JAMMU NEW PLOTS","NEW PLOTS, JAMMU-180007",2578796,JAMMU,JAMMU,"JAMMU AND KASHMIR"
"YES BANK",YESB0CJ0102,NA,"CITIZENS COOP BANK JAMMU MOTI BAZAR","MOTI BAZAR, JAMMU-180001",2579544,JAMMU,JAMMU,"JAMMU AND KASHMIR"
"YES BANK",YESB0CJ0101,NA,"CITIZENS COOP BANK JAMMU C O","117 A/D GANDHI NAGAR, JAMMU-180004",2432058,JAMMU,JAMMU,"JAMMU AND KASHMIR"
"YES BANK",YESB0CDC093,442806572,"CHANDRAPUR DCC BANK SHENGAON","MAIN ROAD SHENGAON 442908",7875759243,SHEGAON,CHANDRAPUR,MAHARASHTRA
"YES BANK",YESB0CDC092,442806571,"CHANDRAPUR DCC BANK TOHOGAON","MAHAJAN COMP POST TOHOGAON TAL GONDPIPARI 442701",7875758863,TOHOGAON,CHANDRAPUR,MAHARASHTRA
"YES BANK",YESB0CDC091,NA,"THE CHANDRAPUR DCC BANK KAPASI","AT POST KAPASI TAH SAOLI DIST CHANDRAPUR - 441225",7875759177,SAOLI,CHANDRAPUR,MAHARASHTRA
"YES BANK",YESB0CDC090,NA,"THE CHANDRAPUR DCC BANK WADHONA","AT POST WADHONA TAH NAGBHEED DIST CHANDRAPUR-441221",7875758985,WADHANA,CHANDRAPUR,MAHARASHTRA
"YES BANK",YESB0CDC089,NA,"THE CHANDRAPUR DCC BANK MUDHOLI","AT POST MUDHOLI TAH BHADRAWATI DIST CHANDRAPUR-442906",9527418148,BHADRAVATI,CHANDRAPUR,MAHARASHTRA
"YES BANK",YESB0CDC088,NA,"THE CHANDRAPUR DCC BANK VIHIRGAO","AT VIHIRGAO TAH SAOLI DIST CHANDRAPUR-441207",7875758854,"VIHIRGAON BK.",CHANDRAPUR,MAHARASHTRA
"YES BANK",YESB0CDC087,NA,"THE CHANDRAPUR DCC BANK JAMBHULGHAT","AT POST JAMBHULGHAT TAL CHIMUR DIST CHANDRAPUR-442903",7875759194,CHIMUR,CHANDRAPUR,MAHARASHTRA
"YES BANK",YESB0CDC086,NA,"THE CHANDRAPUR DCC BANK KADHOLI","AT POST KADHOLI TAH RAJURA DIST CHANDRAPUR-442916",7875759257,RAJURA,CHANDRAPUR,MAHARASHTRA
"YES BANK",YESB0CDC085,NA,"THE CHANDRAPUR DCC BANK BALAPUR","AT POST BALAPUR TAH NAGBHEED DIST CHANDRAPUR-441221",7875758931,BALAPUR,CHANDRAPUR,MAHARASHTRA
"YES BANK",YESB0CDC084,NA,"THE CHANDRAPUR DCC BANK TORGAON","AT POST TORGAON TAH BRAMHAPURI DIST CHANDRAPUR-441206",7875758929,BRAHMAPURI,CHANDRAPUR,MAHARASHTRA
"YES BANK",YESB0CDC083,NA,"THE CHANDRAPUR DCC BANK MAUSHI","AT POST MAUSHI TAH NAGBHEED DIST CHANDRAPUR-441206",9423629460,NAGBHIR,CHANDRAPUR,MAHARASHTRA
"YES BANK",YESB0CDC082,NA,"THE CHANDRAPUR DCC BANK PALASGAO","AT PALASGAON TAH SINDEWAHI DIST CHANDRAPUR-442701",7875759229,PALASGAONJAT,CHANDRAPUR,MAHARASHTRA
"YES BANK",YESB0CDC081,NA,"THE CHANDRAPUR DCC BANK GUNJEWAHI","AT POST GUNJEWAHI TAH SINDEWAHI DIST CHANDRAPUR-441225",8605405777,GUNJEWAHI,CHANDRAPUR,MAHARASHTRA
"YES BANK",YESB0CDC080,NA,"THE CHANDRAPUR DCC BANK WADHOLI","AT POST WADHOLI TAH GONDPIPARI DIST CHANDRAPUR-442702",7875758850,WADHOLI,CHANDRAPUR,MAHARASHTRA
"YES BANK",YESB0CDC079,NA,"THE CHANDRAPUR DCC BANK VISAPUR","AT POST VISAPUR TAH BALLALSHA DIST CHANDRAPUR-442701",9921110469,VISAPUR,CHANDRAPUR,MAHARASHTRA
"YES BANK",YESB0CDC078,NA,"THE CHANDRAPUR DCC BANK VIRUR","AT POST VIRUR TAH RAJURA DIST CHANDRAPUR-442905",7875759235,RAJURA,CHANDRAPUR,MAHARASHTRA
"YES BANK",YESB0CDC077,NA,"THE CHANDRAPUR DCC BANK TUKUM","TADOBA ROAD TUKUM CHANDRAPUR- 442402",7387309084,CHANDRAPUR,CHANDRAPUR,MAHARASHTRA
"YES BANK",YESB0CDC076,NA,"THE CHANDRAPUR DCC BANK TEKAMANDAVA","AT POST TEKEMANDAWA TAH JIWATI DIST CHANDRAPUR-442908",9767132653,JIWATI,CHANDRAPUR,MAHARASHTRA
"YES BANK",YESB0CDC075,NA,"THE CHANDRAPUR DCC BANK TADALI","AT POST TADALI TAH CHANDRAPUR DIST CHANDRAPUR-442406",7875759087,CHANDRAPUR,CHANDRAPUR,MAHARASHTRA
"YES BANK",YESB0CDC074,NA,"THE CHANDRAPUR DCC BANK RAMNAGAR","DATALA ROAD OPP KRUSHI UTPANNA BAJAR SAMITI TAH DIST CHANDRAPUR-442402",7875758863,CHANDRAPUR,CHANDRAPUR,MAHARASHTRA
"YES BANK",YESB0CDC073,NA,"THE CHANDRAPUR DCC BANK PIPARI","AT POST PIPARI TAH CHANDRAPUR DIST CHANDRAPUR- 442505",7875758904,CHANDRAPUR,CHANDRAPUR,MAHARASHTRA
"YES BANK",YESB0CDC072,NA,"THE CHANDRAPUR DCC BANK PAHARNI","AT POST PAHARNI TAH BRAMHAPURI DIST CHANDRAPUR- 441205",7875758973,BRAHMAPURI,CHANDRAPUR,MAHARASHTRA
"YES BANK",YESB0CDC071,NA,"THE CHANDRAPUR DCC BANK NAVEGAONPDV","AT POST NAVEGAON PANDAV TAH NAGBHEED DIST CHANDRAPUR-441205",7875758980,NAGBHIR,CHANDRAPUR,MAHARASHTRA
"YES BANK",YESB0CDC070,NA,"THE CHANDRAPUR DCC BANK NANDORI","AT POST NANDORI TAH WARORA DIST CHANDRAPUR- 442401",7875758992,NANDORI,CHANDRAPUR,MAHARASHTRA
"YES BANK",YESB0CDC069,NA,"THE CHANDRAPUR DCC BANK NANDGAON","AT POST NANDGAON TAH SAOLI DIST CHANDRAPUR-442908",7588073865,SAOLI,CHANDRAPUR,MAHARASHTRA
"YES BANK",YESB0CDC068,NA,"THE CHANDRAPUR DCC BANK MOTEGAON","AT POST MOTEGAON TAH CHIMUR DIST CHANDRAPUR-442904",7875758872,MOTEGAON,CHANDRAPUR,MAHARASHTRA
"YES BANK",YESB0CDC067,NA,"THE CHANDRAPUR DCC BANK MOHALI NAL","AT POST MOHALI NALESHWAR TAH DIST CHANDRAPUR-441222",7875758983,SINDEWAHI,CHANDRAPUR,MAHARASHTRA
"YES BANK",YESB0CDC066,NA,"THE CHANDRAPUR DCC BANK MENDAKI","AT POST MENDAKI TAH BRAMHAPURI DIST CHANDRAPUR- 441206",7875758946,MENDKI,CHANDRAPUR,MAHARASHTRA
"YES BANK",YESB0CDC065,NA,"THE CHANDRAPUR DCC BANK MASAL","AT POST MASAL TAH CHIMUR DIST CHANDRAPUR-442903",7875759121,CHIMUR,CHANDRAPUR,MAHARASHTRA
"YES BANK",YESB0CDC064,NA,"THE CHANDRAPUR DCC BANK MAHAKALI","MAHAKALI MANDIR AREA NEAR GURUMAULI MANDIR TAH DIST CHANDRAPUR-442402",7875759148,MAHAKALI,CHANDRAPUR,MAHARASHTRA
"YES BANK",YESB0CDC063,NA,"THE CHANDRAPUR DCC BANK LONDHOLI","AT POST LONDHOLI TAH SAOLI DIST CHANDRAPUR-441225",9637461052,SAOLI,CHANDRAPUR,MAHARASHTRA
"YES BANK",YESB0CDC062,NA,"THE CHANDRAPUR DCC BANK LATHI","AT POST LATHI TAH GONDPIPARI DIST CHANDRAPUR-442702",7875759209,GONDPIPARI,CHANDRAPUR,MAHARASHTRA
"YES BANK",YESB0CDC061,NA,"THE CHANDRAPUR DCC BANK KAWTHADA","AT POST KAWATHDA TAH KORPANA DIST CHANDRAPUR -442917",9923928695,KAWATHALA,CHANDRAPUR,MAHARASHTRA
"YES BANK",YESB0CDC060,NA,"THE CHANDRAPUR DCC BANK JIWATI","AT POST JIWATI TAH DIST CHANDRAPUR-442908",7875758920,JIWATI,CHANDRAPUR,MAHARASHTRA
"YES BANK",YESB0CDC059,NA,"THE CHANDRAPUR DCC BANK GOWARI","AT POST GOWARI TAH RAJURA DIST CHANDRAPUR-44905",8390465625,RAJURA,CHANDRAPUR,MAHARASHTRA
"YES BANK",YESB0CDC058,NA,"THE CHANDRAPUR DCC BANK DONGARGAON","AT POST DONGARGAON TAH WARORA DIST CHANDRAPUR-442907",9637666922,WARODA,CHANDRAPUR,MAHARASHTRA
"YES BANK",YESB0CDC057,NA,"THE CHANDRAPUR DCC BANK CITY WARORA","AT GANDHI CHOWK WARORA DIST CHANDRAPUR-442907",7875759011,WARODA,CHANDRAPUR,MAHARASHTRA
"YES BANK",YESB0CDC056,NA,"THE CHANDRAPUR DCC BANK CHUNALA","AT POST CHUNALA TAH RAJURA DIST CHANDRAPUR-44905",7620781635,RAJURA,CHANDRAPUR,MAHARASHTRA
"YES BANK",YESB0CDC055,NA,"THE CHANDRAPUR DCC BANK CHORA","AT PO CHORA TAL BHADRAWATI DIST CHANDRAPUR- 442906",7875759051,CHORA,CHANDRAPUR,MAHARASHTRA
"YES BANK",YESB0CDC054,NA,"THE CHANDRAPUR DCC BANK CHIROLI","AT POST CHIROLI TAH MUL DIST CHANDRAPUR-441224",7875758840,MUL,CHANDRAPUR,MAHARASHTRA
"YES BANK",YESB0CDC053,NA,"THE CHANDRAPUR DCC BANK CHICHPALLI","AT POST CHICHPALLI TAH CHANDRAPUR DIST CHANDRAPUR-441224",7875759109,CHICHPALLI,CHANDRAPUR,MAHARASHTRA
"YES BANK",YESB0CDC052,NA,"THE CHANDRAPUR DCC BANK CHAGUN","AT POST CHAUGAN TAH BRAMHAPURI DIST CHANDRAPUR-441206",9552213219,CHAUGAN,CHANDRAPUR,MAHARASHTRA
"YES BANK",YESB0CDC051,NA,"THE CHANDRAPUR DCC BANK CHANDANKHDA","AT POST CHANDANKHEDA TAH BHADRAWATI DIST CHANDRAPUR-441906",7875757909,CHANDANKHEDA,CHANDRAPUR,MAHARASHTRA
"YES BANK",YESB0CDC050,NA,"THE CHANDRAPUR DCC BANK BRAMHAPURI","AT POST BRAMHAPURI TAH BRAMHAPURI DIST CHANDRAPUR-441206",9823253992,BRAHMAPURI,CHANDRAPUR,MAHARASHTRA
"YES BANK",YESB0CDC049,NA,"THE CHANDRAPUR DCC BANK AWADGAON","AT POST AWADGAON TAH BRAMHAPURI DIST CHANDRAPUR-441206",7875758952,BRAHMAPURI,CHANDRAPUR,MAHARASHTRA
"YES BANK",YESB0CDC048,NA,"THE CHANDRAPUR DCC BANK ANTARGAON","AT POST ANTARGAON TAH SAOLI DIST CHANDRAPUR-441223",9158369879,SAOLI,CHANDRAPUR,MAHARASHTRA
"YES BANK",YESB0CDC047,NA,"THE CHANDRAPUR DCC BANK ANANDWAN WA","AT POST ANDANWAN TAL WARORA DIST CHANDRAPUR-442914",7875758997,ANANDWAN,CHANDRAPUR,MAHARASHTRA
"YES BANK",YESB0CDC046,NA,"THE CHANDRAPUR DCC BANK ABAMAKTA","AT POST ABMAKTA TAH WARORA DIST CHANDRAPUR-442907",7875759201,WARODA,CHANDRAPUR,MAHARASHTRA
"YES BANK",YESB0CDC045,NA,"THE CHANDRAPUR DCC BANK ZP CAMPUS","AT  ZILLA PARISHAD  TAH DIST CHANDRAPUR PIN-442401",7875759225,CHANDRAPUR,CHANDRAPUR,MAHARASHTRA
"YES BANK",YESB0CDC044,NA,"THE CHANDRAPUR DCC BANK ZP BRANCH","OPPOSITE ZILLA PARISHAD , MAIN ROAD CHANDRAPUR PIN 442401",9028252530,CHANDRAPUR,CHANDRAPUR,MAHARASHTRA
"YES BANK",YESB0CDC043,NA,"THE CHANDRAPUR DCC BANK WAROHA","DATTA MANDIR WARD NEAR HIGH COURT TAH WARORA DIST CHANDRAPUR  PIN 442907",7875759025,WARODA,CHANDRAPUR,MAHARASHTRA
"YES BANK",YESB0CDC042,NA,"THE CHANDRAPUR DCC BANK VYAHAD","AT POST VYAHAD TAH SAOLI DIST CHANDRAPUR  PIN- 441227",7875758826,VYAHAD,CHANDRAPUR,MAHARASHTRA
"YES BANK",YESB0CDC041,NA,"THE CHANDRAPUR DCC BANK TEMURDA","AT POST TEMURDA TAL WARORA DIST CHANDRAPUR  PIN- 442907",7875759032,WARODA,CHANDRAPUR,MAHARASHTRA
"YES BANK",YESB0CDC040,NA,"THE CHANDRAPUR DCC BANK TAL BALAPUR","AT POST TALODHI BALAPUR TAH NAGBHEED DIST  CHANDRAPUR  PIN-441221",7875759055,NAGBHIR,CHANDRAPUR,MAHARASHTRA
"YES BANK",YESB0CDC039,NA,"THE CHANDRAPUR DCC BANK SINDEWAHI","AT POST TAL SINDEWAHI DIST CHANDRAPUR  PIN- 441222",9422913300,SINDEWAHI,CHANDRAPUR,MAHARASHTRA
"YES BANK",YESB0CDC038,NA,"THE CHANDRAPUR DCC BANK SHEGAV","AT POST SHEGAV TAH CHIMUR DIST CHANDRAPURPIN -442908",9271619749,SHEGAON,CHANDRAPUR,MAHARASHTRA
"YES BANK",YESB0CDC037,NA,"THE CHANDRAPUR DCC BANK SHANKARPUR","AT PO SHANKARPUR TAH CHIMUR DIST CHANDRAPUR  PIN-442903",7875759016,SHANKERPUR,CHANDRAPUR,MAHARASHTRA
"YES BANK",YESB0CDC036,NA,"THE CHANDRAPUR DCC BANK SAOLI","AT POST SAOLI TAH SAOLI DIST CHANDRAPUR  PIN-441225",7875758841,SAOLI,CHANDRAPUR,MAHARASHTRA
"YES BANK",YESB0CDC035,NA,"THE CHANDRAPUR DCC BANK RAJURA","AT PO RAJURA TAH RAJURA DIST CHANDRAPUR  PIN-442905",7875758810,RAJURA,CHANDRAPUR,MAHARASHTRA
"YES BANK",YESB0CDC034,NA,"THE CHANDRAPUR DCC BANK RAJOLI","AT POST RAJOLI TAH MUL DIST CHANDRAPUR  PIN- 441212",7875759241,RAJOLI,CHANDRAPUR,MAHARASHTRA
"YES BANK",YESB0CDC033,NA,"THE CHANDRAPUR DCC BANK POMBHURNA","AT POST TAH POMBHURNA DIST CHANDRAPUR  PIN- 442506",7875758804,POMBHURNA,CHANDRAPUR,MAHARASHTRA
"YES BANK",YESB0CDC032,NA,"THE CHANDRAPUR DCC BANK PIMPALGAO","AT POST PIMPALGAV TAH BRAMHAPURI DIST CHANDRAPUR  PIN- 441206",9561085423,BRAHMAPURI,CHANDRAPUR,MAHARASHTRA
"YES BANK",YESB0CDC031,NA,"THE CHANDRAPUR DCC BANK PATHARI","AT POST PATHARI TAH SAOLI  DIST CHANDRAPUR  PIN-441215",9421815357,PATHARI,CHANDRAPUR,MAHARASHTRA
"YES BANK",YESB0CDC030,NA,"THE CHANDRAPUR DCC BANK OF CHANDA","AT PO. BHADRAWATI TAH BHADRAWATI DIST CHANDRAPUR  PIN-442902",9764414010,BHADRAVATI,CHANDRAPUR,MAHARASHTRA
"YES BANK",YESB0CDC029,NA,"THE CHANDRAPUR DCC BANK NERI","AT POST NERI TAH CHIMUR DIST CHANDRAPUR  PIN- 442904",7875759115,NERI,CHANDRAPUR,MAHARASHTRA
"YES BANK",YESB0CDC028,NA,"THE CHANDRAPUR DCC BANK NAVARGAON","AT POST NAVARGAON TAH SINDEWAHI DIST CHANDRAPUR  PIN-441223",9421719944,NAVARGAON,CHANDRAPUR,MAHARASHTRA
"YES BANK",YESB0CDC027,NA,"THE CHANDRAPUR DCC BANK NANDAFATA","AT POST NANADAFATA TAH KORPANA DIST CHANDRAPUR  PIN-442917",7875759261,KORPANA,CHANDRAPUR,MAHARASHTRA
"YES BANK",YESB0CDC026,NA,"THE CHANDRAPUR DCC BANK NAGBHEED","AT POST NAGBHEED TAH NAGBHEED DIST CHANDRAPUR  PIN- 441205",7875758973,NAGBHIR,CHANDRAPUR,MAHARASHTRA
"YES BANK",YESB0CDC025,NA,"THE CHANDRAPUR DCC BANK NAGARI","AT POST NAGARI  TAH WARORA DIST CHANDRAPUR  PIN-44292",9765206363,NAGRI,CHANDRAPUR,MAHARASHTRA
"YES BANK",YESB0CDC024,NA,"THE CHANDRAPUR DCC BANK MUL","AT POST MUL TAH MUL DIST CHANDRAPUR  PIN-441212",7875759141,MUL,CHANDRAPUR,MAHARASHTRA
"YES BANK",YESB0CDC023,NA,"THE CHANDRAPUR DCC BANK MAJARI","AT POST MAJARI TAH BHADRAWATI DIST CHANDRAPUR  PIN- 442503",9767104201,BHADRAVATI,CHANDRAPUR,MAHARASHTRA
"YES BANK",YESB0CDC022,NA,"THE CHANDRAPUR DCC BANK MAHILA","AT SHSTRINAGAR MUL ROAD CHANDRAPUR PIN 442401",7875758904,CHANDRAPUR,CHANDRAPUR,MAHARASHTRA
"YES BANK",YESB0CDC021,NA,"THE CHANDRAPUR DCC BANK MADHELI","AT PO MADHELI  TAH WARORA DIST CHANDRAPUR  PIN -442910",7875759026,MADHELI,CHANDRAPUR,MAHARASHTRA
"YES BANK",YESB0CDC020,NA,"THE CHANDRAPUR DCC BANK KOTHARI","AT POST KOTHARI  TAH BALLARSHA DIST CHANDRAPUR  PIN- 442701",7875759120,KOTHARI,CHANDRAPUR,MAHARASHTRA
"YES BANK",YESB0CDC019,NA,"THE CHANDRAPUR DCC BANK KORPANA","AT PO KORPANA TAH KORPANA DIST CHANDRAPUR PIN-442916",7875758993,KORPANA,CHANDRAPUR,MAHARASHTRA
"YES BANK",YESB0CDC018,NA,"THE CHANDRAPUR DCC BANK KHAMBADA","AT POST KHAMBADA TAH WARORA DIST CHANDRAPUR  PIN- 442907",7875759049,KHAMBADA,CHANDRAPUR,MAHARASHTRA
"YES BANK",YESB0CDC017,NA,"THE CHANDRAPUR DCC BANK KHADSANGI","AT POST KHADASANGI TAH CHIMUR DIST CHANDRAPUR  PIN- 442906",8805915767,CHIMUR,CHANDRAPUR,MAHARASHTRA
"YES BANK",YESB0CDC016,NA,"THE CHANDRAPUR DCC BANK HO BANKING","CIVIL LINES NAGPUR ROAD CHANDRAPUR PIN 442402",7875758833,CHANDRAPUR,CHANDRAPUR,MAHARASHTRA
"YES BANK",YESB0CDC015,NA,"THE CHANDRAPUR DCC BANK GONDPIPARI","AT POST-TAH- GONDPIPARI DIST CHANDRAPUR  PIN-442702",9405504589,GONDPIPARI,CHANDRAPUR,MAHARASHTRA
"YES BANK",YESB0CDC014,NA,"THE CHANDRAPUR DCC BANK GHUGGUS","AT PO GUGGHUS TAH ┬ûGHUGGUS DIST CHANDRAPUR  PIN - 442505",9422835530,GHUGUS,CHANDRAPUR,MAHARASHTRA
"YES BANK",YESB0CDC013,NA,"THE CHANDRAPUR DCC BANK GHODPETH","AT POST GHODPETH TAH BHADRAWATI DIST CHANDRAPUR  PIN-442902",7875759085,GHODPETH,CHANDRAPUR,MAHARASHTRA
"YES BANK",YESB0CDC012,NA,"THE CHANDRAPUR DCC BANK GANGALWADI","AT POST GANGALWADI  TAH BRAMHAPURI DIST CHANDRAPUR  PIN-441206",7875758930,GANGALWADI,CHANDRAPUR,MAHARASHTRA
"YES BANK",YESB0CDC011,NA,"THE CHANDRAPUR DCC BANK GADCHANDUR","AT POST GADCHANDUR TAH KORPANA DIST CHANDRAPUR  PIN- 442908",9657383912,GADCHANDUR,CHANDRAPUR,MAHARASHTRA
"YES BANK",YESB0CDC010,NA,"THE CHANDRAPUR DCC BANK DURGAPUR","AT POST DURGAPUR DIST CHANDRAPUR PIN 442402",7875758871,DURGAPUR,CHANDRAPUR,MAHARASHTRA
"YES BANK",YESB0CDC009,NA,"THE CHANDRAPUR DCC BANK DHABA","AT POST DHABA TAH GONDPIPARI DIST CHANDRAPUR  PIN-442702",7875759113,GONDPIPARI,CHANDRAPUR,MAHARASHTRA
"YES BANK",YESB0CDC008,NA,"THE CHANDRAPUR DCC BANK CITY BRANCH","OPP JAIN BHAWAN AT PO CHANDRAPUR DIST CHANDRAPUR 442401",9766832893,CHANDRAPUR,CHANDRAPUR,MAHARASHTRA
"YES BANK",YESB0CDC007,NA,"THE CHANDRAPUR DCC BANK CHIMUR","AT PO TAH CHIMUR DIST CHIMUR  PIN ┬û 442903",9420303195,CHIMUR,CHANDRAPUR,MAHARASHTRA
"YES BANK",YESB0CDC006,NA,"THE CHANDRAPUR DCC BANK BRAMHAPURI","AT POST BRAMHAPURI TAH BRAMHAPURI DIST CHANDRAPUR  PIN-441206",7875758928,BRAHMAPURI,CHANDRAPUR,MAHARASHTRA
"YES BANK",YESB0CDC005,NA,"THE CHANDRAPUR DCC BANK BHISI","AT PO BHISI TAH CHIMUR DIST CHANDRAPUR  PIN- 442903",9545850331,BHISI,CHANDRAPUR,MAHARASHTRA
"YES BANK",YESB0CDC004,NA,"THE CHANDRAPUR DCC BANK B TALODHI","AT POST BHANGARAM TALODHI  TAH GONDPIPARI DIST CHANDRAPUR  PIN- 442702",9422947416,"BHANGARAM TALADHI",CHANDRAPUR,MAHARASHTRA
"YES BANK",YESB0CDC003,NA,"THE CHANDRAPUR DCC BANK BHADRAWATI","AT POST BHADRAWATI TAH BHADRAWATI DIST CHANDRAPUR  PIN- 442902",7875759072,BHADRAVATI,CHANDRAPUR,MAHARASHTRA
"YES BANK",YESB0CDC002,NA,"THE CHANDRAPUR DCC BANK BALLARSHA","AT POST BALLARSHAH PIN CODE 442701",7875758813,CHANDRAPUR,CHANDRAPUR,MAHARASHTRA
"YES BANK",YESB0CDC001,NA,"THE CHANDRAPUR DCC BANK BABUPETH","AT POST BABUPETH PIN CODE 442403",9422137359,CHANDRAPUR,CHANDRAPUR,MAHARASHTRA
"YES BANK",YESB0CCUB19,444824202,"CHIKHLI URBAN COOP BANK WASHIM","PRATHMESH ICON COMP NAGAR PARISHAD RD WAHIM 444505",9168333370,WASHIM,AHM,MAHARASHTRA
"YES BANK",YESB0CCUB18,431800003,"CHIKHLI URBAN COOP BANK WALUJ","PLOT NO X 142 MIDC WALUJ 431136",9168333310,WALUJ,AURANGABAD,MAHARASHTRA
"YES BANK",YESB0CCUB17,444824002,"CHIKHLI URBAN COOP BANK SHIVNI","NH 6 MURTIZAPUR ROAD SHIVNI AKOLA 444001",9011065917,SHIVANI,AKOLA,MAHARASHTRA
"YES BANK",YESB0CCUB16,NA,"CHIKHLI URBAN COOP BANK AURANGABAD","GOMTESH MARKET GULMANDI PAITHAN GATE ROAD 431001",9011065916,AURANGABAD,AURANGABAD,MAHARASHTRA
"YES BANK",YESB0CCUB15,NA,"CHIKHLI URBAN COOP BANK M YARDJALNA","M.YARD COMPOUND AT PO.JALNA TQ.JALNA 431203",9011065915,JALNA,JALNA,MAHARASHTRA
"YES BANK",YESB0CCUB14,443803503,"CHIKHLI URBAN COOP BANK JAFRABAD","SHIVAJI CHOWK DEOLGAON RAJA ROAD JAFRABAD 431206",9011065914,JAFERABAD,JALNA,MAHARASHTRA
"YES BANK",YESB0CCUB13,443800502,"CHIKHLI URBAN COOP BANK PHULAMBRI","NEAR POLICE STATION AT.PO.PHULAMBRI 431111",9011065913,PHULAMBRI,AURANGABAD,MAHARASHTRA
"YES BANK",YESB0CCUB12,443803502,"CHIKHLI URBAN COOP BANK AMBAD","CHAKRI CHOWK AT PO.AMBAD 431204",9011065912,AMBAD,JALNA,MAHARASHTRA
"YES BANK",YESB0CCUB11,443803052,"CHIKHLI URBAN COOP BANK JALNA","JINDAL MARKET 431203",9011065911,JALNA,JALNA,MAHARASHTRA
"YES BANK",YESB0CCUB10,443803501,"CHIKHLI URBAN COOP BANK BHOKARDAN","SILLOD ROAD AT.PO.BHOKARDAN 431114",9011065910,BHOKARDAN,JALNA,MAHARASHTRA
"YES BANK",YESB0CCUB09,443800501,"CHIKHLI URBAN COOP BANK SILLOD","SARAFA BAZAR AT.PO.SILLOD 431112",9011065909,SILLOD,AURANGABAD,MAHARASHTRA
"YES BANK",YESB0CCUB08,NA,"CHIKHLI URBAN COOP BANK SINDKHED","MEHKAR ROAD,SINDHKHED RAJA 443203",9011065908,"SINDKHED RAJA",BULDHANA,MAHARASHTRA
"YES BANK",YESB0CCUB07,NA,"CHIKHLI URBAN COOP BANK DULGAONMAHI","JALNA ROAD DEULGAON MAHI BULDANA 443206",9011065907,"DEULGAON MAHI",BULDHANA,MAHARASHTRA
"YES BANK",YESB0CCUB06,NA,"CHIKHLI URBAN COOP BANK BULDANA","JAISTAMBHA CHOWK BULDANA 443001",9011022555,BULDHANA,BULDHANA,MAHARASHTRA
"YES BANK",YESB0CCUB05,NA,"CHIKHLI URBAN COOP BANK DONGAON","MALEGAON ROAD AT PO.DONGAON BULDANA 443303",9011065905,DONGAON,BULDHANA,MAHARASHTRA
"YES BANK",YESB0CCUB04,NA,"CHIKHLI URBAN COOP BANK S KHERDA","NEAR BUS STAND AT PO.S.KHERDA BULDANA 443202",9011065904,SAKHARKHERDA,BULDHANA,MAHARASHTRA
"YES BANK",YESB0CCUB03,NA,"CHIKHLI URBAN COOP BANK DHAD","AURANGABAD ROAD AT POST DHAD TQ BULDANA 443106",9011065903,DHAD,BULDHANA,MAHARASHTRA
"YES BANK",YESB0CCUB02,NA,"CHIKHLI URBAN COOP BANK DEOLGAON","AHINSA MARG DEULGAON RAJA BULDANA 443204",9011065902,"DEULGAON RAJA",BULDHANA,MAHARASHTRA
"YES BANK",YESB0CCUB01,NA,"CHIKHLI URBAN COOP BANK CHIKHLI","DR.SHAYAMAPRASAD MUKHARJEE MARG CHIKHLI 443201",9011065901,CHIKHLI,BULDHANA,MAHARASHTRA
"YES BANK",YESB0CCCB39,NA,"THE CUTTACK CCB DASARATHPUR","AT-PO-DASARATHPUR,755014",254821,DASARATHPUR,JAJPUR,ODISHA
"YES BANK",YESB0CCCB38,NA,"THE CUTTACK CCB BALICHANDRAPUR","AT-PO-BALICHANDRAPUR,754205",276802,BALICHANDRAPUR,JAJPUR,ODISHA
"YES BANK",YESB0CCCB37,NA,"THE CUTTACK CCB BINJHARPUR","AT-PO-BINJHARPUR,755004",230404,BINJHARPUR,JAJPUR,ODISHA
"YES BANK",YESB0CCCB36,NA,"THE CUTTACK CCB SUKINDA","AT-PO-DUBURI,755026",245723,SUKINDA,JAJPUR,ODISHA
"YES BANK",YESB0CCCB35,NA,"THE CUTTACK CCB JAJPUR ROAD","AT-PO-JAJPUR ROAD,755019",220306,"JAJPUR ROAD",JAJPUR,ODISHA
"YES BANK",YESB0CCCB34,NA,"THE CUTTACK CCB JAJPUR TOWN","AT-PO-JAJPUR TOWN,755001",222015,"JAJPUR TOWN",JAJPUR,ODISHA
"YES BANK",YESB0CCCB33,NA,"THE CUTTACK CCB BARI","AT-PO-RAMACHANDRAPUR,755003",246625,BAIRI,JAJPUR,ODISHA
"YES BANK",YESB0CCCB32,NA,"THE CUTTACK CCB RASALPUR","AT-KUAKHIA-PO-RASALPUR,755009",271033,KUAKHIA,JAJPUR,ODISHA
"YES BANK",YESB0CCCB31,NA,"THE CUTTACK CCB DHARMASALA","AT-PO-JARAKA,755050",283043,DHARMASALA,JAJPUR,ODISHA
"YES BANK",YESB0CCCB30,NA,"THE CUTTACK CCB BADACHANA","AT-PO-CHANDIKHOL,754296",226295,BARACHANA,JAJPUR,ODISHA
"YES BANK",YESB0CCCB29,NA,"THE CUTTACK CCB RAJKANIKA","AT-PO-RAJKANIKA,754220",278438,RAJKANIKA,KENDRAPARA,ODISHA
"YES BANK",YESB0CCCB28,NA,"THE CUTTACK CCB AUL","AT-PO-AUL,754219",271128,AUL,KENDRAPARA,ODISHA
"YES BANK",YESB0CCCB27,NA,"THE CUTTACK CCB RAJNAGAR","AT-PO-RAJANAGAR,754225",272428,RAJNAGAR,KENDRAPARA,ODISHA
"YES BANK",YESB0CCCB26,NA,"THE CUTTACK CCB CHANDOL","AT-PO-CHANDOL,754208",268414,CHANDOL,KENDRAPARA,ODISHA
"YES BANK",YESB0CCCB25,NA,"THE CUTTACK CCB PATKURA","AT-PO-KORUA VIA-TYNDAKUL,754134",276525,PATAKURA,KENDRAPARA,ODISHA
"YES BANK",YESB0CCCB24,NA,"THE CUTTACK CCB PATTAMUNDAI","AT-PO-PATTAMUNDAI,754215",224219,PATTAMUNDAI,KENDRAPARA,ODISHA
"YES BANK",YESB0CCCB23,NA,"THE CUTTACK CCB MAHAKALPADA","AT-PO-MAHAKALPARA,754224",271341,MAHAKALPADA,KENDRAPARA,ODISHA
"YES BANK",YESB0CCCB22,NA,"THE CUTTACK CCB MARSHGHAI","AT-PO-MARSAGHAI,754211",272005,MARSAGHAI,KENDRAPARA,ODISHA
"YES BANK",YESB0CCCB21,NA,"THE CUTTACK CCB KENDRAPADA","AT-PO-KENDRAPADA OLD BUS STAND,754211",232226,KENDRAPARA,KENDRAPARA,ODISHA
"YES BANK",YESB0CCCB20,NA,"THE CUTTACK CCB PARADEEP","AT-BADAPADIA BANK LINE-PO-PARADEEP,754142",222157,PARADEEP,JAGATSINGHPUR,ODISHA
