BANK,IFSC,MICR,BRANCH,ADDRESS,CONTACT,CITY,DISTRICT,STATE
"ICICI BANK LIMITED",ICIC0TREA00,NA,RTGS-HO,"ICICI BANK TOWERS, BANDRA KURLA COMPLEX, MUMBAI 400051",0,MUMBAI,"GREATER BOMBAY",MAHARASHTRA
"ICICI BANK LIMITED",ICIC0SF0002,NA,CMS,"ICICI BANK TOWERS, BANDRA KURLA COMPLEX, BANDRA E,MUMBAI-400051",0,MUMBAI,"GREATER BOMBAY",MAHARASHTRA
"ICICI BANK LIMITED",ICIC00ZSMAU,272801103,"ZILA SAHAKARI BANK LTD MAU","ZILA SAHAKARI BANK LTD,  275, INDIRA COMPLEX, 2ND FLOOR, SAHADATPURA, MAU ┬û 275001",0,SAHADATPURA,MAU,"UTTAR PRADESH"
"ICICI BANK LIMITED",ICIC00ZSKTW,246810802,"ZILA SAHAKARI BANK LTD, GARHWAL (KOTDWARA)","MAIN BRANCH BADRINATH MARG, KOTDWARA, UTTARAKHAND-246149",0,KOTDWARA,GARHWAL,UTTARAKHAND
"ICICI BANK LIMITED",ICIC00ZSBLL,226185252,"ZILA SAHKARI BANK LTD LUCKNOW","JAGDISH BUILDING HAZRATGANJ LUCKNOW 226001",8756400205,LUCKNOW,LUCKNOW,"UTTAR PRADESH"
"ICICI BANK LIMITED",ICIC00ZSBLJ,284802002,"ZILA SAHKARI BANK LTD, JHANSI","156/1 CIVIL LINES JHANSI (U.P) -  284001",0,JHANSI,JHANSI,"UTTAR PRADESH"
"ICICI BANK LIMITED",ICIC00ZSBLG,233802002,"ZILA SAHKARI BANK LTD, GHAZIPUR","NEAR KACHERA,GHAZIPUR-233001",9415627238,GHAZIPUR,GHAZIPUR,"UTTAR PRADESH"
"ICICI BANK LIMITED",ICIC00ZSBLB,243802000,"ZILA SAHAKARI BANK LTD, BAREILLY","ICICI BANK LTD.,H.O., SHAHJAHANPUR ROAD, NEAR MADHUBAN TALKIES, BAREILLY 243005",0,BAREILLY,BAREILLY,"UTTAR PRADESH"
"ICICI BANK LIMITED",ICIC00ZSBLA,NA,"ZILA SAHKARI BANK LTD, AZAMGARH","NEAR NAGAR PALIKA,CIVIL LINES,AZAMGARH-276001",9451869390,AZAMGARH,AZAMGARH,"UTTAR PRADESH"
"ICICI BANK LIMITED",ICIC00ZSBJR,NA,"ZILA SAHKARI BANK LTD, JAUNPUR","COLLECTORATE COMPOUND,JAUNPUR",9412405584,JAUNPUR,JAUNPUR,"UTTAR PRADESH"
"ICICI BANK LIMITED",ICIC00ZSBHA,247810102,"ZILA SAHAKARI BANK LTD, HARIDWAR","ZILA SAHAKARI BANK LIMITED HARIDWAR, H.O.- B.T. GANJ ROORKEE,DISTT HARIDWAR(UTTARAKHAND)-247667",0,ROORKEE,HARIDWAR,UTTARAKHAND
"ICICI BANK LIMITED",ICIC00ZSBBU,274801202,"ZILA SAHKARI BANK LTD BUDAUN","SAHAKARI BANK BHAWAN FIRST FLOOR STATION ROAD CIVIL LINE BUDAUN 243601",9411815573,BADAUN,BUDAUN,"UTTAR PRADESH"
"ICICI BANK LIMITED",ICIC00WZPEC,442804001,"WARDHA ZILLA PARISHAD EMPLOYEES URBAN CO-OP BANK","MAHADEOPURA JAMA MASJID CHOWK WARDHA TAH.WARDHA DIST.WARDHA",232896,WARDHA,WARDHA,MAHARASHTRA
"ICICI BANK LIMITED",ICIC00WUCBL,NA,"WARANGAL URBAN COOP BANK LIMITED","H.NO.11 15 107 1ST FLOOR O CITY ROAD KASHIBUGGA WARANGAL 506002",2423388,WARANGAL,WARANGAL,TELANGANA
"ICICI BANK LIMITED",ICIC00VSCBL,583229251,"VIKAS SOUHARDA CO OPERATIVE BANK LTD","OPP SRIRAMULU PARK, STATION ROAD, HOSEPT ┬û 583201",0,HOSPET,BELLARY,KARNATAKA
"ICICI BANK LIMITED",ICIC00VNSBU,NA,"VIKRAMADITYA NAGRIK SAHKARI BANK LTD.","VIKRAMADITYA CLOTH MARKET FAZALPURA UJJAIN ( M.P)456001",0,UJJAIN,UJJAIN,"MADHYA PRADESH"
"ICICI BANK LIMITED",ICIC00VNSBL,465827051,"VIVEKANAND NAGRIK SAHKARI BANK MARYADIT","SHUJALPUR MANDI, NEAR POLICESTATION, SHUJALPUR ,DIST ┬û SHAJAPUR, PIN- 465333",0,SHUJALPUR,SHAJAPUR,"MADHYA PRADESH"
"ICICI BANK LIMITED",ICIC00VMNSB,396803001,"THE VALSAD MAHILA NAGRIK SAHAKARI BANK LTD","MATRUPARAG,AZAD CHAWK,VALSAD,GUJARAT-3960001",0,VAPI,VALSAD,GUJARAT
"ICICI BANK LIMITED",ICIC00VMCBL,416601151,"THE VITA MERCHANTS CO-OP BANK LTD","YASHWANTNAGAR, SALSHINGE ROAD, VITA, DIST ┬û SANGLI (MAHARASHTRA) ┬û 416601",0,VITA,SANGLI,MAHARASHTRA
"ICICI BANK LIMITED",ICIC00VIKAS,581890501,"VIKAS URBAN COOPERATIVE BANK NIYAMITHA","RAMANATH COMPLEX MAIN ROAD YELLAPUR ( U.K. ) -581359",261497,YELLAPUR,"UTTAR KANNAD",KARNATAKA
"ICICI BANK LIMITED",ICIC00VDCBL,221299001,"DISTRICT COOPERATIVE BANK LTD,VARANASI","DISTRICT COOPERATIVE BANK LTD,VARANASI TELIYABAGH , VARANASI",5422203261,VARANASI,VARANASI,"UTTAR PRADESH"
"ICICI BANK LIMITED",ICIC00VBLTR,NA,"VIKAS COOPERATIVE BANK LTD","1ST FLOOR APANG SARATHI BUILDING JIVAN VIKAS PRATISHTHAN GANDHI MAIDAN LATUR 413512",255505,LATUR,LATUR,MAHARASHTRA
"ICICI BANK LIMITED",ICIC00VANSB,NA,"VAISHYA NAGARI","SARDAR PATEL ROAD KACCHI BAZAR PARBHANI 431401.",9423442389,PARBHANI,PARBHANI,MAHARASHTRA
"ICICI BANK LIMITED",ICIC00USNDC,263812203,"UDHAM SINGH NAGAR DISTRICT CO-OPERATIVE BANK LTD","HOUSE NO. S.R.A-3, KASHIPUR BYPASS ROAD, RUDRAPUR, DIST ┬û UDHAM SINGH NAGAR",0,RUDRAPUR,"UDHAM SINGH NAGAR",UTTARAKHAND
"ICICI BANK LIMITED",ICIC00USCBD,248554002,"UTTRAKHAND STATE CO-COPERATIVE BANK LTD","4 VISHNU VIHAR AJABPUR KALAN BYPASS ROAD DEHRADUN,UTTARANCHAL",0,DEHRADUN,"DEHRA DUN",UTTARAKHAND
"ICICI BANK LIMITED",ICIC00UPSCB,226185002,"UTTAR PRADESH STATE COOPERATIVE BANK LTD","2,MAHATMA GANDHI MARG LUCKNOW-226001,UTTAR PRADESH",0,LUCKNOW,LUCKNOW,"UTTAR PRADESH"
"ICICI BANK LIMITED",ICIC00UNICB,NA,"THE UNION CO-OPERATIVE BANK LTD","KS RD,MAHINAGAR MALANCHA,MAHINAGAR KOLKATA-700145",3324370268,KOLKATA,KOLKATA,"WEST BENGAL"
"ICICI BANK LIMITED",ICIC00UMUCB,313581002,"UDAIPUR MAHILA URBAN CO-OP BANK LTD","MAHAVIR BHAWAN, NEAR ASHWANI BAZAR, UDAIPUR RAJASTHAN -313001",0,UDAIPUR,UDAIPUR,RAJASTHAN
"ICICI BANK LIMITED",ICIC00UDCCB,NA,"THE DISTRICT COOPERATIVE BANK LTD, UNNAO","DHAWAN ROAD UNNAO,(U.P) ┬û 209801",0,UNNAO,UNNAO,"UTTAR PRADESH"
"ICICI BANK LIMITED",ICIC00UCBLD,WAITING,"THE URBAN CO-OP BANK LTD","THE URBAN CO OP BANK LTD NEAR S T STAND DHARANGAON",251241,DHARANGAON,JALGAON,MAHARASHTRA
"ICICI BANK LIMITED",ICIC00TVUCB,NA,"THE VITA URBAN CO OP BANK LTD","A P- VITA TAL-KHANAPUR DIST SANGLI 415311",2347272072,VITA,SANGLI,MAHARASHTRA
"ICICI BANK LIMITED",ICIC00TVSBL,416828200,"THE VYANKATESHWARA SAHAKARI BANK LTD","10 167 TIRUPATI BUILDING 1ST FLOOR MAIN ROAD ICHALKARANJI",2302422338,ICHALKARNJI,KOLHAPUR,MAHARASHTRA
"ICICI BANK LIMITED",ICIC00TVCBL,361805001,"THE VARDHMAN CO-OPERATIVE BANK LTD","JAYLABH COMPLEX, CHANDI BAZAR, JAMNAGAR ┬û 361001",0,JAMNAGAR,JAMNAGAR,GUJARAT
"ICICI BANK LIMITED",ICIC00TUCBS,NA,"THE URBAN CO-OPERATIVE BANK LTD","OLD SANTHE MAIDANA SHIKARIPURA-577427 SHIVAMOGGA DIST KARNATAKA",222264,SHIMOGA,SHIMOGA,KARNATAKA
"ICICI BANK LIMITED",ICIC00TUCBL,NA,"THE TIRUR URBAN CO-OPERATIVE BANK LTD","37/450 MANNAYIL ARCADE GOVT.HOSPITAL ROAD TRIKKANDIYUR TIRUR-676104 MALAPPURAM KERALA",0,TIROOR,MALAPPURAM,KERALA
"ICICI BANK LIMITED",ICIC00TUCBD,425828501,"THE URBAN CO OP BANK LTD DHARANGAON","PLOT NO 1257 A/G/I NEAR BUS STAND TAL DHARANGAON DIST JALGAON MAIN ROAD DHARANGAON MAHARASHTRA INDIA 425105",9225816668,DHARANGAON,JALGAON,MAHARASHTRA
"ICICI BANK LIMITED",ICIC00TTNSB,NA,"THE TALOD NAGARIK SAHAKARI BANK LTD","MANAGER NAGARIK BANK,NEAR PURNIMA PRESS-TALOD,GUJARAT,INDIA-383215",2770221485,TALOD,"SABAR KANTHA",GUJARAT
"ICICI BANK LIMITED",ICIC00TTCBL,NA,"THE TIRUPATI CO-OPERATIVE BANK LIMITED","MAIN OFFICE 23 G.CAR STREET TIRUPATI AP",8772221549,TIRUPATI,CHITTOOR,"ANDHRA PRADESH"
"ICICI BANK LIMITED",ICIC00TSMCB,NA,"THE SATANA MERCHANTS COOP BANK LTD","DHANLAXMI TAHARABAD RD.SATANA NASHIK MAHARASHTRA - 423301",8275023537,SATANA,NASIK,MAHARASHTRA
"ICICI BANK LIMITED",ICIC00TSCBL,799637017,"TRIPURA STATE CO-OPERATIVE BANK LIMITED","POST OFFICE CHOWMOHANI, AGARTALA, PIN ┬û 799001",0,AGARTALA,"WEST TRIPURA",TRIPURA
"ICICI BANK LIMITED",ICIC00TPZCB,WAITING,"THE THODUPUZHA CO OP BANK LTD","394, NEW BUILDING OPP SHRIKRISHANA TEMPLE THODUPUZHA.",228593,IDIKKI,IDUKKI,KERALA
"ICICI BANK LIMITED",ICIC00TPUCB,160346251,"THE PANCHKULA URBAN COOPERATIVE BANK LTD.","SCF NO-75 SECTOR 10 PANCHKULA",1722560119,PANCHKULA,PANCHKULA,HARYANA
"ICICI BANK LIMITED",ICIC00TPCBL,388814161,"THASRA PEOPLES CO-OP.BANK LTD","THASRA-388 250,DIST-KAIRA,GUJARAT.",0,THASRA,KHEDA,GUJARAT
"ICICI BANK LIMITED",ICIC00TNSBL,413820127,"TERNA NAGARI SAHAKARI BANK LTD. OSMANABAD","GORE COMPLEX SAMATA NAGAR OSMANABD PIN 413501",2472228807,OSMANABAD,OSMANABAD,MAHARASHTRA
"ICICI BANK LIMITED",ICIC00TMUCB,NA,"THE MAYANI URBAN COOP BANK LTD","A/P MAYANI, TAL ┬û KHATAV, MAYANI ┬û 415102, DIST SATARA,",0,MAYANI,SATARA,MAHARASHTRA
"ICICI BANK LIMITED",ICIC00TMUBG,NA,"THE MERCHANTS URBAN CO-OP BANK LTD-GADAG","APMC ROAD GADAG-582101",278530,GADAG,GADAG,KARNATAKA
"ICICI BANK LIMITED",ICIC00TKNSB,391803101,"THE KARJAN NAGARIK SAHAKARI BANK LTD","OPP. NILKANTHESHVAR MAHADEV, NEAR HIGH SCHOOL, NAVA BAZAR, KARJAN ┬û 391240",0,KARJAN,VADODARA,GUJARAT
"ICICI BANK LIMITED",ICIC00TJUCB,587002251,"THE JAMKHANDI URBAN CO-OPERATIVE BANK LTD","UMARAMESHWAR ROAD JAMKHANDI-587301",220017,AHMADNAGAR,AHMADNAGAR,MAHARASHTRA
"ICICI BANK LIMITED",ICIC00TGZSB,249804202,"TEHRI GARHWAL ZILA SAHAKARI BANK LTD","HEAD OFFICE : NEW TEHRI COUT CAMPUS TEHRI GARHWAL UTTARAKHAND",0,TEHRI,"TEHRI GARHWAL",UTTARAKHAND
"ICICI BANK LIMITED",ICIC00TGUCB,NA,"THE GODHRA URBAN COOPERATIVE BANK LTD","RANAVYAS MARG,NR.BETHAK MANDIR,GODHRA",2672241571,GODHRA,"PANCH MAHALS",GUJARAT
"ICICI BANK LIMITED",ICIC00TGMUC,251852002,"THE GANGA MERCANTILE URBAN COOPERATIVE BANK LTD","MAHAMANA MALVIYA INTER COLLEGE COMPLEX OPP SOLDIER BOARD MUZAFFARNAGAR,UTTAR PRADESH",9219440576,MUZAFFARNAGAR,MUZAFFARNAGAR,"UTTAR PRADESH"
"ICICI BANK LIMITED",ICIC00TECUB,534634002,"THE ELURU URBAN COOP BANK LIMITED","D.NO.4 1 14 CANAL ROAD AGRAHARAM ELURU 534001",230143,ELURU,"WEST GODAVARI","ANDHRA PRADESH"
"ICICI BANK LIMITED",ICIC00TDMCB,422372254,"THE DEOLA MERCHANTS COOP BANK LTD","N 53-A51/19/1+2+3 UTTAM NAGAR CIDCO, C/O RAMDAS PLAZA, NEAR UTTAM NAGAR BUS STOP, NASHIK - 422009",0,NASHIK,NASIK,MAHARASHTRA
"ICICI BANK LIMITED",ICIC00TBHCB,NA,"THE BHAGYODAYA COOPERATIVE BANK LTD","THE BHAGYODAYA COOPERATIVE BANK LTD. NAVA MADHAVPURA, NR. DELHI DARWAJA, AHMEDABAD 380004",7922138235,AHMEDABAD,AHMADABAD,GUJARAT
"ICICI BANK LIMITED",ICIC00TAMCO,NA,"THE ANAND MERCANTILE CO-OP BANK","MERCANTILE,MAHARSHI DAYANAND MARG,P B NO 38,ANAND 388001,GUJARAT",269242812,ANAND,ANAND,GUJARAT
"ICICI BANK LIMITED",ICIC00SVCBL,NA,"SHREE VYANKATESH CO OP BANK LIMITED MALEGAON","MKT YD KRISHI UTPANA BAZAR SAMEETY AWAR MALEGAON 423203",2554251003,NASHIK,NASIK,MAHARASHTRA
"ICICI BANK LIMITED",ICIC00SULCB,390325002,"SULAIMANI CO OP BANK LTD","RASULKHAN PATHAN ROAD MOGALWADA VADODARA 390017",9879292044,VADODARA,VADODARA,GUJARAT
"ICICI BANK LIMITED",ICIC00SUCBO,413819127,"SAMARTH URBAN COOP BANK LTD","KALA MARUTI CHOWK MAIN ROAD OSMANABAD-413501",2472224191,OSMANABAD,OSMANABAD,MAHARASHTRA
"ICICI BANK LIMITED",ICIC00SUCBL,586853501,"THE SINDAGI URBAN CO-OP BANK LTD","BANK ROAD SINDAGI,BIJAPUR,KARNATAKA-586128",9986265490,SINDGI,BIJAPUR,KARNATAKA
"ICICI BANK LIMITED",ICIC00SSKCB,NA,"THE SSK CO OP BANK LTD","THE SSK CO OP BANK LTD SHARSHARJUN COMPLEX DAJIBANPETH HUBLI KARNATAKA-580028",8362363270,HUBLI-DHARWAD,DHARWAD,KARNATAKA
"ICICI BANK LIMITED",ICIC00SSBLI,WAITING,"SANMATI SAHAKARI BANK LTD ICHALKARANJI","7-111, LAXMI MARKET,MAIN ROAD,JANTA CHAWK, ICHALKARNJI.416115.",8805029772,ICHALKARANJI,KOLHAPUR,MAHARASHTRA
"ICICI BANK LIMITED",ICIC00SPCBL,380118300,"THE SUVIKAS PEOPLE'S CO-OPERATIVE BANK LTD","2ND FLOOR, SUN COMPLEX, NEAR STADIUM CIRCLE, C.G. ROAD, NAVRANGPURA, AHMEDABAD ┬û 380009,GUJRAT",0,AHMEDABAD,AHMADABAD,GUJARAT
"ICICI BANK LIMITED",ICIC00SNSBL,391804501,"THE SINOR NAGARIK SAHAKARI BANK LTD","AT & TA & PO - SINOR -391115  DIST ? BARODA  GUJARAT",0,SINOR,VADODARA,GUJARAT
"ICICI BANK LIMITED",ICIC00SMSBL,415816151,"SHRIMANT MALOJIRAJE SAHAKARI BANK LTD","MUDHOJI MANMOHAN RAJWADA PARISAR, PHALTAN ┬û 415523 , DIST SATARA,MAHARASHTRA",0,PHALTAN,SATARA,MAHARASHTRA
"ICICI BANK LIMITED",ICIC00SMRTH,413597002,"SAMARTH SAHAKARI BANK LTD","2 ANTROLIKAR SHOPPING CENTRE, DATTA CHOWK, SOLAPUR",0,SOLAPUR,SOLAPUR,MAHARASHTRA
"ICICI BANK LIMITED",ICIC00SMNSB,NA,"SANMITRA MAHILA NAGRI SAHAKARI BANK","2ND FLOOR KATYANI RUGNALAYA BALAJI WARD CHANDRAPUR 442401",260693,CHANDRAPUR,CHANDRAPUR,MAHARASHTRA
"ICICI BANK LIMITED",ICIC00SMCUB,500211252,"THE SECUNDERABAD MERCANTILE CO-OP URBAN BANK LTD","1ST FLOOR, 2-4-52, M G ROAD, SECUNDERABAD, HYDERABAD ┬û 500003",0,"SECUNDERABAD CANTONMENT",HYDERABAD,"ANDHRA PRADESH"
"ICICI BANK LIMITED",ICIC00SKSBN,560226258,"SRI KALIDASA SAHAKARA BANK NIYAMITHA","KURUBARA SANGHA BUILDING, 2ND MAIN, 2ND CROSS, GANDHINAGAR, BANGALORE ┬û 560 009",0,BANGALORE,"BANGALORE URBAN",KARNATAKA
"ICICI BANK LIMITED",ICIC00SJDCB,242801000,"SHAHJAHANPUR DISTRICT CENTRAL CO-OPERATIVE BANK LTD.","PRADHAN KARYALA, CIVIL LINES, NEAR KUCHHERY, SHAHJAHANPUR 242001",0,SHAHJAHANPUR,SHAHJAHANPUR,"UTTAR PRADESH"
"ICICI BANK LIMITED",ICIC00SIDUC,431899501,"SIDDHESHWAR URBAN CO-OP BANK MARYADIT SILLOD","PALODKAR BLD MAIN MARKET SILLOD DIST AURANGABAD PIN 431112",9422701935,SILLOD,AURANGABAD,MAHARASHTRA
"ICICI BANK LIMITED",ICIC00SIDRH,272803302,"URBAN COOP BANK LTD, SIDDHARTHANAGAR","BANSI ROAD, PIPRI BAZAR, SIDDHARTHANAGAR, 272001",0,SIDHARTHANAGAR,SIDHARTHANAGAR,"UTTAR PRADESH"
"ICICI BANK LIMITED",ICIC00SHNSB,431816501,"SHIVAJI NAGARI PAITHAN","TALUK PAITHAN 431107 DIST AURANGABAD",7774039451,PAITHAN,AURANGABAD,MAHARASHTRA
"ICICI BANK LIMITED",ICIC00SHIDD,586842000,"SHRI SHIDDHESHWAR COOPERATIVE BANK LTD","S S ROAD BIJAPUR KARNATAKA 586101",9379921234,BIJAPUR,BIJAPUR,KARNATAKA
"ICICI BANK LIMITED",ICIC00SEVUC,NA,"THE SEVALIA URBAN CO. OP BANK LTD","SARDAR PATEL ROAD,  SEVALIA 388245",0,"SEVALIA R.S.",KHEDA,GUJARAT
"ICICI BANK LIMITED",ICIC00SDCCB,NA,"THE SOLAPUR DISTRICT CENTRAL COOPERATIVE BANK LTD","207,8,9 GOLD FINCH PETH SOLAPUR 413007",2172624077,SOLAPUR,SOLAPUR,MAHARASHTRA
"ICICI BANK LIMITED",ICIC00SBUCB,485803001,"SHRI BALAJI URBAN CO-OPERATIVE BANK LTD","1ST FLOOR, GANESH TOWER, JAISTAMBH CHOWK, SATNA ┬û 485001, M.P.",0,SATNA,SATNA,"MADHYA PRADESH"
"ICICI BANK LIMITED",ICIC00SBSBN,587818002,"SHRI BASAVESHWAR SAHAKARI BANK NYT, BAGALKOT","BASAVESHWAR BANK CIRCLE, SECTOR NO. 25, NAVANAGAR, BAGALKOT - 587 103",0,BAGALKOT,BAGALKOTE,KARNATAKA
"ICICI BANK LIMITED",ICIC00SBCUB,673843252,"THE SULTAN┬ÆS BATTERY CO-OPERATIVE URBAN BANK LTD","CRESCENT BUILDING, SULTHAN BATHERY P.O. WAYANAD DISTRICT KERALA ┬û 673592",0,SULTHANBATHERY,WAYANAD,KERALA
"ICICI BANK LIMITED",ICIC00SAMSB,400068256,"SAMATA SAHAKARI BANK LTD","SINGH SADAN KHOTWADI A.S.MARG OFF S V ROAD TPS VI SANTACRUZ W MUMBAI 400 054",9920271068,MUMBAI,"GREATER BOMBAY",MAHARASHTRA
"ICICI BANK LIMITED",ICIC00RUMCO,NA,"THE RAIPUR URBAN MERCHANT CO-OP BANK LTD","RAVI BHAWAN JAISTAMBH CHOWK RAIPUR C.G.-492001",9826177141,RAIPUR,RAIPUR,CHHATTISGARH
"ICICI BANK LIMITED",ICIC00RUCBL,416834376,"RAJAPUR URBAN COOP BANK LTD","NAVALE COMPLEX JAWAHAR CHOWK RAJAPUR DIST.RATNAGIRI 416 702",9822628562,RAJAPUR,RATNAGIRI,MAHARASHTRA
"ICICI BANK LIMITED",ICIC00RCCBL,360473002,"THE RAJKOT COMMERCIAL CO-OPERATIVE BANK LTD","SUVIDHA CHANDULAL BUCH MARG RAJKOT 360001",9428010495,RAJKOT,RAJKOT,GUJARAT
"ICICI BANK LIMITED",ICIC00RBDCB,229804002,"RAE BARELI DISTRICT COOPERATIVE BANK LTD","RAE BARELI COOP BANK BUILDING, IST FLOOR, H.P.O. KAIPERGANJ, GHANTAGHAR, KUTCHERY RD. RAE BARELI - 229 001",0,"RAE BARELI","RAI BARELI","UTTAR PRADESH"
"ICICI BANK LIMITED",ICIC00RANPB,NA,"THE RANDER PEOPLES COOP BANK LTD","BANK BUILDING BOTAWALA MARG UMAD FALIA RANDER SURAT 395005",2762622,SURAT,SURAT,GUJARAT
"ICICI BANK LIMITED",ICIC00RAMPR,244803102,"RAMPUR ZILA SAHAKARI BANK LTD","CIVIL LINES, RAMPUR 244901",0,RAMPUR,RAMPUR,"UTTAR PRADESH"
"ICICI BANK LIMITED",ICIC00PURVA,NA,"PURVANCHAL CO-OPERATIVE BANK LTD. GHAZIPUR","52A1 SHASTRI NAGAR LANKA GHAZIPUR U P PIN CODE 233001",9415555777,GHAZIPUR,GHAZIPUR,"UTTAR PRADESH"
"ICICI BANK LIMITED",ICIC00PURDC,WAITING,"THE PURNIA DISTRICT CENTRAL CO-OPERATIVE BANK LTD","COURT COMPOUND PURNIA SADAR PURNIA - 854301",9431883656,PURNEA,PURNIA,BIHAR
"ICICI BANK LIMITED",ICIC00PRDCB,230810002,"THE DISTRICT COOPERATIVE BANK LTD, PRATAPGARGH","RAJPAL TANKI , PRATAPGARH ,(UP) ┬û 230001",0,PRATAPGARH,PRATAPGARH,"UTTAR PRADESH"
"ICICI BANK LIMITED",ICIC00PRCBL,560226345,"PRAGATHI CO-OPERATIVE BANK LTD","NO. 12/1, PRAGATHI BHAVAN, 1ST MAIN ROAD, MALLESHWARAM, BANGALORE ┬û 560 003",0,BANGALORE,"BANGALORE URBAN",KARNATAKA
"ICICI BANK LIMITED",ICIC00PPCOB,387813501,"THE PIJ PEOPLES COOP BANK LTD","BANK BUILDING  MAIN BAZAR  TA- VASO  DIST ? KHEDA  AT POST PIJ ? 387230",9727853022,VASO,KHEDA,GUJARAT
"ICICI BANK LIMITED",ICIC00PMCBL,413920151,"THE PANDHARPUR  MERCHANTS CO-OP BANK LTD,PANDHARPUR","4075/A/1/39-LAXMI PATH,PANDHARPUR-413304,DIST SOLAPUR,MAHARASHTRA",0,PANDHARPUR,SOLAPUR,MAHARASHTRA
"ICICI BANK LIMITED",ICIC00PDCBL,262801002,"PILIBHIT DISTRICT CO-OPERATIVE BANK LTD","REGIONAL OFIICE NEAR CHATARI CHAURAHA PILIBHIT-2627001",0,PILIBHIT,PILIBHIT,"UTTAR PRADESH"
"ICICI BANK LIMITED",ICIC00PCUBL,509843002,"THE PALAMOOR CO-OPERATIVE URBAN BANK LTD","D. NO. 2-1-7/10A, 1ST FLOOR, WAQF COMPLEX, RAICHUR ROAD, MAHABUBNAGAR ┬û 509 001",0,MAHBUBNAGAR,MAHBUBNAGAR,"ANDHRA PRADESH"
"ICICI BANK LIMITED",ICIC00PCTBL,670866152,"PAYYANUR CO OPERATIVE TOWN BANK LTD.","PAYYANUR CO OPERATIVE TOWN BANK LTD.HOSPITAL ROAD,PAYYANUR PIN-670307",202930,PAYYANNUR,CANNUR,KERALA
"ICICI BANK LIMITED",ICIC00OJSBL,413823601,"OMERGA JANTA SAHAKARI BANK LTD","MAIN ROAD OMERGA TALUKA OMERGA - 413606",2475253373,OSMANABAD,OSMANABAD,MAHARASHTRA
"ICICI BANK LIMITED",ICIC00NVJVN,400082443,"THE NAVJEEVAN COOP BANK LTD","BHAVANI SAW MILL COMPOUND, ULHASNAGAR ┬û 421 003.",0,ULHASNAGAR,THANE,MAHARASHTRA
"ICICI BANK LIMITED",ICIC00NNSBL,NA,"NANDANI SAHAKARI BANK LTD","1224 BAZAR PETH NANDANI TAL.SHIROL DIST.KOLHAPUR",235175,KOLHAPUR,KOLHAPUR,MAHARASHTRA
"ICICI BANK LIMITED",ICIC00NNCBL,380302002,"NARODA NAGRIK COOP BANK LTD","NARODA BANK BHAVAN  GURUKUL-MEMNAGAR ROAD  AHMEDABAD ? 380052",9879791670,MEMNAGAR,AHMADABAD,GUJARAT
"ICICI BANK LIMITED",ICIC00NIDHI,380118306,"NIDHI CO-OP BANK LTD","NIDHI HOUSE, N H ROAD ┬û 8, NR C.T.M., CHAR RASTA, AMRAIWADI, AHMEDABAD ┬û 380026",0,AHMEDABAD,AHMEDABAD,GUJARAT
"ICICI BANK LIMITED",ICIC00NGSBL,NA,"NISHIGANDHA SAHAKARI BANK LTD","SHOPING CENTER,NR-GAJANAN MAHARAJ SANSTHAN,PANDHARPUR-413304,DIST SOLAPUR,MAHARASHTRA",0,PANDHARPUR,SOLAPUR,MAHARASHTRA
"ICICI BANK LIMITED",ICIC00NDCCB,422372026,"THE NASIK DIST CENTRAL COOP BANK L","P NO 284  NDCC BANK MAIN BRANCH  SERVICE ROAD  AGRA ROAD  NEAR DWARKA CIRCLE NASIK ? 422011",0,NASHIK,NASIK,MAHARASHTRA
"ICICI BANK LIMITED",ICIC00MZSBL,281801003,"MATHURA ZILLA SAHAKARI BANK LTD.","DAMPIER NAGAR NEAR BHAGAT SINGH PARK, MATHURA 281001",0,MATHURA,MATHURA,"UTTAR PRADESH"
"ICICI BANK LIMITED",ICIC00MUZAF,251804003,"ZILA SAHKARI BANK LTD","COURT ROAD, MUZAFFARNAGAR 251001",0,MUZAFFARNAGAR,MUZAFFARNAGAR,"UTTAR PRADESH"
"ICICI BANK LIMITED",ICIC00MUPCB,NA,"THE MEHMADABAD URBAN PEOPLES CO-OPERATIVE BANK LTD","BANK ROAD BHAVSARVAD MAHEMDAVAD-387130 DIST.KHEDA GUJARAT",2694244091,KHEDA,KHEDA,GUJARAT
"ICICI BANK LIMITED",ICIC00MUCBL,NA,"MAHESH URBAN COOP BANK LTD","KORE BUILDING TAILAR LANE PARLIVAIJNATH TALUK PARLI VAIJANTH DIST BEED 431515",9850609767,PARLIVAIJNATH,BID,MAHARASHTRA
"ICICI BANK LIMITED",ICIC00MUCBA,413824052,"MAHESH URBAN COP BANK LTD AHMEDPUR","HEAD OFFICE COLLEGE ROAD AHMEDPUR DIST LATUR",7421449691,AHMEDPUR,LATUR,MAHARASHTRA
"ICICI BANK LIMITED",ICIC00MSMNB,485002251,"MAA SHARDA MAHILA NAGRIK BANK","NEAR GHANTA GHAR KAMLA MARKET MAIHAR",233374,MAIHAR,SATNA,"MADHYA PRADESH"
"ICICI BANK LIMITED",ICIC00MSCBL,795808002,"THE MANIPUR STATE CO OP BANK LTD","ASSEMBLY ROAD IMPHAL 795001 MANIPUR",9612138974,IMPHAL,IMPHAL,MANIPUR
"ICICI BANK LIMITED",ICIC00MPCUB,500259252,"MAHARANA PRATAP COOP URBAN BANK LTD","2-3-36/1  22 & 23  6 NO : X ROADS  BAGH AMBERPET  HYDERABAD -500013",0,HYDERABAD,HYDERABAD,"ANDHRA PRADESH"
"ICICI BANK LIMITED",ICIC00MORAD,244803001,"DISTRICT CO-OPERATIVE BANK","NEAR BALAJI MANDIR,COURT ROAD, MORADABAD 244001",0,MORADABAD,MORADABAD,"UTTAR PRADESH"
"ICICI BANK LIMITED",ICIC00MNSBL,431806101,"MARKANDEY NAGARI SAHAKARI BANK LTD","SHASTRI MARKET MAHATMA GANDHI ROAD 431604",2462230233,NANDED,NANDED,MAHARASHTRA
"ICICI BANK LIMITED",ICIC00MMNSB,481563001,"MAHISHMATI NAGRIK SAHAKARI BANK","DR.AMBEDKAR WARD CHILMAN CHOWK MANDLA-481 661",9425164474,MANDALA,MANDLA,"MADHYA PRADESH"
"ICICI BANK LIMITED",ICIC00MMCBL,415812476,"THE MANMANDIR CO-OPERATIVE BANK LTD, VITA","OPP S.T. STAND, VITA ┬û 415311, TALUKA ┬û KHANAPUR, DIST- SANGLI,MAHARASHTRA",0,VITA,SANGLI,MAHARASHTRA
"ICICI BANK LIMITED",ICIC00MIRZA,231802002,"ZILA SAHKARI BANK LTD","PRADHAN KARYALAYA, COLLECTORATE COMPOUND,MIRZAPUR-231001",0,MIRZAPUR,MIRZAPUR,"UTTAR PRADESH"
"ICICI BANK LIMITED",ICIC00MERUT,250802000,"ZILA SAHKARI BANK LTD","WESTERN KUTCHERY ROAD, MEERUT 25001",0,MEERUT,MEERUT,"UTTAR PRADESH"
"ICICI BANK LIMITED",ICIC00MDPPC,415813101,"M.D. PAWAR PEOPLE┬ÆS CO-OPERATIVE BANK LIMITED","H.O. MAHAVEER CHOWK, URUN-ISLAMPUR, 415409 , TALUK ┬û WALWA, DIST ┬û SANGLI",0,ISLAMPUR,SANGLI,MAHARASHTRA
"ICICI BANK LIMITED",ICIC00MDCCB,NA,"THE DISTRICT COOPERATIVE BANK LTD, MAINPURI","COURT ROAD, MAINPURI(U.P) ┬û 285001",0,MAINPURI,MAINPURI,"UTTAR PRADESH"
"ICICI BANK LIMITED",ICIC00MCUBL,NA,"THE MANJERI COOP URBAN BANK LIMITED","MAIN BRANCH COURT ROAD MANJERI MALAPPURAM DISTRICT KERALA - 676121",2766194,MANJERI,MALAPPURAM,KERALA
"ICICI BANK LIMITED",ICIC00MAUCB,WAITING,"MAHESH URBAN CO OPERATIVE BANK LTD","KORE BUILDING TAILOR LANE TQ.PARLI VAIJNATH DIST BEED 431515",2446243118,PARALI,BID,MAHARASHTRA
"ICICI BANK LIMITED",ICIC00MANUC,431832501,"MANWATH URBAN COOP BANK","MAIN ROAD MANWAT DIST -PARBHANI 431505",240598,MANWATH,PARBHANI,MAHARASHTRA
"ICICI BANK LIMITED",ICIC00LUCBL,413811052,"LAXMI URBAN CO OP BANK LTD","KAWA ROAD MARKET YARD LATUR 413512",9766866631,LATUR,LATUR,MAHARASHTRA
"ICICI BANK LIMITED",ICIC00LMNSB,474497001,"LAXMIBAI MAHILA NAGARIK SAHAKARI BANK LTD","MOHAN NIWAS KAMPOO ROAD LASHKAR GWALIOR",7512636620,GWALIOR,GWALIOR,"MADHYA PRADESH"
"ICICI BANK LIMITED",ICIC00LKUCB,WAITING,"LAKHIMPUR URBAN COOP BANK LTD","CP102 RAJNAGAR YOJNA AWAS VIKAS COLONY KHERI ROAD LAKHIMPUR KHERI 262701",0,LAKHIMPUR,"LAKHIMPUR KHERI","UTTAR PRADESH"
"ICICI BANK LIMITED",ICIC00LDCBL,284801000,"THE DISTRICT COOPERATIVE BANK LTD, LALITPUR","NEAR ELITE CHORAHA, JHANSI ROAD, LALITPUR",0,LALITPUR,LALITPUR,"UTTAR PRADESH"
"ICICI BANK LIMITED",ICIC00KZSBL,208185270,"KANPUR ZILLA SAHAKARI BANK LTD","30 D ,O ,BLOCK ALOO MANDI ,KIDWAI NAGAR ,KANPUR-208011",0,KANPUR,"KANPUR CITY","UTTAR PRADESH"
"ICICI BANK LIMITED",ICIC00KUTCB,400068355,"KUTCH COOPERATIVE BANK LTD","SHEETAL 1ST FLOOR NEAR DIAMOND TALKIES L.T.ROAD BORIVLI W MUMBAI 400092",7666366363,MUMBAI,"GREATER BOMBAY",MAHARASHTRA
"ICICI BANK LIMITED",ICIC00KURLA,400077002,"THE KURLA NAGARIK SAHAKARI BANK LTD","210 S G BARVE MARG ,KURLA HIGH SCHOOL NEAR KURLA STATION KURLA [W]  MUMBAI 400070",0,MUMBAI,MUMBAI,MAHARASHTRA
"ICICI BANK LIMITED",ICIC00KPCBL,387810000,"THE KHEDA PEOPLE'S CO.OP. BANK LTD","PANIWALI SHERI, CHOKSI BAZAAR, KHEDA ┬û 387411",0,KHEDA,KHEDA,GUJARAT
"ICICI BANK LIMITED",ICIC00KNUCB,413806052,"KEDARNATH URBAN CO OP BANK LTD","AMBAJOGAI ROAD LATUR -413512",0,LATUR,LATUR,MAHARASHTRA
"ICICI BANK LIMITED",ICIC00KNSBL,WAITING,"KHALILABAD NAGAR SAHAKARI BANK LIMITED","GOLA BAZAR, KHALILABAD,SHANT KABIR NAGAR, UTTAR PRADESH.272175.",554722656,KHALILABAD,"SANT KABIR NAGAR","UTTAR PRADESH"
"ICICI BANK LIMITED",ICIC00KHIRI,262810202,"DIST. COOP BANK LTD, LAKHIMPUR KHIRI","CIVIL LINES, LAKHIMPUR KHIRI 262701",0,"LAKHIMPUR KHERI","LAKHIMPUR KHERI","UTTAR PRADESH"
"ICICI BANK LIMITED",ICIC00KDUCB,WAITING,"KODOLI URBAN COOPERATIVE BANK","HO BRANCH KODAOLI AT POST KODOLI TAL PANHALA DIST KOLHAPUR",224046,PANHALA,KOLHAPUR,MAHARASHTRA
"ICICI BANK LIMITED",ICIC00KDCBL,NA,"KHARDAH COOPERATIVE BANK LIMITED","KHARDAH BRANCH NO.74 BY 24 BY 1 PK BISWAS ROAD KHARDAH KOLKATA 700117",25637506,KHARDAH,"NORTH TWENTY FOUR PARGANAS","WEST BENGAL"
"ICICI BANK LIMITED",ICIC00KAIRA,387801001,"THE KAIRA DISTRICT CENTRAL CO OP BANK LTD","KDCC BANK BHAVAN, SARDAR PATEL ROAD, NADIAD. PIN- 387001 DIST: KHEDA GUJARAT",0,NADIAD,KHEDA,GUJARAT
"ICICI BANK LIMITED",ICIC00JUSBL,NA,"JAYSINGPUR UDGAON SAHAKARI BANK LTD","10TH LANE, SANGLI ┬û KOLHAPUR ROAD, OPP POLICE STATION, JAYSINGPUR ┬û 416101, TAL ┬û SHIROL, DIST ┬û KOLHAPUR",0,SHIROL,KOLHAPUR,MAHARASHTRA
"ICICI BANK LIMITED",ICIC00JUCOB,NA,"JANTA URBAN CO-OP BANK","2408 B SONGIRWADI WAI-412803",8275059951,SATARA,SATARA,MAHARASHTRA
"ICICI BANK LIMITED",ICIC00JUCBL,NA,"JANSEWA URBAN CO-OP BANK LTD","1ST FLOOR MADHAVLEELA COMPLEX MASKASATH SQUARE ITWARI NAGPUR - 440002",9850301876,NAGPUR,NAGPUR,MAHARASHTRA
"ICICI BANK LIMITED",ICIC00JSBLA,416406002,"JANTA SAHAKARI BANK LTD, AJARA","MAIN ROAD, AJRA, DIST ┬û KOLHAPUR (MAHARASHTRA) ┬û 416505",0,AJRA,KOLHAPUR,MAHARASHTRA
"ICICI BANK LIMITED",ICIC00JPNSB,NA,"JAIPRAKASH NARAYAN NAGRI SAHAKARI BANK","HPHVJHOWK,PBHNOD,BMHNGDHNGOL",222905,HINGOLI,HINGOLI,MAHARASHTRA
"ICICI BANK LIMITED",ICIC00JDCCB,425835001,"THE JALGAON DISTRICT CENTRAL CO-OPERATIVE BANK LTD","HEAD OFFICE : 27, RING ROAD, JALGAON ┬û 425001",0,JALGAON,JALGAON,MAHARASHTRA
"ICICI BANK LIMITED",ICIC00JDCBL,285817000,"JALAUN DISTRICT CO-OPERATIVE BANK LTD","JALAUN STATION RAOD ORAI ┬û 285001",0,JALAUN,JALAUN,"UTTAR PRADESH"
"ICICI BANK LIMITED",ICIC00JCBLG,389805002,"THE JANATA CO.OP. BANK LTD.GODHRA","NAWA BAZAR, GODHRA-3890001",0,GODHRA,"PANCH MAHALS",GUJARAT
"ICICI BANK LIMITED",ICIC00IUCBL,NA,"INDAPUR URBAN CO OP BANK LTD","LTURE MARKET COMMITTEE CAMPUS PUNE SOLAPUR ROAD INDAPUR 413106 DIST PUNE",9822600404,INDAPUR,PUNE,MAHARASHTRA
"ICICI BANK LIMITED",ICIC00INPRS,452279002,"INDORE PARASPAR SAHAKARI BANK LIMITED","SAHAKAR SADAN, 221, TILAK PATH, INDORE 452 007",0,INDORE,INDORE,"MADHYA PRADESH"
"ICICI BANK LIMITED",ICIC00INDPR,WAITING,"INDAPUR URBAN CO OP BANK LTD INDAPUR","APMC INDAPUR TALI NDAPUR DIST PUNE-413106",9822600404,INDAPUR,PUNE,MAHARASHTRA
"ICICI BANK LIMITED",ICIC00IMSBL,WAITING,"INDIRA MAHILA SAHKARI BANK LTD","MALEGAON MAMLEDAR GALLI A BY P AND TAL MALEGAON 423203",233019,MALEGAON,NASIK,MAHARASHTRA
"ICICI BANK LIMITED",ICIC00HSBLW,NA,"HUTATMA SAHAKARI BANK LTD WALWA","B TYPE KARKHANA ROAD A P WALWA TAL WALWA DIST SANGLI",2312656136,WALWA,SANGLI,MAHARASHTRA
"ICICI BANK LIMITED",ICIC00HHSBL,412804002,"HARIHARESHWAR SAHAKARI BANK LTD, WAI","989, HARIHARESHWAR PLAZA, BRAMHANSHAHI, WAI ┬û 412803 , DIST ┬û SATARA",0,WAI,SATARA,MAHARASHTRA
