BANK,IFSC,MICR,BRANCH,ADDRESS,CONTACT,CITY,DISTRICT,STATE
"YES BANK",YESB0ZSBL99,NA,"ZILA SAHKARI BANK LUCKNOW H O","26, JAGDISH BUILDING, HAZRATGANJ, LUCKNOW - 226001",8756400240,LUCKNOW,LUCKNOW,"UTTAR PRADESH"
"YES BANK",YESB0ZSBL23,226185257,"ZILA SAHKARI BANK LUCKNOW CHANDRNGR","H NO 551 KA/180 KHA,ST BANK RD, BHILLAWAN,CHANDARNAGAR,ALAMBAGH,LUCKNOW-226005",8756400238,LUCKNOW,LUCKNOW,"UTTAR PRADESH"
"YES BANK",YESB0ZSBL22,226185252,"ZILA SAHKARI BANK LUCKNOW ARJUNGANJ","AHMAMAU, ARJUNGANJ, LUCKNOW - 226002",8756400239,ARJUNGANJ,LUCKNOW,"UTTAR PRADESH"
"YES BANK",YESB0ZSBL21,226185258,"ZILA SAHKARI BANK LUCKNOW PARAGDARY","JOPPLING ROAD, LUCKNOW - 226001",8756400237,LUCKNOW,LUCKNOW,"UTTAR PRADESH"
"YES BANK",YESB0ZSBL20,226185254,"ZILA SAHKARI BANK LUCKNOW ICCMRT EC","21/467, INDIRA NAGAR, LUCKNOW - 226016",8756400236,LUCKNOW,LUCKNOW,"UTTAR PRADESH"
"YES BANK",YESB0ZSBL19,NA,"ZILA SAHKARI BANK LUCKNOW ITAUNJA","ITAUNJA BAZAAR, LUCKOW - 226203",8756400234,ITAUNJA,LUCKNOW,"UTTAR PRADESH"
"YES BANK",YESB0ZSBL18,NA,"ZILA SAHKARI BANK LUCKNOW GOSAIGANJ","NAGAR PANCHAYAT GOSAINGANJ, NEAR VIKAS KHAND OFFICE, LUCKNOW - 226501",8756400226,GOSAINGANJ,LUCKNOW,"UTTAR PRADESH"
"YES BANK",YESB0ZSBL17,NA,"ZILA SAHKARI BANK LUCKNOW BKT","AIRFORCE ROAD, BKT, LUCKNOW - 226201",8756400233,BAKSHI-KA-TALAB,LUCKNOW,"UTTAR PRADESH"
"YES BANK",YESB0ZSBL16,NA,"ZILA SAHKARI BANK LUCKNOW MALIHABAD","TEHSEEL ROAD, MALIHABAD, LUCKNOW - 226102",8756400231,MALIHABAD,LUCKNOW,"UTTAR PRADESH"
"YES BANK",YESB0ZSBL15,NA,"ZILA SAHKARI BANK LUCKNOW KAKORI","BARGAD TALL, KAKORI, LUCKNOW - 226101",8756400230,KAKORI,LUCKNOW,"UTTAR PRADESH"
"YES BANK",YESB0ZSBL14,NA,"ZILA SAHKARI BANK LUCKNOW MOHNLAL G","NEAR KASHISHWAR INTER COLLEGE, RAEBARELI ROAD, LUCKNOW - 227305",8756400228,MOHANLALGANJ,LUCKNOW,"UTTAR PRADESH"
"YES BANK",YESB0ZSBL13,NA,"ZILA SAHKARI BANK LUCKNOW BANTHARA","VILL AND POST BANTHARA, LUCKNOW - 227101",8756400229,BANTHRA,LUCKNOW,"UTTAR PRADESH"
"YES BANK",YESB0ZSBL12,NA,"ZILA SAHKARI BANK LUCKNOW NAGRAM","NAGAR PANCHAYAT, NAGRAM, LUCKNOW - 226303",8756400227,NAGRAM,LUCKNOW,"UTTAR PRADESH"
"YES BANK",YESB0ZSBL11,NA,"ZILA SAHKARI BANK LUCKNOW MALLBRNCH","POST OFFICE MALL, LUCKNOW - 226104",8756400232,LUCKNOW,LUCKNOW,"UTTAR PRADESH"
"YES BANK",YESB0ZSBL10,NA,"ZILA SAHKARI BANK LUCKNOW SGPGI","VILL AND POST, KALLI PASCHIM, RAEBARELI ROAD, LUCKNOW - 226014",8756400235,"KALLI PACHIM",LUCKNOW,"UTTAR PRADESH"
"YES BANK",YESB0ZSBL09,226185260,"ZILA SAHKARI BANK LUCKNOW VIKAS NGR","VIKAS NAGAR, LUCKNOW - 226022",8756400222,LUCKNOW,LUCKNOW,"UTTAR PRADESH"
"YES BANK",YESB0ZSBL08,226185254,"ZILA SAHKARI BANK LUCKNOW CHINHAT","A-1529, INDIRA NAGAR, LUCKNOW - 226016",8756400225,LUCKNOW,LUCKNOW,"UTTAR PRADESH"
"YES BANK",YESB0ZSBL07,226185256,"ZILA SAHKARI BANK LUCKNOW LATOUCHE","ISHWARI DAYAL COMPLEX, LATOUCHE ROAD, LUCKNOW - 226018",8756400219,LUCKNOW,LUCKNOW,"UTTAR PRADESH"
"YES BANK",YESB0ZSBL06,226185257,"ZILA SAHKARI BANK LUCKNOW KANPUR RD","B-1-61/D, LDA COLONY, KANPUR ROAD, LUCKNOW - 226012",8756400220,LUCKNOW,LUCKNOW,"UTTAR PRADESH"
"YES BANK",YESB0ZSBL05,226185259,"ZILA SAHKARI BANK LUCKNOW SADATGANJ","348/35 A, TULSIDAS MARG, BULAKI ADDA, LUCKNOW - 226004",8756400221,LUCKNOW,LUCKNOW,"UTTAR PRADESH"
"YES BANK",YESB0ZSBL04,226185258,"ZILA SAHKARI BANK LUCKNOW NISHATGNJ","PREM BAZAR, NISHATGANJ, LUCKNOW - 226007",8756400218,LUCKNOW,LUCKNOW,"UTTAR PRADESH"
"YES BANK",YESB0ZSBL03,226185255,"ZILA SAHKARI BANK LUCKNOW GOMTI NGR","2/218, VIVEK KHAND, GOMTI NAGAR, LUCKNOW - 226010",8756400224,LUCKNOW,LUCKNOW,"UTTAR PRADESH"
"YES BANK",YESB0ZSBL02,226185253,"ZILA SAHKARI BANK LUCKNOW ALIGANJ","D-21 A, SEC H, ALIGANJ, LUCKNOW - 226024",8756400223,LUCKNOW,LUCKNOW,"UTTAR PRADESH"
"YES BANK",YESB0ZSBL01,226185252,"ZILA SAHKARI BANK LUCKNOW MAIN BR","26 JAGDISH BUILDING, HAZRATGANJ, LUCKNOW - 226001",8756400217,LUCKNOW,LUCKNOW,"UTTAR PRADESH"
"YES BANK",YESB0YUCB35,NA,"THE YAVATMAL UCB HINGANGHAT","SHARMA BUILDING, OLD POST OFFICE ROAD, NEHARU WARD, KARANJA CHOWK, HINGANGHAT - 442 301",245546,HINGANGHAT,WARDHA,MAHARASHTRA
"YES BANK",YESB0YUCB34,NA,"THE YAVATMAL UCB AHMEDNAGAR","KUKREJA COMPLEX, PREMDAN CHOWK, BESIDE BIG BAZAR, SAWDI ROAD, AHMEDNAGAR - 414 001",2427112,AHMADNAGAR,AHMADNAGAR,MAHARASHTRA
"YES BANK",YESB0YUCB33,NA,"THE YAVATMAL UCB KOTHURD PUNE","KUMBARE HIGHTS,VIJAY COMMERCIAL COMPLEX,RAJLAXMI HALL BUILDING, NEW DP ROAD, KOTHRUD, PUNE-411 038",25382160,PUNE,PUNE,MAHARASHTRA
"YES BANK",YESB0YUCB32,NA,"THE YAVATMAL UCB JALNA","SH AV BAGDIA,ASHA ARCADE,GR FLOOR,CTS 4010,DURGAMATA MANDIR RD,NR MISSION HOSPITAL,JALNA-431 203",241184,JALNA,JALNA,MAHARASHTRA
"YES BANK",YESB0YUCB31,NA,"THE YAVATMAL UCB AURANGABAD","MG CHIKHALIKAR,CTS 15308/15,PLOT 68,SARANG COOP SOCIETY,GM MANDIR CHOWK,GARKHEDA,AURANGABAD-431 001",2330006,AURANGABAD,AURANGABAD,MAHARASHTRA
"YES BANK",YESB0YUCB30,NA,"THE YAVATMAL UCB WASHIM","BAKLIWAL TOWERS, OPP. STATE BANK OF INDIA, AKOLANAKA ROAD, WASHIM - 444 505",231227,WASHIM,WASHIM,MAHARASHTRA
"YES BANK",YESB0YUCB29,NA,"THE YAVATMAL UCB GONDIA","NEAR HALWAI HOTEL ASSOCIATION, SHREE TALKIES ROAD, GONDIA - 441 601",230850,GONDIYA,GONDIA,MAHARASHTRA
"YES BANK",YESB0YUCB28,NA,"THE YAVATMAL UCB NANDED","KALA'S BUILDING, OPP. PALEKAR PETROL PUMP, V.I.P. ROAD, VISAVA NAGAR, NANDED - 431 601",256047,NANDED,NANDED,MAHARASHTRA
"YES BANK",YESB0YUCB27,NA,"THE YAVATMAL UCB BAIDYANATH CHOWK","JEJANI COMPLEX, OPP. P.N.B. M.I.C.R. CLEARING CENTRE, GREAT NAG ROAD, NAGPUR - 440 001",2773575,NAGPUR,NAGPUR,MAHARASHTRA
"YES BANK",YESB0YUCB26,NA,"THE YAVATMAL UCB WARDHAMAN NAGAR","JOSHI COPMPLEX, PLOT NO. 3, EAST PRISENT, WARDHAMAN NAGAR, NAGPUR - 440 024",2680184,NAGPUR,NAGPUR,MAHARASHTRA
"YES BANK",YESB0YUCB25,NA,"THE YAVATMAL UCB GANDHIBAG","1ST FLOOR, KAMDAR COMPLEX, PLOT NO. 73, SEWA SADAN SQUARE, C A ROAD, NAGPUR - 440 001",2728184,NAGPUR,NAGPUR,MAHARASHTRA
"YES BANK",YESB0YUCB24,NA,"THE YAVATMAL UCB HEAD OFFICE","HEAD OFFICE BLDG DATTA CHOWK YAVATMAL 445 001",243703,YAVATMAL,YAVATMAL,MAHARASHTRA
"YES BANK",YESB0YUCB23,NA,"THE YAVATMAL UCB AKOLA","ALSHI COMPLEX GANDHI CHOWK AKOLA-444001",2426278,AKOLA,AKOLA,MAHARASHTRA
"YES BANK",YESB0YUCB22,NA,"THE YAVATMAL UCB NAGPUR","DEVNAGAR SQUARE KHAMLA ROAD NAGPUR -440015",2242320,NAGPUR,NAGPUR,MAHARASHTRA
"YES BANK",YESB0YUCB21,440800002,"THE YAVATMAL UCB BHADRAWATI","GANDHI CHOWK BHADRAWATI 442902",265633,BHADRAVATI,CHANDRAPUR,MAHARASHTRA
"YES BANK",YESB0YUCB20,NA,"THE YAVATMAL UCB GADCHANDUR","ACHANAK CHOWK GADCHANDUR TQ KORPANA CHANDRAPUR - 442908",246680,GADCHANDUR,CHANDRAPUR,MAHARASHTRA
"YES BANK",YESB0YUCB19,NA,"THE YAVATMAL UCB AMRAVATI","BHONDU COMPLEX OPP POLICE STATION RAJAPETH AMARAVATI-444604",2578520,AMRAVATI,AMRAVATI,MAHARASHTRA
"YES BANK",YESB0YUCB18,NA,"THE YAVATMAL UCB CHANDRAPUR","NAGAR PARISHAD BUILDING GANDHI CHOWK CHANDRAPUR 442402",254361,CHANDRAPUR,CHANDRAPUR,MAHARASHTRA
"YES BANK",YESB0YUCB17,NA,"THE YAVATMAL UCB WADGAON YAVATMAL","ARNI NAKA WADGAON ROAD YAVATMAL - 445001",245930,"WADGAON ROAD",YAVATMAL,MAHARASHTRA
"YES BANK",YESB0YUCB16,NA,"THE YAVATMAL UCB BABHULGAON","INDIRA CHOWK BABHULGAON-445101",270518,BABHULGAON,YAVATMAL,MAHARASHTRA
"YES BANK",YESB0YUCB15,NA,"THE YAVATMAL UCB VEER SAWARKAR MARG","VEER SAWARKAR MARG MAIN LINE YAVATMAL 445001",246804,YAVATMAL,YAVATMAL,MAHARASHTRA
"YES BANK",YESB0YUCB14,NA,"THE YAVATMAL UCB PUSAD","KAMAN CHOWK NEAR MENDHYA MAROTI PUSAD - 445204",245300,PUSAD,YAVATMAL,MAHARASHTRA
"YES BANK",YESB0YUCB13,NA,"THE YAVATMAL UCB KALAMB","CHINTAMANI MANDIR ROAD KALAMB - 445401",226519,KALAMB,YAVATMAL,MAHARASHTRA
"YES BANK",YESB0YUCB12,NA,"THE YAVATMAL UCB RALEGAON","MAIN ROAD RALEGAON - 445402",225123,RELEGAON,YAVATMAL,MAHARASHTRA
"YES BANK",YESB0YUCB11,NA,"THE YAVATMAL UCB DARWHA","VANDEMATARAM COMPLEX NEAR NAGAR PARISHAD DARWHA-445202",224336,DARWHA,YAVATMAL,MAHARASHTRA
"YES BANK",YESB0YUCB10,NA,"THE YAVATMAL UCB PANDHARKAWADA","MAIN ROAD PANDHARKAWADA - 445302",227190,PANDHARKAODA,YAVATMAL,MAHARASHTRA
"YES BANK",YESB0YUCB09,NA,"THE YAVATMAL UCB DHANKI","BUS STATION ROAD DHANKI TQ UMARKHED 445207",241111,DHANKI,YAVATMAL,MAHARASHTRA
"YES BANK",YESB0YUCB08,NA,"THE YAVATMAL UCB GHATANJI","NEAR SBI YAVATMAL ROAD GHATANJI - 445301",277163,GHATANJI,YAVATMAL,MAHARASHTRA
"YES BANK",YESB0YUCB07,NA,"THE YAVATMAL UCB NER","OPP. POLICE STATION NER - 455102",267102,NERPARSOPANT,YAVATMAL,MAHARASHTRA
"YES BANK",YESB0YUCB06,NA,"THE YAVATMAL UCB DIGRAS","POLICE STATION ROAD DIGRAS - 445203",222328,DIGRAS,YAVATMAL,MAHARASHTRA
"YES BANK",YESB0YUCB05,NA,"THE YAVATMAL UCB UMARKHED","PATTEWAR COMPLEX OPP BUS STATION UMARKHED - 445206",237081,UMARKHED,YAVATMAL,MAHARASHTRA
"YES BANK",YESB0YUCB04,NA,"THE YAVATMAL UCB WANI","BANK OF MAHA CHOWK HYDERABAD ROAD WANI - 445304",225156,WANI,YAVATMAL,MAHARASHTRA
"YES BANK",YESB0YUCB03,NA,"THE YAVATMAL UCB ARNI","NEAR BUS STAND ARNI -445103",266677,ARNI,YAVATMAL,MAHARASHTRA
"YES BANK",YESB0YUCB02,NA,"THE YAVATMAL UCB PATANBORI","NEAR BUS STATION PATANBORI TQ KELAPUR - 445305",237840,PATANBORI,YAVATMAL,MAHARASHTRA
"YES BANK",YESB0YUCB01,NA,"THE YAVATMAL UCB MAIN","DATTA CHOWK INFRONT OF DAWA BAZAR YAVATMAL- 445001",245183,YAVATMAL,YAVATMAL,MAHARASHTRA
"YES BANK",YESB0YLNS05,NA,"YLNS COOP URBAN BANK MOTHKUR","H NO 3-39/2-3 MOTHKUR NALGONDA 508277",9885118380,MOTHKUR,NALGONDA,TELANGANA
"YES BANK",YESB0YLNS04,NA,"YLNS COOP URBAN BANK THIRUMALAGIRI","H NO 7-172-3 SURYAPET ROAD THIRUMALAGIRI 508202",9885118380,THIRUMALAGIRI,NALGONDA,TELANGANA
"YES BANK",YESB0YLNS03,NA,"YADAGIRI LNS COOP BANK YADGIRIGUTTA","5-184/2-C, NEAR GHAT ROAD, YADGIRIGUTTA 508115",9885118380,YADAGIRIGUTTA,NALGONDA,"ANDHRA PRADESH"
"YES BANK",YESB0YLNS02,NA,"YADAGIRI LNS COOP URBN BANK ALAIR","14-121, NEAR APSRTC BUS STAND, ALAIR, NALGONDA - 508101",9885258046,ALER,NALGONDA,"ANDHRA PRADESH"
"YES BANK",YESB0YLNS01,NA,"YADAGIRI LNS COOP URBN BANK BHONGIR","1-6-451/6, STATION ROAD, BHONGIR, NALGONDA - 508116",9885118380,BHONGIR,NALGONDA,"ANDHRA PRADESH"
"YES BANK",YESB0YDC095,WAITING,"YAVATMAL DCC BANK GAUL","C/O DIGAMBAR CHAVAN AT GAUL YAVATMAL 445215",9421853085,PUSAD,YAVATMAL,MAHARASHTRA
"YES BANK",YESB0YDC094,WAITING,"YAVATMAL DCC BANK KAMATHWADA","C/O GVK KAMATHWADA PO KAMATHWADA YAVATMAL 445201",9970842143,DARWHA,YAVATMAL,MAHARASHTRA
"YES BANK",YESB0YDC093,WAITING,"YAVATMAL DCC BANK CHIKHALI","C/O GRAM PANCHAYAT AT CHIKHALI YAVATMAL 445230",7770032014,"CHIKHLI BHANDEGAON",YAVATMAL,MAHARASHTRA
"YES BANK",YESB0YDC092,WAITING,"YAVATMAL DCC BANK DARWHA CITY","C/O AS RATHOD AT PO DARWHA YAVATMAL 445202",8421528909,DARWHA,YAVATMAL,MAHARASHTRA
"YES BANK",YESB0YDC091,WAITING,"YAVATMAL DCC BANK NAVARGAON","C/O NAVARGAON.V.K. YAVATMAL 445303",7768832901,YAVATMAL,YAVATMAL,MAHARASHTRA
"YES BANK",YESB0YDC090,NA,"YAVATMAL DCC BANK KARANJI","AT PO KARANJI NEAR POLICE STATION YAVATMAL 445302",7757912276,PANDHARKAODA,YAVATMAL,MAHARASHTRA
"YES BANK",YESB0YDC089,NA,"YAVATMAL DCC BANK CITY RALEGAON","GVK SOC RALEGAON RALEGAON YAVATMAL 445402",7588042552,RELEGAON,YAVATMAL,MAHARASHTRA
"YES BANK",YESB0YDC088,NA,"YAVATMAL DCC BANK AKPURI","SHRI Y P GAYAKWAD AKPURI YAVATMAL 445301",9423435765,YAVATMAL,YAVATMAL,MAHARASHTRA
"YES BANK",YESB0YDC087,NA,"YAVATMAL DCC BANK CITY BRANCH ARNI","SWAMI SAMARTH VYAPARI SANKUL ARNI.YAVATMAL 445103",7588042589,ARNI,YAVATMAL,MAHARASHTRA
"YES BANK",YESB0YDC086,NA,"YAVATMAL DCC BANK KOLHI","KOLHI BABHULGAON YAVATMAL 445 101",7588042629,YAVATMAL,YAVATMAL,MAHARASHTRA
"YES BANK",YESB0YDC085,NA,"YAVATMAL DCC BANK GHATI GHATANJI","GHATI GHATANJI YAVATMAL 445301",9421851909,GHATANJI,YAVATMAL,MAHARASHTRA
"YES BANK",YESB0YDC084,NA,"YAVATMAL DCC BANK ZARI JAMNI","GAMBHIR B RAO BHALERAO ZARI JAMNI YAVATMAL 445305",8888931138,YAVATMAL,YAVATMAL,MAHARASHTRA
"YES BANK",YESB0YDC083,NA,"THE YAVATMAL DCC BANK KAKADDATI","SHRIRAMPUR PUSAD-445204",7588042637,PUSAD,YAVATMAL,MAHARASHTRA
"YES BANK",YESB0YDC082,NA,"THE YAVATMAL DCC BANK PIMPALGAONKNH","PIMPALGAON KANHA,TH:MAHAGAON P.S.-445204",7588042685,MAHAGAON,YAVATMAL,MAHARASHTRA
"YES BANK",YESB0YDC081,NA,"THE YAVATMAL DCC BANK PUSAD CITY","NAGAR VACHANALAYA,PUSAD-445204",7588042605,PUSAD,YAVATMAL,MAHARASHTRA
"YES BANK",YESB0YDC080,NA,"THE YAVATMAL DCC BANK CHATARI","CHATARI,TH:UMARKHED-445305",7588042646,UMERKHED,YAVATMAL,MAHARASHTRA
"YES BANK",YESB0YDC079,NA,"THE YAVATMAL DCC BANK FULSAWANGI","FULSAWANGI,TH:MAHAGAON P.S.-445230",7588042604,FULSAWANGI,YAVATMAL,MAHARASHTRA
"YES BANK",YESB0YDC078,NA,"THE YAVATMAL DCC BANK BELORA","BELORA,TH:PUSAD-445105",7588042644,PUSAD,YAVATMAL,MAHARASHTRA
"YES BANK",YESB0YDC077,NA,"THE YAVATMAL DCC BANK SHEMBALPIMPRI","SHEMBALPIMPRI,TH:PUSAD-445209",7588042683,SHEMBAL-PIMPRI,YAVATMAL,MAHARASHTRA
"YES BANK",YESB0YDC076,NA,"THE YAVATMAL DCC BANK SAKARA UM","SKARA(UM),TH:UMARKHED-445206",7588042648,UMARKHED,YAVATMAL,MAHARASHTRA
"YES BANK",YESB0YDC075,NA,"THE YAVATMAL DCC BANK MULAWA","MULAWA,TH:UMARKHED-445211",7588042684,MULAWA,YAVATMAL,MAHARASHTRA
"YES BANK",YESB0YDC074,NA,"THE YAVATMAL DCC BANK HIWARA","HIWAR,TH:MAHAGAON P.S.-445204",7588042607,MAHAGAON,YAVATMAL,MAHARASHTRA
"YES BANK",YESB0YDC073,NA,"THE YAVATMAL DCC BANK POPHALI","POPHALI,TH:UMARKHED-445213",7588042652,UMARKHED,YAVATMAL,MAHARASHTRA
"YES BANK",YESB0YDC072,NA,"THE YAVATMAL DCC BANK KALI DOU","KALI DOU,TH:MAHAGAON P.S.-445204",7588042685,MAHAGAON,YAVATMAL,MAHARASHTRA
"YES BANK",YESB0YDC071,NA,"THE YAVATMAL DCC BANK JAMB BAZAR","JAMB BAZAR,TH:PUSAD-445204",7588042638,PUSAD,YAVATMAL,MAHARASHTRA
"YES BANK",YESB0YDC070,NA,"THE YAVATMAL DCC BANK DHANKI","DHANKI,TH:UMARKHED-445206",7588042649,DHANKI,YAVATMAL,MAHARASHTRA
"YES BANK",YESB0YDC069,NA,"THE YAVATMAL DCC BANK MAHAGAON PS","MAHAGAON P.S.-445205",7588042606,MAHAGAON,YAVATMAL,MAHARASHTRA
"YES BANK",YESB0YDC068,NA,"THE YAVATMAL DCC BANK UMARKHED",UMARKHED-445206,7588042649,UMARKHED,YAVATMAL,MAHARASHTRA
"YES BANK",YESB0YDC067,NA,"THE YAVATMAL DCC BANK PUSAD","SHIWAJI WARD PUSAD-445204",7588042635,PUSAD,YAVATMAL,MAHARASHTRA
"YES BANK",YESB0YDC066,NA,"THE YAVATMAL DCC BANK TALNI","TALANI,TH:ARNI-445109",7588042603,ARNI,YAVATMAL,MAHARASHTRA
"YES BANK",YESB0YDC065,NA,"THE YAVATMAL DCC BANK SAWALI SA","SAWALI(SA),TH:ARNI-445106",7588042591,ARNI,YAVATMAL,MAHARASHTRA
"YES BANK",YESB0YDC064,NA,"THE YAVATMAL DCC BANK LONBEHEL","LONBEHAL,TH:ARNI-445103",7588042589,LONBEHEL,YAVATMAL,MAHARASHTRA
"YES BANK",YESB0YDC063,NA,"THE YAVATMAL DCC BANK MALKHED KHU","MALKHED,TH:NER-445102",7588042595,YAVATMAL,YAVATMAL,MAHARASHTRA
"YES BANK",YESB0YDC062,NA,"THE YAVATMAL DCC BANK DIGRAS CITY","NEAR GHANTI BABA MANDIR,DIGRAS-445203",7588042582,DIGRAS,YAVATMAL,MAHARASHTRA
"YES BANK",YESB0YDC061,NA,"THE YAVATMAL DCC BANK VASANT NAGAR","VASANT NAGAR,TH:DIGRAS-445203",7588042581,DIGRAS,YAVATMAL,MAHARASHTRA
"YES BANK",YESB0YDC060,NA,"THE YAVATMAL DCC BANK CH BHANDEGAON","CHIKHALI BHANDEGAON,TH:DARWHA-445202",7588042693,"CHIKHLI (BHANDEGAON)",YAVATMAL,MAHARASHTRA
"YES BANK",YESB0YDC059,NA,"THE YAVATMAL DCC BANK SIRASGAON PA","SHIRASGAON(PA),TH:NER-445102",7588042594,SIRASGAON(PANDHARI),YAVATMAL,MAHARASHTRA
"YES BANK",YESB0YDC058,NA,"THE YAVATMAL DCC BANK JAWALA","JAWALA,TH:ARNI-445105",7588042587,ARNI,YAVATMAL,MAHARASHTRA
"YES BANK",YESB0YDC057,NA,"THE YAVATMAL DCC BANK MANGLADEVI","MANGLADEVI,TH:NER-445102",7588042601,MANGALADEVI,YAVATMAL,MAHARASHTRA
"YES BANK",YESB0YDC056,NA,"THE YAVATMAL DCC BANK KALGAON","KALGAON,TH:DIGRAS-445203",7588042579,KALGAON,YAVATMAL,MAHARASHTRA
"YES BANK",YESB0YDC055,NA,"THE YAVATMAL DCC BANK MAHAGAONKSABA","MAHAGAON (KASABA),TH:DARWHA-445110",7588042694,MAHAGAON,YAVATMAL,MAHARASHTRA
"YES BANK",YESB0YDC054,NA,"THE YAVATMAL DCC BANK LOHI","LOHI,TH:DARWHA-445210",7588042576,LOHI,YAVATMAL,MAHARASHTRA
"YES BANK",YESB0YDC053,NA,"THE YAVATMAL DCC BANK BORI ARAB","BORI ARAB,TH;DARWHA-445201",7588042695,"BORI ARAB",YAVATMAL,MAHARASHTRA
"YES BANK",YESB0YDC052,NA,"THE YAVATMAL DCC BANK NER","NEAR BUS STAND NER-445102",7588042590,YAVATMAL,YAVATMAL,MAHARASHTRA
"YES BANK",YESB0YDC051,NA,"THE YAVATMAL DCC BANK ARNI","SHIWAJI NAGARA ARNI-445103",7588042632,ARNI,YAVATMAL,MAHARASHTRA
"YES BANK",YESB0YDC050,NA,"THE YAVATMAL DCC BANK DIGRAS","NEAR TAISIL OFFICE,DIGRAS-445203",7588042547,DIGRAS,YAVATMAL,MAHARASHTRA
"YES BANK",YESB0YDC049,NA,"THE YAVATMAL DCC BANK DARWHA","NEAR SBI DARWHA-445202",7588042573,DARWHA,YAVATMAL,MAHARASHTRA
"YES BANK",YESB0YDC048,NA,"THE YAVATMAL DCC BANK PATAN","PATAN,TH:ZARI-445305",7588042668,PATAN,YAVATMAL,MAHARASHTRA
"YES BANK",YESB0YDC047,NA,"THE YAVATMAL DCC BANK RASA","RASA,TH:WANI-445304",7588042659,WANI,YAVATMAL,MAHARASHTRA
"YES BANK",YESB0YDC046,NA,"THE YAVATMAL DCC BANK SHINDOLA","SHINDOLA,TH:WANI-445307",7588042610,SHINDOLA,YAVATMAL,MAHARASHTRA
"YES BANK",YESB0YDC045,NA,"THE YAVATMAL DCC BANK WANI CITY","NEAR BUS STAND WANI-445302",7588042671,WANI,YAVATMAL,MAHARASHTRA
"YES BANK",YESB0YDC044,NA,"THE YAVATMAL DCC BANK KAYAR","KAYAR,TH:WANI-445304",7588042679,WANI,YAVATMAL,MAHARASHTRA
"YES BANK",YESB0YDC043,NA,"THE YAVATMAL DCC BANK PUNWAT","PUNWAT,TH:WANI-445304",7588042661,WANI,YAVATMAL,MAHARASHTRA
"YES BANK",YESB0YDC042,NA,"THE YAVATMAL DCC BANK KUMBHA","KUMBHA,TH:MAREGAON-445303",7588042690,MAREGAON,YAVATMAL,MAHARASHTRA
"YES BANK",YESB0YDC041,NA,"THE YAVATMAL DCC BANK SHIBLA",SHIBLATH:ZARI-445302,7588042670,MUKUTBAN,YAVATMAL,MAHARASHTRA
"YES BANK",YESB0YDC040,NA,"THE YAVATMAL DCC BANK SHIRPUR","SHIRPUR,TH.WANI-445304",7588042682,WANI,YAVATMAL,MAHARASHTRA
"YES BANK",YESB0YDC039,NA,"THE YAVATMAL DCC BANK MARDI","MARDI,TH:MAREGAON-445303",7588042658,MAREGAON,YAVATMAL,MAHARASHTRA
"YES BANK",YESB0YDC038,NA,"THE YAVATMAL DCC BANK GHONSA","GHONSA,TH:WANI-445304",7588042663,WANI,YAVATMAL,MAHARASHTRA
"YES BANK",YESB0YDC037,NA,"THE YAVATMAL DCC BANK KURAI","KURAI,TH:WANI-445307",7588042609,WANI,YAVATMAL,MAHARASHTRA
"YES BANK",YESB0YDC036,NA,"THE YAVATMAL DCC BANK MUKTUBAN","MUKUTBAN,TH:ZARI-445319",7588042672,MUKUTBAN,YAVATMAL,MAHARASHTRA
"YES BANK",YESB0YDC035,NA,"THE YAVATMAL DCC BANK MAREGAON",MAREGAON-445303,7588042665,MAREGAON,YAVATMAL,MAHARASHTRA
"YES BANK",YESB0YDC034,NA,"THE YAVATMAL DCC BANK WANI","NEAR BUS STAND WANI-445302",7588042656,WANI,YAVATMAL,MAHARASHTRA
"YES BANK",YESB0YDC033,NA,"THE YAVATMAL DCC BANK KURLI","KURLI,TH:RALEGAON-4454306",7588042563,RELEGAON,YAVATMAL,MAHARASHTRA
"YES BANK",YESB0YDC032,NA,"THE YAVATMAL DCC BANK PANDHARKAWADA","MAIN ROAD PANDHARKAWADA-445302",7588042550,PANDHARKAWADA,YAVATMAL,MAHARASHTRA
"YES BANK",YESB0YDC031,NA,"THE YAVATMAL DCC BANK SHIROLI","SHIROLI,TH:GHATANJI-445301",7588042565,GHATANJI,YAVATMAL,MAHARASHTRA
"YES BANK",YESB0YDC030,NA,"THE YAVATMAL DCC BANK PARDI NASKARI","PARDI NASKARI,TH:GHATANJI-445109",7588042571,GHATANJI,YAVATMAL,MAHARASHTRA
"YES BANK",YESB0YDC029,NA,"THE YAVATMAL DCC BANK WADHONA BAZAR","WADONA BAZAR,TH:RALEGAON-445402",7588042559,RALEGAON,YAVATMAL,MAHARASHTRA
"YES BANK",YESB0YDC028,NA,"THE YAVATMAL DCC BANK ZADGAON","ZADGAON,TH:RALEGAON-445402",7588042654,RALEGAON,YAVATMAL,MAHARASHTRA
"YES BANK",YESB0YDC027,NA,"THE YAVATMAL DCC BANK KHAIRI","KHAIRI,TH:RALEGAON-445308",7588042569,RALEGAON,YAVATMAL,MAHARASHTRA
"YES BANK",YESB0YDC026,NA,"THE YAVATMAL DCC BANK AARLI","AARLI,TH:PANDHARKAWADA-445305",7588042567,PANDHARKAODA,YAVATMAL,MAHARASHTRA
"YES BANK",YESB0YDC025,NA,"THE YAVATMAL DCC BANK SAKHARA KHURD","SAKHAR KHURD,TH:GHATANJI-445301",7588042650,GHATANJI,YAVATMAL,MAHARASHTRA
"YES BANK",YESB0YDC024,NA,"THE YAVATMAL DCC BANK MOHADA","MOHADA,TH:PANDHARKAWADA-445323",7588042570,PANDHARKAODA,YAVATMAL,MAHARASHTRA
"YES BANK",YESB0YDC023,NA,"THE YAVATMAL DCC BANK SAYKHEDA","SAYKHEDA,TH:PANDHARKAWADA-445302",7588042558,PANDHARKAODA,YAVATMAL,MAHARASHTRA
"YES BANK",YESB0YDC022,NA,"THE YAVATMAL DCC BANK PAYAN BORI","PATAN BORI,TH:PANDHARKAWADA-445305",7588042568,PANDHARKAODA,YAVATMAL,MAHARASHTRA
"YES BANK",YESB0YDC021,NA,"THE YAVATMAL DCC BANK PARAWA","PARWA,TH:GHATANJI-445204",7588042674,GHATANJI,YAVATMAL,MAHARASHTRA
"YES BANK",YESB0YDC020,NA,"THE YAVATMAL DCC BANK WADKI","WADKI,TH:RALEGAON-445308",7588042561,RELEGAON,YAVATMAL,MAHARASHTRA
"YES BANK",YESB0YDC019,NA,"THE YAVATMAL DCC BANK RALEGAON",RALEGAON-445402,7588042551,RELEGAON,YAVATMAL,MAHARASHTRA
"YES BANK",YESB0YDC018,NA,"THE YAVATMAL DCC BANK GHATANJI",GHATANJI-445301,7588042555,GHATANJI,YAVATMAL,MAHARASHTRA
"YES BANK",YESB0YDC017,NA,"THE YAVATMAL DCC BANK PANDHARKAWADA","NEAR SBI PANDHARKAWADA-445302",7588042691,PANDHARKAODA,YAVATMAL,MAHARASHTRA
"YES BANK",YESB0YDC016,NA,"THE YAVATMAL DCC BANK COTTON MARKET","COTTON MARKET ,YAVATMAL-445001",7588042622,YAVATMAL,YAVATMAL,MAHARASHTRA
"YES BANK",YESB0YDC015,NA,"THE YAVATMAL DCC BANK BAJORIYANAGAR","BAJORIYA NAGAR,YAVATAMAL-445001",7588042620,YAVATMAL,YAVATMAL,MAHARASHTRA
"YES BANK",YESB0YDC014,NA,"THE YAVATMAL DCC BANK OM COLONY","WADGAON,YAVATMAL-445001",7588042583,YAVATMAL,YAVATMAL,MAHARASHTRA
"YES BANK",YESB0YDC013,NA,"THE YAVATMAL DCC BANK MAIN ROAD YTM","MAIN ROAD YAVATMAL-445001",7588042618,YAVATMAL,YAVATMAL,MAHARASHTRA
"YES BANK",YESB0YDC012,NA,"THE YAVATMAL DCC BANK DATTA CHOWK","VIRWAMANRO CHOWK , YAVATMAL-445001",7588042675,YAVATMAL,YAVATMAL,MAHARASHTRA
"YES BANK",YESB0YDC011,NA,"THE YAVATMAL DCC BANK SAWAR","SAWAR,TH:BABHULGAON-445001",7588042624,BABHULGAON,YAVATMAL,MAHARASHTRA
"YES BANK",YESB0YDC010,NA,"THE YAVATMAL DCC BANK PIMPALGAON RU",PIMPALGAON(RU)-TH:KALAMB-445001,7588042681,KALAMB,YAVATMAL,MAHARASHTRA
"YES BANK",YESB0YDC009,NA,"THE YAVATMAL DCC BANK JODMOHA","JODMOHA,TH:KALAMB-445001",7588042677,KALAMB,YAVATMAL,MAHARASHTRA
"YES BANK",YESB0YDC008,NA,"THE YAVATMAL DCC BANK PAHUR","BHAMBRAJA,YAVATMAL-445105",7588042619,YAVATMAL,YAVATMAL,MAHARASHTRA
"YES BANK",YESB0YDC007,NA,"THE YAVATMAL DCC BANK PAHUR","PAHUR,BABHULGAON-445101",7588042612,BABHULGAON,YAVATMAL,MAHARASHTRA
"YES BANK",YESB0YDC006,NA,"THE YAVATMAL DCC BANK AKOLA BAZAR","AKOLA BAZAR,YAVATMAL-445109",7588042623,YAVATMAL,YAVATMAL,MAHARASHTRA
"YES BANK",YESB0YDC005,NA,"THE YAVATMAL DCC BANK GHARPHAL","GHARFAL,BABHULGAON-445101",7588042628,BABHULGAON,YAVATMAL,MAHARASHTRA
"YES BANK",YESB0YDC004,NA,"THE YAVATMAL DCC BANK KALAMB",KALAMB-445401,7588042615,KALAMB,YAVATMAL,MAHARASHTRA
"YES BANK",YESB0YDC003,NA,"THE YAVATMAL DCC BANK BABHULGAON","NEAR TAISIL OFFICE,BABHULGAON-445101",7588042625,BABHULGAON,YAVATMAL,MAHARASHTRA
"YES BANK",YESB0YDC002,NA,"THE YAVATMAL DCC BANK RO","NEAR CITY POLICE STATION,YAVATMAL-445001",7588042614,YAVATMAL,YAVATMAL,MAHARASHTRA
"YES BANK",YESB0YDC001,440344000,"THE YAVATMAL DCC BANK HO","NEAR CITY POLICE STATION YAVATMAL-445001",7588042532,YAVATMAL,YAVATMAL,MAHARASHTRA
"YES BANK",YESB0WUCB07,506836006,"WARANGAL URBAN COOP BANK NGO COL","NGO COLONY WARANGAL 506001",├╜2575501,WARANGAL,WARANGAL,TELANGANA
"YES BANK",YESB0WUCB05,506836005,"WARANGAL URBAN COOP BANK KASHIBUGGA","11 15 107,CITY ROAD,KASHIBUGGA 506002",2423387,WARANGAL,WARANGAL,"ANDHRA PRADESH"
"YES BANK",YESB0WUCB04,NA,"WARANGAL URBAN COOP BANK PARKAL","# 6-318, 319, MAIN ROAD, PARKAL-506164",240104,PARKAL,WARANGAL,"ANDHRA PRADESH"
"YES BANK",YESB0WUCB03,NA,"WARANGAL URBAN COOP BANK NAIMNAGAR","# 5-11-469, GOPALPUR 'X' ROAD, NAIM NAGAR, HANMKONDA - 506009",2455419,WARANGAL,WARANGAL,"ANDHRA PRADESH"
"YES BANK",YESB0WUCB02,NA,"WARANGAL URBAN COOP BANK HANAMKONDA","OPP:GOVT. JUNIOR COLLEGE, HANAMKONDA - 506001",2455028,WARANGAL,WARANGAL,"ANDHRA PRADESH"
"YES BANK",YESB0WUCB01,NA,"WARANGAL URBAN COOP BANK HO","#8/1059, RNT ROAD WARANGAL - 506002",2423387,WARANGAL,WARANGAL,"ANDHRA PRADESH"
"YES BANK",YESB0WNSB14,NA,"WARDHA NAGRI BANK SINDHI","DR.WAZURKAR NIWAS, MAIN ROAD,SINDHI-442105",266258,SINDHI,WARDHA,MAHARASHTRA
"YES BANK",YESB0WNSB13,NA,"WARDHA NAGRI BANK SELOO","DESHPANDE BUILDING, MAINRAOD,SELOO-442104",220343,SELOO,WARDHA,MAHARASHTRA
"YES BANK",YESB0WNSB12,NA,"WARDHA NAGRI BANK KARANJA GHADGE","HADE COMPLEX, MAINRAOD, KARANJA (G)-442203",245691,KARANJA(GADGE),WARDHA,MAHARASHTRA
"YES BANK",YESB0WNSB11,NA,"WARDHA NAGRI BANK ARVI","KARMARKAR BUILDING,TAHASIL ROAD, ARVI-442201",222095,ARVI,WARDHA,MAHARASHTRA
"YES BANK",YESB0WNSB10,NA,"WARDHA NAGRI BANK PULGAON","NIWAL BUILDING,GANDHI CHOWK, PULGAON-442302",282096,PULGAON,WARDHA,MAHARASHTRA
"YES BANK",YESB0WNSB09,NA,"WARDHA NAGRI BANK DEOLI","VAIDYA BUILDING, MAIN ROAD,DEOLI-442101",254547,DEOLI,WARDHA,MAHARASHTRA
"YES BANK",YESB0WNSB08,442803152,"WARDHA NAGRI BANK MAIN BRANCH","ADV.BHANDAKKAR BUILDING DESH SEWA ROAD,HINGANGHAT-442301",244165,HINGANGHAT,WARDHA,MAHARASHTRA
"YES BANK",YESB0WNSB07,4428036,"WARDHA NAGRI BANK SERVICE BRANCH","KACCHHI LINE,HOSPITAL ROAD,WARDHA-442001",243635,WARDHA,WARDHA,MAHARASHTRA
"YES BANK",YESB0WNSB06,4428035,"WARDHA NAGRI BANK BORGOAN MEGHE","THAKRE BUILDING,NEAR MSEB OFFICE,BORGOAN-442001",242372,WARDHA,WARDHA,MAHARASHTRA
"YES BANK",YESB0WNSB05,4428034,"WARDHA NAGRI BANK SEWAGRAM","SARVODAYA SEWA SANGH BUILDING,MAIN ROAD,SEWAGRAM-442102",284186,SEWAGRAM,WARDHA,MAHARASHTRA
"YES BANK",YESB0WNSB04,4428033,"WARDHA NAGRI BANK SHIVAJI CHOWK","SHIVAJI CHOWK,NAGPUR ROAD,WARDHA-442001",243566,WARDHA,WARDHA,MAHARASHTRA
"YES BANK",YESB0WNSB03,4428032,"WARDHA NAGRI BANK GANDHI NAGAR","TADAS BUILDING GANDHINAGAR,ARVI ROAD,WARDHA-442001",247066,WARDHA,WARDHA,MAHARASHTRA
"YES BANK",YESB0WNSB02,4428031,"WARDHA NAGRI BANK KUMARAPPA MARG","MADHAV BHAWAN,DHANTOLI,WARDHA-442001",243464,WARDHA,WARDHA,MAHARASHTRA
"YES BANK",YESB0WNSB01,NA,"WARDHA NAGRI BANK HEAD OFFICE","MADHAV BHAWAN,DEVI ASHTABHUJA MANDIR,CHOWK,DHANTOLI,WARDHA-442001",9960560552,WARDHA,WARDHA,MAHARASHTRA
"YES BANK",YESB0WANA07,442889505,"WANA NAGRI SAHKARI BANK WADNER","NEAR N.H. 07 WADNER TEH HINGANGHAT WARDHA 442307",9890059900,WADNER,WARDHA,MAHARASHTRA
"YES BANK",YESB0WANA06,442889504,"WANA NAGARIK SAHAKARI BANK LTD - ALLIPUR","SADANAND WARD,FRONT OF PRIMARY HELTH CENTRE ALLIPUR TAH.HINGANGHAT DIST.WARDHA",9657887687,ALLIPUR,WARDHA,MAHARASHTRA
"YES BANK",YESB0WANA05,442889503,"WANA NAGRI SAHKARI BANK KANGAON","BAZAR CHOWK TEH HINGANGHT WARDHA 442101",9730664026,KANGAON,WARDHA,MAHARASHTRA
"YES BANK",YESB0WANA04,442889502,"WANA NAGRI SAHKARI BANK SINDI RLY","M GANDHI CHOWK SARAFA LINE SELOO WARDHA 442105",8928673311,SELOO,WARDHA,MAHARASHTRA
"YES BANK",YESB0WANA03,442889002,"WANA NAGRI SAHKARI BANK WARDHA","MALGUJARI PURA WARDHA 442001",242169,WARDHA,WARDHA,MAHARASHTRA
